2017_SI6DHcfJswd2scMVb10MrA,0.59714854,0.038241714,0.02506885,0.10265085,0.013710082,0.022903323,0.08017805,0.011492193,0.085911304,0.024931997,101,2017_SI6DHcfJswd2scMVb10MrA_0.jpg,40.737638,-73.929838,a truck driving down a street next to buildings;a couple of cars driving down a city street;a couple of cars driving down a street;a couple of cars driving down a street next to buildings;a truck driving down a street next to a building
2017_JEppPltzEz6Dhcp_vmJxIA,0.6804046,0.03937757,0.03277296,0.04976046,0.009470612,0.01711142,0.09242687,0.013236761,0.04202342,0.017074108,101,2017_JEppPltzEz6Dhcp_vmJxIA_0.jpg,40.697638,-73.849838,a car parked on the side of the road;a car parked on the side of a street;a car parked on the side of the street;a car parked on the side of a road near a house;a car parked on the side of a road near a building
2017_8GuchwNBOCcuG6phd2l-6Q,0.62728274,0.0501664,0.038892984,0.08473915,0.016488373,0.02537179,0.07335928,0.014602631,0.080397666,0.024416238,101,2017_8GuchwNBOCcuG6phd2l-6Q_0.jpg,40.757638,-73.919838,a long line of cars driving down a street;a long line of cars driving down a road;a long line of cars driving down a city street;a view of a street from the middle of the day;a view of a street from the middle of a street
2017_r3tzQzDPTHqGeasuZUAKxQ,0.6814333,0.048980713,0.05173087,0.050207198,0.012681216,0.019219369,0.076942205,0.015832871,0.04770729,0.017166495,101,2017_r3tzQzDPTHqGeasuZUAKxQ_0.jpg,40.757638,-73.979838,a red car driving down a street next to tall buildings;a red car driving down a city street;a red car driving down a street next to buildings;a red car driving down a street past tall buildings;a red car driving down a street next to a tall building
2017_BJZgOKJVUlhaLOOQVV3-iw,0.6288494,0.039118946,0.029111505,0.075099766,0.011707366,0.020270348,0.08040622,0.010798603,0.065093845,0.02032718,101,2017_BJZgOKJVUlhaLOOQVV3-iw_0.jpg,40.717638,-73.959838,a view of a city street from across the street;a view of a city street from the street;a view of a city street from the sidewalk;a view of a city street from the UNK;a view of a street from the side of a road
2017_ez1nxXQ6IH6wwz19hkqPiw,0.6694366,0.042008758,0.029549241,0.06390256,0.011384904,0.021204144,0.08204326,0.012406886,0.05383718,0.01802966,101,2017_ez1nxXQ6IH6wwz19hkqPiw_0.jpg,40.747638,-73.819838,a street with cars parked on the side;a street with cars parked on the side of the road;a group of cars driving down a city street;a street with cars parked on the side of it;a group of cars driving down a street next to buildings
2017_jskDvqzGkPKOBFtdn_BxKg,0.6841947,0.050848365,0.047613442,0.05080542,0.013116986,0.020206034,0.07774863,0.01605615,0.047425866,0.017149568,101,2017_jskDvqzGkPKOBFtdn_BxKg_0.jpg,40.717638,-73.939838,a street with cars parked on the side of the road;a street filled with lots of traffic next to tall buildings;a street with cars parked on the side of the street;a street with cars parked along the side of it;a street with cars parked along the side of the road
2017_ILHFvG6NdgVWCs8ZKASRjQ,0.6848727,0.04061854,0.037398934,0.043753028,0.009584367,0.016483366,0.09395632,0.014019907,0.03931582,0.016447634,101,2017_ILHFvG6NdgVWCs8ZKASRjQ_0.jpg,40.737638,-73.919838,a group of cars parked on the side of a street;a group of cars parked on the side of a road;a group of cars parked on the side of the road;a car parked on the side of a street;a long line of cars parked on the side of a road
2017_WBujIORBW0xluMt92KHV-Q,0.6869652,0.04160911,0.036261737,0.046111345,0.010015368,0.016987652,0.089332014,0.013960749,0.04210031,0.01658243,101,2017_WBujIORBW0xluMt92KHV-Q_0.jpg,40.777638,-74.029838,a car parked on the side of the road;several cars parked on the side of a road;a car driving down a street next to a building;a car parked on the side of a road;a car parked on the side of a road next to a building
2017_MxqXwmgV5eKchFIRFZV4dQ,0.3560412,0.025041133,0.022639662,0.20653972,0.010952443,0.020845383,0.2233054,0.009625942,0.07301146,0.045548648,301,2017_MxqXwmgV5eKchFIRFZV4dQ_0.jpg,40.797638,-73.959838,a dirt road is shown with trees and grass;a dirt road is shown with trees on each side;a paved road leading to a park area;a dirt road is shown with trees on both sides;a dirt road is shown with trees and grass on it
2017_rub1Ad8E3kaTZvb1B1W2Dg,0.6372351,0.046407193,0.030192524,0.07958922,0.014462382,0.025378585,0.0811536,0.013480276,0.06940073,0.02130267,101,2017_rub1Ad8E3kaTZvb1B1W2Dg_0.jpg,40.707638,-73.909838,a long road with a few cars parked on it;a long road with a red car driving down the road;a long road with a few cars parked on the side of it;a view of a street from the side of a road;a long road with a few cars parked on the side
2017_B_ognaCvBJyCOwK8zL4GzA,0.5393037,0.03936702,0.019497633,0.13417369,0.015888274,0.029251277,0.0973618,0.011991024,0.105849355,0.030490905,101,2017_B_ognaCvBJyCOwK8zL4GzA_0.jpg,40.717638,-73.889838,a street with a few cars driving down it;a street with a few cars parked on the side of it;a street with a few cars parked on the side of the road;a street with houses on both sides of it;a street with a few cars parked on the side
2017_p8nMmvxAd1TShT-qslv-Xw,0.6865424,0.051075995,0.05345437,0.043760538,0.012537092,0.018269688,0.0837422,0.017616808,0.0438326,0.017440915,101,2017_p8nMmvxAd1TShT-qslv-Xw_0.jpg,40.767638,-73.819838,a group of cars parked on a city street;a group of cars parked on the side of a road;a group of cars parked on the side of the road;a group of cars parked along a city street;a group of cars parked on the side of a street
2017_Uo_SVBXoe7mi20HPpwAhbg,0.6575212,0.05636111,0.057828784,0.059943527,0.015598655,0.021642119,0.07260606,0.017206818,0.057962626,0.020316362,101,2017_Uo_SVBXoe7mi20HPpwAhbg_0.jpg,40.787638,-73.979838,a group of cars parked on the side of a road;a group of cars parked on the side of a street;a group of cars parked on the side of the road;a group of cars parked on the side of the street;a group of cars parked on the street
2017_mEAyJE_zUbYexVprSzRaRw,0.65822524,0.043827713,0.03289339,0.06689143,0.012135774,0.021703035,0.07750657,0.013019741,0.05452925,0.018587172,101,2017_mEAyJE_zUbYexVprSzRaRw_0.jpg,40.747638,-74.059838,a couple of cars parked on the side of a road;a car parked on the side of the road;a couple of cars parked on the side of a street;a car parked on the side of a street;a car parked on the side of the street
2017_OJ7ILH_zcGURYIQS6Z6brw,0.65959746,0.056428403,0.06614545,0.053827703,0.015328258,0.021046042,0.0733259,0.017790616,0.052837938,0.019801289,101,2017_OJ7ILH_zcGURYIQS6Z6brw_0.jpg,40.717638,-73.999838,a blue car driving down a street next to tall buildings;a blue car driving down a street past tall buildings;a blue car driving down a city street;a blue car driving down a street next to buildings;a blue car driving down a street past buildings
2017_colXbVIVtaKwirD8jYmxuA,0.4994062,0.040672272,0.019328564,0.16290477,0.018540233,0.033157557,0.10008538,0.012885153,0.13144559,0.036459118,101,2017_colXbVIVtaKwirD8jYmxuA_0.jpg,40.707638,-73.819838,a long road with cars parked on the side;a long road lined with parked cars on the side;a long road with cars parked on the side of it;a long road with cars parked along side of it;a long road with cars parked on the side of the road
2017_h8EOBhugbpxGBwE-zunJ5g,0.62325954,0.0457038,0.04366541,0.06850228,0.012498915,0.0184668,0.08179143,0.012869805,0.064285666,0.021410286,101,2017_h8EOBhugbpxGBwE-zunJ5g_0.jpg,40.707638,-73.899838,a city street filled with lots of traffic;a group of cars driving down a city street;a group of cars driving down a street;a group of cars driving down a street next to tall buildings;a city street filled with lots of traffic and tall buildings
2017_jiwF3HYWe-0tshsF8vQikQ,0.6478708,0.049720556,0.049614847,0.06073755,0.013375312,0.020143658,0.07427353,0.014481545,0.054970413,0.018989056,101,2017_jiwF3HYWe-0tshsF8vQikQ_0.jpg,40.737638,-73.859838,a street with cars and buildings in the background;a street with cars parked on the side of the road;a street with cars parked on the side of it;a city street with a large building in the background;a street with cars parked on the side of the street
2017_a_-lnd-KBl2UYMH3WIJzVQ,0.67937386,0.050455183,0.054318726,0.050178856,0.012696445,0.019124836,0.07764578,0.015989244,0.047080934,0.017303526,101,2017_a_-lnd-KBl2UYMH3WIJzVQ_0.jpg,40.787638,-73.949838,a group of cars driving down a city street;a group of cars parked on the side of the road;a group of cars driving down a street next to tall buildings;a group of cars driving down a street;a group of cars parked on the side of a road
2017_aUzpL_Oq54eEKgyXqF1Mzg,0.6828614,0.038736045,0.0367018,0.042947114,0.008952558,0.015689045,0.10093409,0.013351232,0.03844613,0.016634166,101,2017_aUzpL_Oq54eEKgyXqF1Mzg_0.jpg,40.757638,-74.049838,a car parked on the side of a street;a car parked on the side of the street;a car parked on the side of the road;a car parked on the side of a road;a car parked on the side of a street near houses
2017_dZ0nsMAaFgffTjM_exRTpw,0.68881625,0.04346323,0.03865093,0.04797381,0.010603279,0.01774761,0.08673081,0.014602244,0.042913854,0.016982883,101,2017_dZ0nsMAaFgffTjM_exRTpw_0.jpg,40.807638,-74.009838,a car driving down a street next to houses;a car driving down a street past houses;a car driving down a road next to houses;a car driving down a street next to a house;a car parked on the side of a road near houses
2017_jwShPrD9s2s5VOZO25IclA,0.6610832,0.034597486,0.03442934,0.046640605,0.008269817,0.014592081,0.11293447,0.011459619,0.04019311,0.016962439,101,2017_jwShPrD9s2s5VOZO25IclA_0.jpg,40.747638,-73.979838,a view of a city street from the sidewalk;a city street with a building and a street;a view of a city street with a building behind it;a view of a city street with a snow covered sidewalk;a view of a city street with a snow covered street
2017_twlxt476RQWBWkYFySogxw,0.50321734,0.04551062,0.023504823,0.15370163,0.020122558,0.03482613,0.09644702,0.013967633,0.15033329,0.038084567,101,2017_twlxt476RQWBWkYFySogxw_0.jpg,40.717638,-73.819838,a view of a street from the side of the road;a view of a street from the street;a view of a street from the side of a street;a street with cars parked on the side of the road;a view of a street from the side of a road
2017_b0Hgv831LjJbagbEml7-Pw,0.66758627,0.0444538,0.041116,0.06325728,0.012820989,0.019945592,0.07158679,0.013915598,0.055603236,0.018147916,101,2017_b0Hgv831LjJbagbEml7-Pw_0.jpg,40.737638,-73.989838,a white truck driving down a city street;a truck driving down a street next to tall buildings;the back of a truck driving down a street;a white truck driving down a street next to tall buildings;the back of a truck driving down a city street
2017_fqJwd9K9mu1g6f-WLMb8zw,0.5895062,0.045943588,0.02622804,0.112076014,0.018289924,0.030454248,0.08320999,0.014841914,0.101451546,0.02925235,101,2017_fqJwd9K9mu1g6f-WLMb8zw_0.jpg,40.767638,-73.869838,a couple of cars driving down a street;a couple of cars that are parked on a street;a couple of cars parked on the side of a road;several cars are parked on the side of the road;a couple of cars parked on the side of a street
2017_-9Su6579C6s1rx-Pp5Ai3Q,0.6581032,0.062252104,0.09120792,0.05225271,0.017544419,0.021911353,0.081171185,0.021527737,0.052425325,0.022219956,101,2017_-9Su6579C6s1rx-Pp5Ai3Q_0.jpg,40.797638,-73.939838,a city street filled with traffic surrounded by tall buildings;a city street filled with traffic next to tall buildings;a city street filled with traffic next to buildings;a city street with cars and buildings on it;a city street with cars and buildings on each side
2017_slWA5kJuKRhWEm-9rBPxrA,0.68385327,0.037308156,0.033345222,0.04699281,0.009005308,0.016302735,0.09667009,0.013045013,0.039604485,0.016630292,101,2017_slWA5kJuKRhWEm-9rBPxrA_0.jpg,40.797638,-74.019838,a car parked on the side of the road;a car parked on the side of a street;a car parked on the side of a road;a car parked on the side of a road near a house;a street with cars parked on the side and a building
2017_FUFQTUJHTtdmhFWICbImog,0.6359294,0.039942503,0.0265207,0.08149558,0.012537211,0.022447228,0.08057997,0.012078673,0.06333873,0.020766705,101,2017_FUFQTUJHTtdmhFWICbImog_0.jpg,40.787638,-73.839838,a truck parked in front of a building;a truck parked in front of a brown building;a truck parked in a parking lot next to a building;a truck parked in front of a large brown building;a truck parked in a parking lot next to a tall building
2017_-5bZYRBcj4JBzD23KHCn-Q,0.6732396,0.048910677,0.04982993,0.049556673,0.012150764,0.019100845,0.07858795,0.015066236,0.047923148,0.01730597,101,2017_-5bZYRBcj4JBzD23KHCn-Q_0.jpg,40.717638,-73.979838,a group of cars driving down a street;a group of cars driving down a road;a group of cars driving down a street next to tall buildings;several cars parked on the side of the road;several cars parked on the side of a road
2017_dxs34ptBdpTGDHCH33JdLQ,0.6692872,0.04734677,0.043145984,0.055475593,0.012309819,0.020091861,0.074691445,0.014339,0.04921648,0.016896516,101,2017_dxs34ptBdpTGDHCH33JdLQ_0.jpg,40.727638,-73.849838,a blue truck parked in front of a building;a blue and white truck parked in front of a building;a view of a city street from the street;a blue truck parked in front of a tall building;a blue and white truck parked in front of buildings
2017_ckHPZweaEoBhZW13rqHRBg,0.47387424,0.024714679,0.030373782,0.09127256,0.008966357,0.014012367,0.27555153,0.009201914,0.04841253,0.030008644,502,2017_ckHPZweaEoBhZW13rqHRBg_0.jpg,40.767638,-73.979838,a grassy field with a fence and trees;a park filled with green grass and trees;a grassy area with a fence and trees;a park filled with green grass and a fence;a grassy field with trees and a fence
2017_CVETIfPQV95pWQ_qnKs63w,0.6486335,0.063993335,0.107527554,0.05306068,0.019433409,0.022465378,0.08501005,0.023561597,0.053318888,0.024388254,101,2017_CVETIfPQV95pWQ_qnKs63w_0.jpg,40.757638,-73.989838,a city street with cars and buildings on it;a busy city street in a city with tall buildings;a busy city street with cars and people crossing the street;a city street with cars and people walking on it;a city street with cars and people walking on the sidewalk
2017_rPDrm4jo-WSDQPVHQ4p2Xw,0.39824617,0.09014976,0.044804424,0.239476,0.04760617,0.086436,0.11191535,0.034163803,0.2749722,0.07692239,301,2017_rPDrm4jo-WSDQPVHQ4p2Xw_0.jpg,40.757638,-73.959838,a highway filled with lots of traffic and traffic;a highway filled with lots of traffic under a bridge;a highway filled with lots of traffic on it;a highway filled with lots of traffic next to a train track;a highway filled with lots of traffic near a train
2017_joxqW1Y7vq6gsXWvajVk3w,0.61523104,0.0386371,0.0231753,0.10109696,0.013687342,0.024160266,0.08568013,0.011760026,0.08006382,0.02382961,101,2017_joxqW1Y7vq6gsXWvajVk3w_0.jpg,40.797638,-74.059838,a couple of cars driving down a street;a car driving down a street next to a tree;a car driving down a road next to houses;a car driving down a road next to a tree;a couple of cars driving down a street next to houses
2017_B2YtyGFR3wgENkxgHoNtKw,0.3398258,0.029974163,0.019637823,0.25083673,0.014643937,0.027486175,0.16809309,0.010205627,0.131818,0.046848506,301,2017_B2YtyGFR3wgENkxgHoNtKw_0.jpg,40.707638,-74.059838,a view of a road from a vehicle;a view of a street from a vehicle;a view of a road from a car window;a long road with a street light and a street light;an empty highway with a street light and a blue sky
2017_vg4AfZ3zYOj3es26XJOoVg,0.5973551,0.029770464,0.018255174,0.09658852,0.009651125,0.019578397,0.09851247,0.009121776,0.06254488,0.0215002,101,2017_vg4AfZ3zYOj3es26XJOoVg_0.jpg,40.777638,-73.819838,a street with a few houses in the background;a street with a few houses on the side;a view of a residential area with houses and houses;a street with a few houses on the side of it;a street with a few houses on the side of the road
2017_2OSnw1PVCsXqoQ4C4Kpx_g,0.6864646,0.042174667,0.03605494,0.04867053,0.010165185,0.01752758,0.08901596,0.014037162,0.042200536,0.016854882,101,2017_2OSnw1PVCsXqoQ4C4Kpx_g_0.jpg,40.747638,-73.899838,a group of cars driving down a street;a group of cars driving down a street next to buildings;a group of cars driving down a city street;a group of cars parked on a city street;a group of cars parked on the side of a road
2017_HqfLr0zGxTKP9TlK3Ph0nw,0.6475971,0.06396508,0.106453836,0.052371114,0.019321054,0.022384107,0.08667639,0.023456544,0.05303964,0.024273247,101,2017_HqfLr0zGxTKP9TlK3Ph0nw_0.jpg,40.757638,-73.969838,a group of people walking down a city street;a group of people walking across a street near tall buildings;a group of people walking down a street next to tall buildings;a group of people standing on the side of a road;a group of people walking across a street next to tall buildings
2017_BK9Bdp1EwSlnNHLijda-_Q,0.632096,0.049699903,0.03968677,0.083764255,0.015835404,0.025169522,0.073872834,0.01479885,0.080518514,0.024176449,101,2017_BK9Bdp1EwSlnNHLijda-_Q_0.jpg,40.767638,-73.949838,a yellow school bus driving down a city street;a yellow school bus driving down a street;a yellow school bus driving down the road;a yellow school bus driving down a street next to tall buildings;a yellow school bus driving down a road
2017_GP0tu6xBtl6SF9PDo7wzJQ,0.42642087,0.06424528,0.037869543,0.19907174,0.0283359,0.05051765,0.10473654,0.019963533,0.22333351,0.055176616,504,2017_GP0tu6xBtl6SF9PDo7wzJQ_0.jpg,40.737638,-74.059838,an empty street with a sky background;an empty street with no cars on it;an empty street with no cars driving down it;a long road with a long line of houses on each side;a long road with a long line of trees
2017_BMe7EnMa5RI2Tnss8yaHkg,0.59314936,0.027374387,0.015512615,0.097946376,0.008604646,0.018226266,0.111682594,0.008173227,0.06657967,0.021784872,101,2017_BMe7EnMa5RI2Tnss8yaHkg_0.jpg,40.747638,-73.909838,a long road with houses on each side;a car driving down a street next to houses;a long road with houses on both sides of it;a long road with houses on both sides of the road;a long road with houses on both sides of the street
2017_tT7M2BqLtLdxbRIRXsO3qg,0.642402,0.058301985,0.07319978,0.06396595,0.016331702,0.021255493,0.07521626,0.018142909,0.06330943,0.023502588,101,2017_tT7M2BqLtLdxbRIRXsO3qg_0.jpg,40.777638,-73.979838,a bus driving down a street next to tall buildings;a city street with cars and buses on it;a city street with cars and a bus;a street with cars and a bus on it;a city street with cars and a bus driving on it
2017_fUbGKUORYfmKZC2hjzUWaQ,0.36582103,0.02694416,0.017070323,0.21441716,0.011469901,0.023933798,0.1810039,0.008801401,0.09224543,0.04048738,301,2017_fUbGKUORYfmKZC2hjzUWaQ_0.jpg,40.697638,-73.869838,a car driving down a road in a rural area;a car driving down a road next to a forest;a car driving down a road next to a field;a car driving down a road next to a lush green field;a car driving down a road next to a lush green forest
2017_j8Zk8uNyfEMcfxBWyekQ0A,0.67507946,0.03573519,0.029458702,0.049291044,0.008345842,0.01592794,0.10369599,0.011729717,0.040535778,0.016713947,101,2017_j8Zk8uNyfEMcfxBWyekQ0A_0.jpg,40.737638,-74.049838,a car parked on the side of the road;a car parked on the side of a road;a car parked on the side of the street;a car parked on the side of the road near houses;a car parked on the side of the road near some houses
2017_oGzrjuVh7vPu0VlRefL4ng,0.46758294,0.051549733,0.027056932,0.16616601,0.022520572,0.04328507,0.10515311,0.015987843,0.1696378,0.043601364,101,2017_oGzrjuVh7vPu0VlRefL4ng_0.jpg,40.777638,-73.949838,a view of a parking lot through a window;a view of a city street from a window;a view of a parking lot through a glass window;a view of a parking lot from the window of a building;a view of a city street from the side of a house
2017_Y0czxYBeF3VE79ebLqWwPA,0.47879413,0.06272906,0.032613456,0.17435265,0.027768552,0.049079537,0.09738472,0.020140886,0.1982122,0.047655016,101,2017_Y0czxYBeF3VE79ebLqWwPA_0.jpg,40.727638,-73.939838,an empty street with no cars on the road;an empty street with no cars on it;an empty street with no cars on both sides;an empty street with no cars on the street;an empty street with a truck parked on the side
2017_C36kZdqIMTM9OGzZdyLLZw,0.6444245,0.031533837,0.021989107,0.06858772,0.008713365,0.017205268,0.08931324,0.009380102,0.052960187,0.018417388,101,2017_C36kZdqIMTM9OGzZdyLLZw_0.jpg,40.757638,-73.819838,a car parked on the side of a street;a car parked on the side of the road;a car parked on the side of a road;a car parked on the side of the street;a car parked on the side of a street near a house
2017_UHJwIk3hWkJjpAAm-_0otg,0.68302774,0.041487932,0.038193792,0.046414047,0.010056943,0.017139435,0.08578336,0.013835788,0.04258451,0.016871095,101,2017_UHJwIk3hWkJjpAAm-_0otg_0.jpg,40.767638,-73.919838,cars parked on the side of the road;cars parked on the side of the street;a group of cars parked on the side of the road;a group of cars parked on the side of a road;a group of cars parked on the side of a street
2017_3iXkX8XLCKacoTHAmgx3Og,0.41218325,0.037532747,0.020085335,0.21045163,0.017234921,0.033350885,0.11504918,0.011926293,0.15514442,0.04230964,301,2017_3iXkX8XLCKacoTHAmgx3Og_0.jpg,40.777638,-74.079838,a highway with a blue sign on the road;a highway with a blue sign on the side;a highway with a blue sign on the side of it;an empty road with a sign that says UNK;a highway with a blue and white sign and trees
2017_TzOqFJnQSU_9_lF4wIf39w,0.68052316,0.037251055,0.0327304,0.048044622,0.008774817,0.015846968,0.096526146,0.011854768,0.040639132,0.015961409,101,2017_TzOqFJnQSU_9_lF4wIf39w_0.jpg,40.767638,-74.039838,a car parked on the side of the road;a car driving down a street past some buildings;a car parked on the side of a street;a car parked in front of a building on a street;a car parked in front of a building on a city street
2017_wsgWVLIDmwz83LmY33Y-hw,0.38890532,0.043474853,0.021849155,0.23903933,0.02249232,0.04321885,0.12758324,0.013827115,0.19058189,0.048080295,301,2017_wsgWVLIDmwz83LmY33Y-hw_0.jpg,40.717638,-74.059838,an empty street with no cars on it;an empty street with no cars driving on it;an empty street with no cars driving down it;an empty street with no cars on the road;an empty street with no cars on it and a sky background
2017_K0Bi1d9kE9B6AoplROm_ZQ,0.6863733,0.04646769,0.042368233,0.04984677,0.011386782,0.018903375,0.08269054,0.0144431,0.04385382,0.01639536,101,2017_K0Bi1d9kE9B6AoplROm_ZQ_0.jpg,40.737638,-73.869838,a car driving down a street past houses;a car parked on the side of the road;a car driving down a street near houses;a car parked on the side of a road;a car parked on the side of the road near some houses
2017_6a1GRwOUM97HVB-R_nYt3A,0.67081726,0.044777602,0.039719492,0.05575481,0.011738777,0.019196004,0.07718682,0.013436317,0.050855428,0.017502546,101,2017_6a1GRwOUM97HVB-R_nYt3A_0.jpg,40.767638,-73.929838,a car driving down a street next to tall buildings;a view of a city street from a car window;a car driving down a street next to buildings;a view of a city street from a vehicle;a view of a city street with cars driving on it
2017_qsVBG5SaWZwXeAblTadz5Q,0.2818312,0.06976253,0.040988326,0.3498715,0.04444343,0.08319771,0.17302778,0.026770145,0.282791,0.087587476,301,2017_qsVBG5SaWZwXeAblTadz5Q_0.jpg,40.737638,-74.079838,a view of a bridge from across the water;a view of the city from a distance;a view of a city skyline from a distance;a view of a city skyline from across a bridge;a view of a city skyline from across the water
2017_QLEu77wP_SMyIf-2mntIXw,0.3301707,0.029160857,0.021752596,0.23462802,0.014537901,0.02522242,0.18365812,0.009928018,0.13194388,0.04407382,301,2017_QLEu77wP_SMyIf-2mntIXw_0.jpg,40.797638,-73.979838,a body of water with a bridge in the background;a body of water with lots of clouds in the sky;a body of water with lots of smoke coming out of it;a body of water with a long boat on it;a body of water with a bridge in the back ground
2017_LziyiZgbK91N3bkVeCIOLQ,0.44875547,0.023939788,0.017341137,0.1633814,0.009036571,0.017757386,0.16030857,0.007474124,0.086844504,0.029212564,101,2017_LziyiZgbK91N3bkVeCIOLQ_0.jpg,40.707638,-74.079838,an empty street with houses in the background;an empty street with houses on both sides;a view of a street with houses and houses in the background;a view of a street with houses and houses on each side;a view of a street with houses and houses in the back
2017_X73yqPUBcjAVu_rGsHX5IQ,0.36195862,0.027554959,0.030037552,0.17387053,0.012231976,0.02237475,0.2993381,0.011812329,0.059189737,0.049137294,502,2017_X73yqPUBcjAVu_rGsHX5IQ_0.jpg,40.777638,-73.969838,a tree branch is in the middle of a field;a field with purple flowers and a dirt path;a tree branch is in the middle of purple flowers;a tree branch is in the middle of a dirt path;a tree branch is in the middle of a dirt road
2017_6w3_v0qrkDwzvNXLqq9lJw,0.68369615,0.052511692,0.055604815,0.047841966,0.013099909,0.019820303,0.07984167,0.016601413,0.04700467,0.017317027,101,2017_6w3_v0qrkDwzvNXLqq9lJw_0.jpg,40.787638,-74.019838,a group of cars parked on a city street;cars are parked on the side of the street;a group of cars parked on the side of a road;cars are parked on the side of the road;a group of cars parked on the side of the road
2017_UminL9NPXYIrg95ghEXKGg,0.33917665,0.047744274,0.026852041,0.28285325,0.028526396,0.05307156,0.13354158,0.016443789,0.21453032,0.064499736,301,2017_UminL9NPXYIrg95ghEXKGg_0.jpg,40.707638,-74.069838,a view of a street from the side of the road;a view of a street from the side of a road;a view of a street from a car window;a view of an empty street from a window;a view of an empty street from a car window
