2017_RdAsHKtKDj5xNxK9ib2beQ,0.5035654,0.026184022,0.015983492,0.12936306,0.009202302,0.019304603,0.14413923,0.007751852,0.08778995,0.02742815,101,2017_RdAsHKtKDj5xNxK9ib2beQ_0.jpg,40.807638,-73.999838,a view of a street from a car window;a view of the street from a car window;a view of an empty street with a sky background;a view of a city street with buildings on each side;a view of a city street with buildings and a blue sky
2017_A_ODvOkDCrhN3IgbFzKvAQ,0.44228682,0.022412002,0.019653797,0.1286203,0.009558588,0.016141474,0.16358307,0.007778376,0.079625905,0.030455738,101,2017_A_ODvOkDCrhN3IgbFzKvAQ_0.jpg,40.757638,-73.949838,a body of water with buildings in the background;a large body of water with a city in the background;a view of a city skyline from a river;a large body of water with a city in the back ground;a large body of water with a boat in the middle of it
2017_eENOUxEDLDb0bCyae3BLSw,0.3592672,0.065804124,0.032069802,0.26092485,0.034819633,0.0693838,0.12693927,0.022543281,0.24082154,0.06681168,301,2017_eENOUxEDLDb0bCyae3BLSw_0.jpg,40.717638,-73.909838,a view of the inside of an airplane;a view of the inside of an airport;a view of the airport from a vehicle;a view of the inside of an airport terminal;a view of the inside of a vehicle on a highway
2017_gVD6dNqnYfaVtvka3vtuvQ,0.6672335,0.04085836,0.03931585,0.052522212,0.01006636,0.017365545,0.07923907,0.012429774,0.045892566,0.017066032,101,2017_gVD6dNqnYfaVtvka3vtuvQ_0.jpg,40.707638,-73.929838,a yellow car driving down a street past tall buildings;a couple of cars parked in front of a brick building;a yellow car driving past a tall brick building;a couple of cars parked in front of a building;a yellow car parked in front of a tall building
2017_bSpn2bnHjYAWhAl4xT8BGg,0.33401898,0.059156597,0.031469136,0.29416028,0.035091758,0.06409982,0.12580988,0.020568132,0.25951725,0.07404694,301,2017_bSpn2bnHjYAWhAl4xT8BGg_0.jpg,40.707638,-73.859838,a view of a train track from a distance;a long line of concrete steps leading up to a building;a long line of concrete steps leading to a train station;a long line of concrete steps leading up to a train station;a long line of concrete steps leading to a train
2017_e4Kt_-A1avWNpePdVbUqNw,0.476988,0.021199614,0.016741514,0.12736934,0.00784108,0.015584618,0.16410461,0.007142365,0.073141545,0.027676344,101,2017_e4Kt_-A1avWNpePdVbUqNw_0.jpg,40.757638,-73.939838,a street with a building in the background;a view of a street corner from a distance;a view of a street corner with a building in the background;a street with a building in the background and a sidewalk;a view of a street corner with a building and a tree
2017_XwKlpG1ZUDXiBimxE9fDDA,0.66351753,0.033631742,0.02658543,0.059798032,0.008575559,0.01666522,0.08992961,0.010478228,0.0464606,0.017235607,101,2017_XwKlpG1ZUDXiBimxE9fDDA_0.jpg,40.787638,-74.059838,a street with houses on each side and a street;a view of a residential street with houses and trees;a street with houses on each side and a green grass field;a street with houses on each side and a street light;a street with houses on each side and a street light on it
2017_a7ETAhT_HFTXiA9ZeDYsQw,0.6461853,0.048611403,0.04268521,0.06895694,0.013432413,0.020814866,0.074160576,0.013778359,0.062437475,0.020352155,101,2017_a7ETAhT_HFTXiA9ZeDYsQw_0.jpg,40.737638,-74.009838,a city street with cars driving on it;a street with a few cars on it;a street with a few cars driving on it;a road with cars driving on it and trees in the background;a road with cars driving on it and trees
2017_PqLqwtz4oyaxH6Rt-_bHCg,0.66572666,0.04428649,0.043710887,0.055639684,0.011381358,0.018900692,0.075104415,0.012991756,0.05050665,0.017426819,101,2017_PqLqwtz4oyaxH6Rt-_bHCg_0.jpg,40.747638,-73.999838,a public transit bus on a city street;a bus driving down a street next to tall buildings;a white bus driving down a street next to tall buildings;a white bus driving down a city street;a bus driving down a street next to a tall building
2017_9W52p019clsuKy1i8_9elA,0.68653226,0.046729416,0.041949928,0.04977554,0.011575252,0.018856883,0.080250084,0.014851779,0.0449889,0.01681605,101,2017_9W52p019clsuKy1i8_9elA_0.jpg,40.737638,-73.999838,a truck parked in front of a building;a truck driving down a street next to tall buildings;a truck parked in front of a large building;a truck driving down a street next to a building;a truck driving down a street past a building
2017_JM-BKupOj9JHF28JzrR_AA,0.38926458,0.03889945,0.021331906,0.22777212,0.019770086,0.038240194,0.12796083,0.012353092,0.17066196,0.046913534,301,2017_JM-BKupOj9JHF28JzrR_AA_0.jpg,40.737638,-73.939838,an empty street with a train passing by buildings;an empty street with a train passing by;an empty street with a train passing by a building;a road with a train on the side of it;a road with a train on the side and a building behind it
2017_Gzk8CwiG_vgcfICvPb62mg,0.34149945,0.048003584,0.026794672,0.2620286,0.02824527,0.04881257,0.13619319,0.016316086,0.21495306,0.059129804,301,2017_Gzk8CwiG_vgcfICvPb62mg_0.jpg,40.767638,-74.079838,a long road with power lines above it;a road with power lines and power lines;a long road with power lines and power lines;a long road with power lines and telephone poles;a long road with power lines and power lines above
2017__l7j3-2bX62unw7nx7RfAQ,0.3348976,0.054297715,0.028613359,0.29503942,0.030353487,0.055630445,0.122577965,0.018728971,0.23856291,0.0662356,301,2017__l7j3-2bX62unw7nx7RfAQ_0.jpg,40.747638,-73.929838,a highway with a truck driving down it;an empty highway with a car driving down it;an empty highway with a car driving down the road;a highway with a truck driving down it under a blue sky;a highway with a truck driving down it under a blue cloudy sky
2017_onV9Nro8U0IpmW0RzWqX-Q,0.69100773,0.04610744,0.04896289,0.04114166,0.01110664,0.016898304,0.09001085,0.016583353,0.04075718,0.017467171,101,2017_onV9Nro8U0IpmW0RzWqX-Q_0.jpg,40.727638,-73.979838,a car driving down a street next to tall buildings;a car driving down a street past tall buildings;a car driving down a city street next to tall buildings;a group of cars parked on the side of a street;a group of cars parked on the side of a road
2017_BmMg6nWris0kGbLfYnGBTw,0.3834257,0.026388854,0.018448442,0.20483431,0.010706604,0.021002412,0.16972908,0.008235067,0.1073769,0.034963667,301,2017_BmMg6nWris0kGbLfYnGBTw_0.jpg,40.787638,-73.829838,a empty street with houses in the background;an empty street with houses in the background;a street with houses in the background and houses;a street with houses in the background and houses on the street;a street with houses in the background and houses on the other side
2017_JjZQRSpntyFfQXmTuL8QlQ,0.46128604,0.023606598,0.014779836,0.1522662,0.009705067,0.01900962,0.13600886,0.007415354,0.09719953,0.029602647,101,2017_JjZQRSpntyFfQXmTuL8QlQ_0.jpg,40.747638,-74.039838,a car driving down a road next to tall buildings;a car driving down a street past tall buildings;a car driving down a road next to a tall building;a car driving down a street past a tall building;a car driving down a street next to tall buildings
2017_QjtOcuP4RVVZc0JqioCB7A,0.622821,0.03533587,0.02253005,0.08772382,0.011377603,0.021400481,0.088609815,0.011055738,0.06267446,0.021686763,101,2017_QjtOcuP4RVVZc0JqioCB7A_0.jpg,40.747638,-73.869838,a truck parked on the side of a road;a truck parked on the side of the road;a truck parked on the side of a street;a truck parked on the side of the street;a truck parked on the side of the road near a building
2017_1H-I8gB47izNPuTRMeYfVg,0.5938723,0.040845633,0.024739116,0.101186365,0.014112324,0.024295896,0.08450431,0.01149857,0.09423575,0.02613464,101,2017_1H-I8gB47izNPuTRMeYfVg_0.jpg,40.727638,-73.999838,a view of a city street from a distance;a view of a city street from the street;a view of a city street from a car window;a view of a street with cars and buildings;a view of a city street with buildings and cars
2017_IcNc6AWwNtHHwpniAMjHHA,0.29654866,0.047287762,0.026446015,0.29461062,0.026742756,0.050046086,0.15518078,0.016959906,0.19682997,0.06477958,301,2017_IcNc6AWwNtHHwpniAMjHHA_0.jpg,40.767638,-73.839838,a car driving down a street next to a traffic light;a car driving down a road next to buildings;a long road with some buildings on each side;a car driving down a street next to a building;a car driving down a road next to a street light
2017_M3iJ9Kt01XWO0c-BNVQZgw,0.47039852,0.044803023,0.022191048,0.18606561,0.020997018,0.03907171,0.10338345,0.014555424,0.16140205,0.040331453,101,2017_M3iJ9Kt01XWO0c-BNVQZgw_0.jpg,40.787638,-74.049838,a red and white truck driving down a highway;a red truck driving down a highway next to another car;a red truck driving down a road next to a red truck;a red truck driving down a highway next to a blue sky;a red truck driving down a highway next to another red truck
2017_tEnE2PceIF6PQFO39LoH6Q,0.65725183,0.059398144,0.0674513,0.061092377,0.016783684,0.022240281,0.07187697,0.018621504,0.05920741,0.021935195,101,2017_tEnE2PceIF6PQFO39LoH6Q_0.jpg,40.757638,-73.859838,a group of cars driving down a city street;a group of cars driving down a street;a group of cars driving down a road;a street with cars parked on the side of it;a street with cars parked on the side of the road
2017_k2Ee4ib6S7usmUN829kUNA,0.6482645,0.057911873,0.082344025,0.05428359,0.016252995,0.020936668,0.08007023,0.019040406,0.053695247,0.02160743,101,2017_k2Ee4ib6S7usmUN829kUNA_0.jpg,40.737638,-73.979838,a city street filled with traffic next to tall buildings;a view of a street from a car window;a city street filled with lots of traffic next to tall buildings;a city street filled with lots of traffic near tall buildings;a city street filled with lots of traffic next to buildings
