2017_LJv-H9Kqttcyus4em81CrQ,0.45244592,0.02515331,0.02792865,0.11681983,0.009934127,0.017245173,0.29221427,0.00969559,0.05229476,0.034810126,502,2017_LJv-H9Kqttcyus4em81CrQ_0.jpg,1.37,103.85,a bench that is sitting in the grass;a bench that is sitting in the dirt;a view of a bench through a park;a bench that is sitting in the grass near trees;a bench that is sitting in the middle of a sidewalk
2017_Wdu0C1hOeYsKMn0Q3HWUSg,0.4061963,0.025609791,0.01992467,0.19128284,0.010376811,0.018440425,0.16447106,0.008215249,0.08687866,0.03470862,101,2017_Wdu0C1hOeYsKMn0Q3HWUSg_0.jpg,1.07,103.92,a dirt road with houses in the background;a dirt road with houses on each side;a dirt road with houses on each side of it;a dirt road with houses on each side of the road;a dirt road with houses on each side and houses in the background
2017_DFdEo_b-0qtvVNrf1u0Y3A,0.36017576,0.026945055,0.020813704,0.183673,0.011626005,0.02184096,0.21298403,0.009363294,0.0862613,0.038598627,502,2017_DFdEo_b-0qtvVNrf1u0Y3A_0.jpg,1.33,103.42,a body of water with two wind surfers on it;a body of water with two wind surfers in it;a body of water with two wind sails floating on it;a body of water that has a person on a surfboard;a body of water with a person on it and a sky background
2017_yiFEcygETbuNut6i3Tlq9g,0.2509937,0.038326144,0.027487218,0.37426764,0.021139473,0.04180643,0.2181046,0.015538603,0.138693,0.08116284,301,2017_yiFEcygETbuNut6i3Tlq9g_0.jpg,1.48,103.94,a view of a road from a grassy area;a view of a road with power lines in the background;a view of a road with power lines overhead;a view of a road with power lines and clouds;a view of a road with power lines in the back
2017_EV1aNaO0UCyhfUza9SEPbA,0.36051184,0.095326245,0.04612115,0.28871435,0.053479403,0.09802881,0.121585965,0.037110746,0.3003313,0.08385354,301,2017_EV1aNaO0UCyhfUza9SEPbA_0.jpg,1.34,103.96,a highway with several cars driving down it;a highway with several cars driving on it;a highway with several cars driving down the road;a highway with several cars driving on it and a cloudy sky;a highway with several cars driving on it near trees
2017_1WIqVT4eSYENRUGhAOHtWg,0.6857962,0.048549563,0.05356598,0.0465675,0.012123019,0.017941684,0.08070928,0.016476393,0.044385105,0.018018544,101,2017_1WIqVT4eSYENRUGhAOHtWg_0.jpg,1.33,103.93,a white car driving down a city street;a white car driving down a street next to tall buildings;a white car driving down a road next to tall buildings;a white car driving down a street next to a building;a white car driving down a street past a building
2017_rO2KUEJS3VZAmGREDuCIhA,0.42279217,0.02858767,0.019610524,0.17418414,0.013328314,0.025737792,0.15464726,0.009564847,0.11455926,0.037001878,101,2017_rO2KUEJS3VZAmGREDuCIhA_0.jpg,1.4,103.65,a couple of flags floating on top of a lake;a couple of flags floating on top of a body of water;a body of water with a flag on it;a body of water with a kite in the middle of it;a couple of flags floating on top of a lake next to a forest
2017_9PF7MuzF2cauST635nQ_6w,0.6209227,0.03290081,0.037954956,0.04502806,0.008076727,0.01366818,0.16144574,0.011352122,0.036836177,0.019232899,101,2017_9PF7MuzF2cauST635nQ_6w_0.jpg,1.36,103.89,a row of houses sitting next to each other;a row of houses with a house in the background;a white house sitting next to a couple of buildings;a view of a residential area with a large house;a row of houses sitting next to each other on a sidewalk
2017_eKhhTxyOJZF1dzwUD33URw,0.33064523,0.042830616,0.024014086,0.27136922,0.021795064,0.042960674,0.13920414,0.014156133,0.20125565,0.05489883,301,2017_eKhhTxyOJZF1dzwUD33URw_0.jpg,1.39,103.63,an empty highway with a blue sky in the background;an empty highway with a lot of trees on it;an empty highway with a lot of trees;a road with a long line of trees on it;an empty highway with a lot of trees on the side
2017_aXzfKZAona99waWwE1I_pw,0.31592762,0.03931871,0.024156034,0.2821396,0.022466987,0.039589286,0.14822161,0.013582885,0.19278097,0.055177778,301,2017_aXzfKZAona99waWwE1I_pw_0.jpg,1.44,103.61,an empty street with a few houses in the background;a view of an empty parking lot with a cloudy sky;an empty street with a few houses in the back ground;a view of an empty parking lot from a distance;an empty street with a few houses on the side of the road
2017_AVMec0JvDg88a7d5m5dZZQ,0.64843094,0.03927487,0.030157149,0.06517118,0.010845989,0.019688576,0.08000404,0.01124981,0.054271877,0.018128514,101,2017_AVMec0JvDg88a7d5m5dZZQ_0.jpg,1.35,103.95,a road that has some buildings on it;a view of a street from the side of a road;a view of a street from the side of a street;a view of a street from the side of the road;a view of a two lane street from a street
2017_5BRLWf9pNZH8DqQosumLRw,0.44013295,0.022687882,0.016439378,0.16406393,0.009658933,0.018991202,0.15034756,0.007334858,0.10206336,0.032253355,101,2017_5BRLWf9pNZH8DqQosumLRw_0.jpg,1.29,103.81,a large building with a green field next to it;a large building with a green tree next to it;a large building with a green lawn next to it;a large building with a green grass covered field;a large building with a green field next to a tree
2017_jqditdC9_5KY3w2UPRplNA,0.4134015,0.026771009,0.03564462,0.110333055,0.010340869,0.01547271,0.31349897,0.010316879,0.052161098,0.03674835,502,2017_jqditdC9_5KY3w2UPRplNA_0.jpg,1.29,103.86,an empty street with a large building in the background;a view of a street with a building in the background;an empty street with a long line of trees;an empty street with a large building in the back;a view of an empty street with a view of a building
2017_bjM9iO4o7Ku-CpQgtavo8w,0.60438675,0.029275298,0.028920889,0.059202194,0.007530361,0.013092488,0.13253626,0.008563101,0.048699796,0.019216359,101,2017_bjM9iO4o7Ku-CpQgtavo8w_0.jpg,1.38,103.75,a view of a street from across the street;a view of a street from a window of a building;a view of a city street from the side of a road;a view of a street from the back of a car;a view of a street from the side of a road
2017_TDLQd0VoWMmL_7xKypttlw,0.6407551,0.042764455,0.02830711,0.08543515,0.013687432,0.024013191,0.07908884,0.012876183,0.06840688,0.021906078,101,2017_TDLQd0VoWMmL_7xKypttlw_0.jpg,1.46,103.58,a truck driving down a street past houses;a truck driving down a street past a house;a truck driving down a street next to houses;a truck driving down a street next to a building;a truck driving down a street next to a house
2017_dWpsa68SDbf-GYmHq3yvVA,0.6789379,0.046983123,0.044736058,0.04646671,0.011661977,0.01839292,0.083756834,0.015505463,0.043023586,0.016570479,101,2017_dWpsa68SDbf-GYmHq3yvVA_0.jpg,1.15,104.01,a group of motorcycles parked in front of a building;a group of motorcycles parked on the side of a street;a group of motorcycles parked next to a building;a group of motorcycles parked on the side of a road;a group of people walking down a street next to tall buildings
2017_qbDrTjqB_2g6pBTTAW9Vgw,0.5162967,0.047265977,0.027183652,0.1271236,0.017905682,0.02961278,0.090243965,0.013605922,0.12897784,0.033340156,101,2017_qbDrTjqB_2g6pBTTAW9Vgw_0.jpg,1.41,103.83,a view of a city street from across the street;a view of a city street from across the road;a view of a city street from a distance;a view of a street corner with a parking lot;a view of a street corner with a parking lot and grass
2017_UFcRVmAJ_BBBzsSnvlP7hQ,0.41777217,0.022679806,0.018915355,0.16483757,0.009042412,0.017380953,0.2042529,0.007714242,0.07592389,0.033426523,502,2017_UFcRVmAJ_BBBzsSnvlP7hQ_0.jpg,1.44,103.84,a long road with a fence lined with trees;a view of a street from the side;a long road with a fence on both side;a view of a street from the side of the road;a long road with a fence on both sides of it
2017_AyKzDU_g5z5aFucUbPkn8g,0.38587165,0.047948837,0.024214894,0.24634463,0.024521261,0.045179963,0.110955626,0.0156402,0.20236689,0.052669436,301,2017_AyKzDU_g5z5aFucUbPkn8g_0.jpg,1.32,103.83,an empty parking lot next to a green field;an empty parking lot next to a fenced off area;an empty parking lot next to an empty street;an empty parking lot next to an empty parking lot;an empty parking lot next to a fenced in area
2017_KvbAPptGs0gsP6P0Teka8g,0.6462108,0.042797774,0.045039445,0.0559099,0.011021525,0.01758039,0.0795255,0.012476265,0.049082637,0.017301977,101,2017_KvbAPptGs0gsP6P0Teka8g_0.jpg,1.43,103.78,a city street with buildings and a cloudy sky;a bus stop sign covered in graffiti next to a building;a bus stop sign covered in graffiti in front of a tall building;a bus stop sign covered in graffiti on a street;a bus stop sign covered in graffiti next to tall buildings
2017_RJjgbFbrN6j2KnNP4dla0Q,0.41826594,0.03788972,0.019362807,0.20820987,0.01846829,0.035229564,0.11536485,0.012023151,0.15163586,0.04220465,301,2017_RJjgbFbrN6j2KnNP4dla0Q_0.jpg,1.33,103.96,a car driving down a road next to a tree;a car driving down a street near a building;a car driving down a street next to a green tree;a car driving down a street next to a tree;a car driving down a street next to a tall building
2017_OE9ot9_Dhrnqc96_FntMSg,0.47456086,0.02701664,0.015122414,0.16892791,0.011663139,0.023844779,0.11423412,0.008486658,0.10872209,0.031268686,101,2017_OE9ot9_Dhrnqc96_FntMSg_0.jpg,1.05,103.94,a green and white bus parked next to a building;a bus is parked outside of a building;a green and white bus parked in front of a building;a bus parked next to a building under a tree;a bus parked next to a building on a sidewalk
2017_5Tq577PbprE67Bg63ABqHQ,0.5594362,0.027280897,0.030402064,0.058363974,0.007487893,0.012444526,0.15896788,0.009020746,0.043782324,0.02186957,101,2017_5Tq577PbprE67Bg63ABqHQ_0.jpg,1.3,103.89,a group of people riding bicycles down a street;a group of people riding bicycles down a road;a group of people riding bicycles down the road;a group of people riding bicycles down a city street;a group of people riding bicycles down an empty road
2017_h5ruysyvWtPvG3VfjC-nzg,0.54326385,0.027846634,0.015443027,0.11324358,0.010236621,0.021369785,0.11582774,0.008559793,0.07762051,0.026173085,101,2017_h5ruysyvWtPvG3VfjC-nzg_0.jpg,1.32,103.95,a highway with parked cars on both sides;a long road with many cars parked on both sides;a view of a street from a car window;a highway with parked cars on both sides of it;a highway with parked cars on both sides of the road
2017_EzsPAAIQnykndA-1VgjcHA,0.5674405,0.043099582,0.0267694,0.114993125,0.016861886,0.027377218,0.08339313,0.013323963,0.110563606,0.0293172,101,2017_EzsPAAIQnykndA-1VgjcHA_0.jpg,1.36,103.84,a white truck driving down a street next to tall buildings;a white truck driving down a city street;a truck driving down a street next to a tall building;a truck driving down a street next to tall buildings;a truck driving down a city street next to tall buildings
2017_oLE0f2n3UauVofKHRDq_Nw,0.5867992,0.030098855,0.016003996,0.10942224,0.009964377,0.021492273,0.1090658,0.008658916,0.0763565,0.023914844,101,2017_oLE0f2n3UauVofKHRDq_Nw_0.jpg,1.13,103.93,an empty street with a few houses on each side;an empty street with a few houses on the side;an empty street with a few houses in the background;a view of a street from the side of a road;a view of a street from the side of the road
2017_yVZJRltTcY_EcA98qSoKWw,0.2609981,0.03571099,0.027300864,0.337834,0.019574314,0.041733682,0.23707819,0.015382558,0.11195907,0.080614805,301,2017_yVZJRltTcY_EcA98qSoKWw_0.jpg,1.41,103.99,a wooden bench sitting next to a forest;a wooden bench sitting next to a lush green forest;a long wooden bench sitting next to a forest;a long wooden bench sitting next to a lush green forest;a wooden bench sitting next to a lush green park
2017_iIoQkoEPyEjVvR2jCBlFXw,0.41865256,0.04970339,0.030264586,0.20996714,0.023089707,0.03742966,0.101086855,0.015531689,0.19613239,0.048801064,301,2017_iIoQkoEPyEjVvR2jCBlFXw_0.jpg,1.37,103.58,a road with a few buildings on each side;a view of a street from the highway;a view of a street from a distance;a view of a street from a car;a view of a street from a car window
2017_xEBSyUdoIx3sbq8oY5mTFA,0.611905,0.036742955,0.033929706,0.06829509,0.009811938,0.0166955,0.09497562,0.010053068,0.058453232,0.019165814,101,2017_xEBSyUdoIx3sbq8oY5mTFA_0.jpg,1.34,103.7,an empty street with buildings in the background;a view of a city street with buildings in the background;a view of a city street from the ground;a view of a city street from the side;a view of a city street from the side of the road
2017_Q7ShGUBT8n1FTJYBlnUnnA,0.3261127,0.030143052,0.019761562,0.25023794,0.013363451,0.02812481,0.19077376,0.010459811,0.09412685,0.050477028,301,2017_Q7ShGUBT8n1FTJYBlnUnnA_0.jpg,1.48,103.52,a car driving down a street next to a forest;a road with a car driving down the road;a car driving down a road next to a lush green forest;a car driving down a road next to a forest;a car driving down a road past a lush green forest
2017_CvD0c8yEYn3bTedOKX3FxA,0.50937253,0.040300906,0.022497177,0.13061684,0.015266389,0.026503682,0.0937354,0.012085855,0.11378351,0.031713933,101,2017_CvD0c8yEYn3bTedOKX3FxA_0.jpg,1.3,103.83,a group of cars that are sitting in the street;a group of cars driving down a city street;a group of cars driving down a street;a group of cars driving down a road;a group of cars driving down a street next to a tall building
2017_YFooM9rZUg6z0pGUx-MwAQ,0.5171199,0.02390778,0.014000326,0.13054782,0.009240001,0.018640667,0.13010812,0.007642329,0.080446064,0.026575416,101,2017_YFooM9rZUg6z0pGUx-MwAQ_0.jpg,1.14,104.03,a view of a house from a distance;a view of a house from the side;a view of a building from the ground;a view of a house from the side of the road;a view of a house from the side of a house
2017_EAcgs1GIvccHmOBx7xG4BQ,0.5913221,0.038924247,0.0228118,0.116190374,0.015504897,0.026139677,0.08568311,0.012965888,0.089860946,0.027627826,101,2017_EAcgs1GIvccHmOBx7xG4BQ_0.jpg,1.39,103.74,a semi truck is driving down a road;a semi truck driving down a road next to trees;a semi truck driving down a highway next to trees;a semi truck driving down a road next to a park;a semi truck driving down a road next to a green field
2017_j_Cw9jIWvsz-uDe-dvTghw,0.38844645,0.04011205,0.02284664,0.23203328,0.020646125,0.03781271,0.123238325,0.01360774,0.18162978,0.049061924,301,2017_j_Cw9jIWvsz-uDe-dvTghw_0.jpg,1.3,103.91,a view of a street from the ground;a parking lot with palm trees and a road;a view of a street with a long line of palm trees;a view of a street from the side of a road;a view of a street from the side of the road
2017_aib9LwGrI2eqp5iijbHsQA,0.33727452,0.026256382,0.020153612,0.2406626,0.011669934,0.023150206,0.19460484,0.009055018,0.09716782,0.044205606,301,2017_aib9LwGrI2eqp5iijbHsQA_0.jpg,1.48,103.89,a white house sitting on the side of a road;a white house sitting on the corner of a street;a white house sitting on the side of a street;a white house sitting on the side of the road;a white house sitting on the side of a road next to a field
2017_PbB01DUN2jP8xnT5b3O31g,0.536409,0.032027572,0.01769501,0.11866179,0.011488825,0.022540838,0.10514507,0.009292245,0.08559209,0.026848882,101,2017_PbB01DUN2jP8xnT5b3O31g_0.jpg,1.1,104.09,a view of a street from a car window;a view of a street from a vehicle window;a view of a street from the side of the road;a view of a road from the side of a road;a view of a street from the side of a road
2017_N0y4zAVGjnazzXOJm4zWlQ,0.42295796,0.02329725,0.017242521,0.17371553,0.009581476,0.019123077,0.17907661,0.007791281,0.090030074,0.03234929,101,2017_N0y4zAVGjnazzXOJm4zWlQ_0.jpg,1.1,104.05,a narrow street with houses on both sides;a narrow street with houses on each side;a street with houses on each side;a street with houses on each side and houses in the background;a street with houses on each side and houses on each side
2017_cJK_zrZtfZ-V73zckKsKBg,0.31487203,0.085342616,0.04505393,0.31807768,0.04773134,0.09504002,0.13607332,0.03362283,0.3060894,0.089274436,301,2017_cJK_zrZtfZ-V73zckKsKBg_0.jpg,1.34,103.83,a view of a street with a sky background;a street with a long line of trees in the background;a street with a long line of cars on it;a street with a long line of trees on it;a view of a street from the side of a road
2017_4C2_Kot88kHtnjREkAcVLg,0.3152691,0.02777791,0.022640496,0.25721496,0.012967378,0.026624143,0.22236004,0.010722309,0.0917795,0.054021776,301,2017_4C2_Kot88kHtnjREkAcVLg_0.jpg,1.47,103.91,an empty road with trees on each side;an empty road with trees on both sides;an empty road with a long line of trees;an empty road with trees on both side;an empty road with a long line of trees next to it
2017_9TTuTfk9TsfNz3bezjmadA,0.37785143,0.0410161,0.022616506,0.23440889,0.020077676,0.03992948,0.11766395,0.013421088,0.17965361,0.049355924,301,2017_9TTuTfk9TsfNz3bezjmadA_0.jpg,1.39,103.9,a yellow train traveling past a tall building;a yellow train traveling past a tall building on a street;there is a yellow and black train on the road;there is a yellow and black train passing by the street;there is a yellow and black train passing by a building
2017_EhkWBn5x13b0Af9oNmPBjQ,0.31524885,0.028577179,0.023201376,0.27262175,0.013085991,0.026565015,0.21422327,0.0111835,0.091697216,0.05647707,301,2017_EhkWBn5x13b0Af9oNmPBjQ_0.jpg,1.35,103.47,a view of a dirt road from the side;a view of a dirt road with trees on each side;a view of a dirt road with trees along the side;a view of a dirt road with trees on it;a view of a dirt road from the side of a dirt road
2017_c1IoYqyW51xXrwjCDuzY6w,0.41723394,0.022143245,0.018374652,0.16206163,0.009249032,0.016522855,0.16834375,0.007745147,0.07556474,0.033136874,101,2017_c1IoYqyW51xXrwjCDuzY6w_0.jpg,1.36,103.59,a group of people riding bicycles down a dirt road;a group of people that are sitting on bicycles;a group of people sitting on top of a dirt road;a group of people that are sitting on bikes;a group of people that are sitting in the dirt
2017_pHWtQj17La5PJdFh18zwyQ,0.30865008,0.06597203,0.034980565,0.3243497,0.038953632,0.07250315,0.12999809,0.02429083,0.26726466,0.07841304,301,2017_pHWtQj17La5PJdFh18zwyQ_0.jpg,1.43,103.63,a highway with a mountain in the background;a highway with a large mountain behind it;a highway with a large mountain in the background;a highway with a mountain in the back;a highway with a mountain in the back ground
2017_cQenBZtjYht_3u_-exSH5g,0.2570609,0.043780416,0.027874708,0.3417158,0.021920979,0.043855816,0.17689043,0.015230894,0.18607032,0.06842971,301,2017_cQenBZtjYht_3u_-exSH5g_0.jpg,1.04,104.08,a view of a field with clouds in the sky;a view of a grassy field with clouds in the sky;a field that has a grassy field with clouds in the sky;a view of a field with clouds in the background;a view of a grassy field with a cloudy sky
2017_UH_L5pGlPQXuNIESvE62HA,0.3609423,0.026741922,0.019011378,0.2260516,0.012981415,0.022089541,0.15595344,0.009149134,0.113817364,0.043204337,301,2017_UH_L5pGlPQXuNIESvE62HA_0.jpg,1.11,103.96,an empty parking lot next to some trees;an empty parking lot in the middle of the day;an empty parking lot next to a green field;an empty parking lot next to a grassy field;an empty parking lot in the middle of the park
2017_S4MbH9OyHl947ZU-4_Zz5A,0.46119,0.035452574,0.018174142,0.18232262,0.016473144,0.02961874,0.1004352,0.011415869,0.13473722,0.03688091,101,2017_S4MbH9OyHl947ZU-4_Zz5A_0.jpg,1.31,103.66,a group of trucks drive down a highway;a couple of trucks driving down a road;a group of trucks driving down a highway;a couple of trucks driving down a street;a group of semi trucks driving down a highway
2017_LDjgnltpjwuAbCCZ6nfZgg,0.30198163,0.033392906,0.020131528,0.2949481,0.015550107,0.032170355,0.1777716,0.011191905,0.11717209,0.05514446,301,2017_LDjgnltpjwuAbCCZ6nfZgg_0.jpg,1.07,103.93,a car driving down a road with a cloudy sky;a car driving down a road in the middle of the day;a car driving down a road in the country;a car driving down a road next to a forest;a car driving down the road in the middle of the day
2017_kcb49KVaW0orM6lwxpkIrQ,0.6100476,0.027184367,0.016960472,0.08925018,0.008363783,0.017950714,0.11766821,0.008832961,0.055268824,0.02145493,101,2017_kcb49KVaW0orM6lwxpkIrQ_0.jpg,1.13,104.05,an empty street with a car parked on the side;an empty street with a car parked in front of a building;an empty street with a car parked next to it;a street view of a street and a building;an empty street with a car parked in front of a tall building
2017_C_6B6VswP4iFi2IC2vWH7A,0.2557637,0.08123791,0.04856816,0.36597386,0.05137682,0.093557805,0.16884404,0.033296525,0.30077904,0.10421315,301,2017_C_6B6VswP4iFi2IC2vWH7A_0.jpg,1.36,103.62,an empty highway with a train on it;an empty highway with a train on each side;a long road with a long line of train tracks;a long road with a long line of traffic;a long road with a long line of train cars on it
2017_9bmH9deH7gRT3q8X7VZAdg,0.47220415,0.026417553,0.016757518,0.13355187,0.010278761,0.019907802,0.12499723,0.008164018,0.089292675,0.02965042,101,2017_9bmH9deH7gRT3q8X7VZAdg_0.jpg,1.33,103.84,a person riding a skateboard down a street;a person is riding a skateboard down the street;a man riding a skateboard down a street;a person riding a skate board on a city street;a man riding a skateboard down a street next to parked cars
2017_zSnHvDu3pDFor1veNYUDtg,0.6753895,0.04171866,0.037348956,0.051446915,0.010330766,0.017382115,0.080776304,0.012677342,0.045896888,0.016426086,101,2017_zSnHvDu3pDFor1veNYUDtg_0.jpg,1.45,103.81,a large white truck driving down a street;a white van parked in a parking lot;a white truck driving down a street next to tall buildings;a white van driving down a street next to tall buildings;a white van parked in the middle of a parking lot
2017_v0GCK-5mxDZdcMWj4txk1A,0.6181514,0.03852591,0.02990207,0.07885808,0.011003763,0.018954486,0.08390355,0.010081291,0.068857074,0.02088523,101,2017_v0GCK-5mxDZdcMWj4txk1A_0.jpg,1.34,103.69,a long road with buildings on each side;a long road with buildings on both sides;a long road with buildings on both sides of it;a long road with buildings on both sides and a sky background;a long road with buildings on each side and a sky background
2017_UhPRnwbsJFb7rra892k34w,0.36655852,0.030527353,0.018968135,0.22959676,0.016063988,0.028032213,0.14079785,0.009840012,0.15602893,0.0450269,301,2017_UhPRnwbsJFb7rra892k34w_0.jpg,1.39,103.87,a street corner with a street light and power lines;a street corner with a street light next to a street;a street corner with a street light and a pole;a street corner with a street light and a street light;a street corner with a street light and a street lamp
2017_sG0W5JPybwRjHvwCb--EWA,0.3330595,0.026822567,0.023589283,0.2381934,0.012139618,0.024422437,0.23147497,0.010801435,0.08155385,0.052760303,301,2017_sG0W5JPybwRjHvwCb--EWA_0.jpg,1.3,103.81,a park like area with trees and grass;a park like area with trees and bushes;a park like area with trees and grass and bushes;a view of a park from the side of the road;a park like area with trees and grass and trees
2017_7l8BzVWDyETJv_Yup1j4zw,0.29311466,0.030966341,0.023341537,0.30241096,0.014598072,0.029889017,0.20198485,0.011777878,0.1071274,0.060329676,301,2017_7l8BzVWDyETJv_Yup1j4zw_0.jpg,1.02,103.43,a dirt road on the side of a dirt road;a dirt road that is surrounded by grass;a dirt road on the side of the road;a dirt road on the side of a rural road;a dirt road on a dirt road with a sky background
2017_hg9EWKvBwtLTwEHVx6_KCw,0.40002275,0.02262929,0.020700395,0.17578635,0.00981763,0.017894208,0.22697678,0.008414716,0.06850684,0.037484735,502,2017_hg9EWKvBwtLTwEHVx6_KCw_0.jpg,1.17,104.04,a brick walkway with trees in the background;a brick walkway in the middle of a park;a brick walkway in the middle of a field;a brick walkway in the middle of a dirt road;a brick walkway in the middle of the middle of the woods
2017_IZRoTfF-Sk6YhahsMMepXw,0.58195686,0.025413275,0.015725791,0.09845629,0.008394808,0.01796478,0.111531675,0.008011878,0.0636915,0.022386342,101,2017_IZRoTfF-Sk6YhahsMMepXw_0.jpg,1.35,103.84,a bus parked on the side of the road;a bus parked on the side of a road;a bus parked on the side of a street;a bus parked on the side of a road near a building;a bus parked on the side of a road next to houses
2017_C-LF2qZo8IUVRt24i3YLEQ,0.6568689,0.059965104,0.0808416,0.05894351,0.016857982,0.021094412,0.07630071,0.019803196,0.058790386,0.022998959,101,2017_C-LF2qZo8IUVRt24i3YLEQ_0.jpg,1.34,103.89,a city street filled with traffic next to buildings;a street with cars parked on the side of it;a view of a city street with buildings and cars;a street with cars parked on the side of the road;a street with cars parked on the side and a building in the background
2017_mHE9NfvjMB1N3PodbJ4BDw,0.46798745,0.05288446,0.028901905,0.17041782,0.020813644,0.03895831,0.098058134,0.015055865,0.17789471,0.042456836,101,2017_mHE9NfvjMB1N3PodbJ4BDw_0.jpg,1.36,103.97,an empty street with a lot of buildings around it;a highway with buildings on both side of the road;an empty street with a lot of buildings on it;an empty street with a lot of buildings on the side;an empty street with a lot of buildings on the side of it
2017_Rl8iFsGGXD5o6W2TZb_7gg,0.42435995,0.025155813,0.01622048,0.17266959,0.009684503,0.019629508,0.17032608,0.007677168,0.080604106,0.03169301,101,2017_Rl8iFsGGXD5o6W2TZb_7gg_0.jpg,1.33,103.71,a white bus driving down a street next to houses;a white bus driving down a street next to trees;a white bus driving down a street next to a building;a white bus driving down a road next to trees;a white bus driving down a road next to a forest
2017_KU8dWi5Mt9pAVrDj6fRL9A,0.52539235,0.033551157,0.018703252,0.13229007,0.012979329,0.023656666,0.09618455,0.010293543,0.098841995,0.02954045,101,2017_KU8dWi5Mt9pAVrDj6fRL9A_0.jpg,1.17,104.02,two motorcycles parked in front of a building;a couple of motorcycles parked in front of a building;two motorcycles parked in front of a small building;a couple of motorcycles parked in front of a house;a motorcycle parked in front of a building
