2017_-9Nr6_3H1qy7xZZqmr-xDQ,0.3598333,0.024791837,0.019836485,0.2204634,0.011312276,0.021933049,0.20202738,0.008773834,0.08886954,0.043699235,301,2017_-9Nr6_3H1qy7xZZqmr-xDQ_0.jpg,1.34,103.48,a dirt road with trees on each side;a dirt road that is lined with trees;a dirt road that is next to some trees;a dirt road with trees on both sides;a dirt road that is next to a dirt road
2017_mLY2JcGE_46Kh0YKRCSxEA,0.2977447,0.029950738,0.021801919,0.28191012,0.014143646,0.029297113,0.21100178,0.011060268,0.10645944,0.054847956,301,2017_mLY2JcGE_46Kh0YKRCSxEA_0.jpg,1.28,103.51,a view of a road with a cloudy sky;a long road that has a long line of grass on it;a long road with a long line of trees on each side;a long road with a long line of trees on it;a long road with a long line of trees on both sides
2017_aGHCU_tFSq4yv7tP3eVrNQ,0.3133875,0.029548913,0.019605577,0.2546183,0.013530284,0.026722968,0.18735054,0.009908795,0.11143413,0.0492478,301,2017_aGHCU_tFSq4yv7tP3eVrNQ_0.jpg,1.42,103.6,a view of a street with a sky background;a long road with a long line of traffic lights;a long road with a long line of traffic;a long road with a long line of traffic signs;a long road with a long line of traffic signs on it
2017_trJ2RnYduPpdCyyibUY9bw,0.5749703,0.062874615,0.033614427,0.122174025,0.02682665,0.04205489,0.08810383,0.019832253,0.14450899,0.03635317,101,2017_trJ2RnYduPpdCyyibUY9bw_0.jpg,1.38,103.85,cars parked on the side of the road;cars parked on the side of the street;a view of a street from a car window;a road with cars parked on the side of it;cars parked on the side of a road near trees
2017_ffFk1-fwgVTS0KmqMUKf2g,0.42667404,0.022073388,0.021200538,0.13802296,0.008813381,0.015598446,0.21614337,0.007913321,0.070693344,0.033180594,502,2017_ffFk1-fwgVTS0KmqMUKf2g_0.jpg,1.34,103.73,a view of a residential area from a house;a view of a street with a few trees;a view of a street corner with a building in the background;a view of a street with a few trees in the background;a view of a street with a few trees and bushes
2017_4SOhcTND_hOKftsWE4ZKMw,0.395111,0.024234176,0.019652188,0.17412773,0.010373205,0.017957568,0.19283476,0.008738071,0.07668513,0.03697759,101,2017_4SOhcTND_hOKftsWE4ZKMw_0.jpg,1.02,104.07,a motorcycle driving down a road next to a forest;a motorcycle is driving down a road in the country;a motorcycle driving down a road next to a green forest;a motorcycle is driving down a road with a car;a motorcycle is driving down a road with many wires above
2017_TK6hhiE4ruY3FYTTZ5Q9KA,0.4572519,0.02396056,0.015935421,0.15410295,0.00957042,0.019566745,0.16358298,0.007559091,0.09154639,0.031216204,101,2017_TK6hhiE4ruY3FYTTZ5Q9KA_0.jpg,1.34,103.84,a view of a city street from the street;a view of a street from the street;a view of a city street from an intersection;a view of a street with buildings and trees;a view of a city street from the side of the road
2017_So6cREucMUVqOaQ9H2cPdA,0.43130326,0.02650091,0.015505016,0.1796284,0.011696965,0.023473352,0.1445871,0.008194119,0.11124462,0.034778893,101,2017_So6cREucMUVqOaQ9H2cPdA_0.jpg,1.34,103.79,a view of a road from the side of a road;a view of a road with trees and bushes;a view of a road with trees and bushes on it;a view of a road with a long line of trees;a view of a road with a long line of trees on the side
2017_17zl3fxiCqNOLTwA0b99Sg,0.2816862,0.034391135,0.02239263,0.32113987,0.016627878,0.03459519,0.17856887,0.011889696,0.13214567,0.058415562,301,2017_17zl3fxiCqNOLTwA0b99Sg_0.jpg,1.47,103.74,a long empty road with houses on both sides;a long empty road with houses on each side;a road that has a few houses on it;a road with houses on the side and houses in the background;a road with houses on the side and houses on each side
2017_kYcsMi303Rc6r2qcYh_T_A,0.3541816,0.06860444,0.034722537,0.2778515,0.03770256,0.06747565,0.11395085,0.02438426,0.26161152,0.06873709,301,2017_kYcsMi303Rc6r2qcYh_T_A_0.jpg,1.34,103.71,a highway with lots of cars driving under a bridge;a highway with lots of cars under a bridge;a highway with lots of traffic under a bridge;a highway with lots of traffic on it;a highway with lots of cars driving under a cloudy sky
2017_dRNONOhQyYe-e-FMAsyyYw,0.6564383,0.043950766,0.038462847,0.058619946,0.01129967,0.019315273,0.07856512,0.012561411,0.0523628,0.017381936,101,2017_dRNONOhQyYe-e-FMAsyyYw_0.jpg,1.3,103.85,a couple of cars driving down a street;a couple of cars driving down a street next to tall buildings;a couple of cars driving down a city street;a couple of cars driving down a road;a couple of cars driving down a street past tall buildings
2017_5CFsC2E6MXlnVR4EU1yi1w,0.5401872,0.029911846,0.016323209,0.12230733,0.011191785,0.022276223,0.10872176,0.008388817,0.0957005,0.027008474,101,2017_5CFsC2E6MXlnVR4EU1yi1w_0.jpg,1.35,103.97,a empty street in front of a large building;a empty street in front of a large white building;a empty street in front of a building;a empty street in front of a big building;a view of a street from the side of the road
2017_SSvrJQcydEmDCX8d7b2SGA,0.3175902,0.043147504,0.025719821,0.29098153,0.02581963,0.04439029,0.13727912,0.014602095,0.20461944,0.063937634,301,2017_SSvrJQcydEmDCX8d7b2SGA_0.jpg,1.29,103.63,a road with a long line of green grass;a road with a long line of green grass on it;a paved road with a fence to the side;a road with a long line of green grass on the side;a road with a long line of green grass on the side of it
2017_u7H4lQuv9sNVhouy8AZBWw,0.32757488,0.029601008,0.019589096,0.26793212,0.01389432,0.025702417,0.16185346,0.009761721,0.11581111,0.048701108,301,2017_u7H4lQuv9sNVhouy8AZBWw_0.jpg,1.06,103.94,a truck driving on a sandy beach near the ocean;a truck driving on a sandy beach next to the ocean;a person is standing in the middle of a desert;a person is standing in the middle of a desert field;a car driving down a sandy beach next to a field
2017_dT0GokoXQ3dFg_4yDsSQ-Q,0.5767375,0.034285784,0.019691408,0.10660949,0.01215601,0.023120672,0.09573546,0.010252565,0.07603055,0.025349766,101,2017_dT0GokoXQ3dFg_4yDsSQ-Q_0.jpg,1.31,103.88,cars parked on the side of the road;cars parked on the side of the street;a car driving down a street next to tall buildings;a car driving down a street next to a building;a car driving down a street next to a green tree
2017_nquaIKtru16lixfitmUScg,0.2932314,0.030935645,0.025737256,0.30180818,0.015209079,0.0316312,0.23818073,0.01312837,0.09782392,0.06556553,301,2017_nquaIKtru16lixfitmUScg_0.jpg,1.45,103.78,an open field with a white fire hydrant;an open field with a large white fire hydrant;an open field with water and grass on it;an open field with water and grass on the ground;an open field with a white fire hydrant in it
2017_y_Hkiq7fHB_raXtV7XMU0w,0.5549755,0.02717644,0.017211556,0.10348499,0.009263128,0.018123537,0.104294986,0.008372873,0.068534136,0.023175925,101,2017_y_Hkiq7fHB_raXtV7XMU0w_0.jpg,1.31,103.76,a car driving down a street past tall buildings;a car driving down a street next to tall buildings;a car driving down a road next to tall buildings;a car driving down a city street with tall buildings;a car driving down a street next to a tall building
2017_DiO_d4dtQGzFWzGW3IdrtQ,0.26684183,0.03555718,0.02424863,0.32819337,0.017348826,0.035470396,0.19687402,0.012802094,0.13740051,0.06383699,301,2017_DiO_d4dtQGzFWzGW3IdrtQ_0.jpg,1.37,103.77,an empty street with a sky background;a street with a long line of traffic;an empty road with a long line of traffic;an empty road with a long line of power lines;an empty street with a sky background and trees
2017_4jKfkIddMNqFLPAUd1vm3A,0.60468554,0.041871607,0.024679005,0.10528493,0.01579836,0.027177066,0.08411443,0.01337117,0.088113606,0.026761323,101,2017_4jKfkIddMNqFLPAUd1vm3A_0.jpg,1.48,103.65,a truck parked on the side of the road;a white truck parked on the side of a road;a truck parked on the side of a road;a white truck parked on the side of a street;a white truck driving down a street next to a tall building
2017_M4uCNBSyZtA3lqWxru7oxQ,0.6407024,0.047878206,0.057807922,0.05226627,0.01203838,0.018395096,0.081195354,0.014519662,0.047172695,0.01799789,101,2017_M4uCNBSyZtA3lqWxru7oxQ_0.jpg,1.3,103.84,a street with cars and people walking on it;a street with cars and people walking down it;a street that has cars parked on it;a street with cars and people walking on the sidewalk;a street with cars and people walking on the street
2017_bwEovUZOcGFrPxq4gOFZzQ,0.4689389,0.03256291,0.018626422,0.16144037,0.013645291,0.026798636,0.10857046,0.009940267,0.12029374,0.03387162,101,2017_bwEovUZOcGFrPxq4gOFZzQ_0.jpg,1.32,103.94,a parking lot with a building and palm trees;a parking lot with houses and palm trees;a parking lot with a building and palm tree;a parking lot with a few houses in the background;a parking lot with a building and palm trees in the background
2017_LygCeBMgf1-1wLep4HYSnw,0.4513756,0.055963427,0.02884382,0.19636703,0.025404036,0.04570037,0.09996915,0.01779151,0.20070422,0.04778105,504,2017_LygCeBMgf1-1wLep4HYSnw_0.jpg,1.32,103.89,an empty parking lot with a building in the background;an empty parking lot with a large building in the background;a car driving down a street past a tall building;a car driving down a street past a building;an empty parking lot with a large building on the side
2017_7eoKLmzpOZfAOYfLkUSi8A,0.3091111,0.030647576,0.01992175,0.27851135,0.014432102,0.029904962,0.1879363,0.010704488,0.10622284,0.053996325,301,2017_7eoKLmzpOZfAOYfLkUSi8A_0.jpg,1.41,103.86,a car driving down a road next to a forest;a car driving down a road next to a field;a car driving down a road past a forest;a car driving down a road next to a lush green field;a car driving down a road next to a lush green forest
2017_9CdUN6eYQyQ5IYkxyDgpQg,0.419574,0.034146726,0.018737584,0.18936887,0.014898837,0.02890557,0.13489828,0.010177344,0.1511052,0.038324147,101,2017_9CdUN6eYQyQ5IYkxyDgpQg_0.jpg,1.46,103.82,a view of a road from a car window;a view of a road with a car driving down it;a view of a street from the side of a road;a view of a road from a car;a view of a street with a car driving down the road
2017_ueFIAfDo_vOKqTf1hpZlGw,0.53617156,0.065501004,0.035955846,0.13692889,0.029000372,0.043055832,0.09052378,0.020356834,0.16927823,0.040542632,101,2017_ueFIAfDo_vOKqTf1hpZlGw_0.jpg,1.46,103.97,a group of cars parked in a parking lot;a group of cars are parked in a parking lot;a group of cars parked on the side of a road;a group of cars are parked in a lot;a group of cars parked on the side of the road
2017_CBVk06vDfwVsCZ_buZohJg,0.33205014,0.03411475,0.020969689,0.26415658,0.01752776,0.033726037,0.15854013,0.011357129,0.15180317,0.048111647,301,2017_CBVk06vDfwVsCZ_buZohJg_0.jpg,1.47,103.64,a road with a few cars driving down it;a long road with a few clouds overhead;a road with a few cars driving on it;a view of a street from a vehicle;a view of a street from a car window
2017_TbiN8Oq1VUmqs2la_6bRNQ,0.3036061,0.03566265,0.02152276,0.2881832,0.018391967,0.03568399,0.1736424,0.012198746,0.15066311,0.056467712,301,2017_TbiN8Oq1VUmqs2la_6bRNQ_0.jpg,1.42,103.72,a view of a road from a vehicle;a road that has a long road with trees in the background;a road that has a long road with trees on each side;a view of a road with a road and trees;a road that has a long road with a fence on it
2017_LCipSfyCKbLh0uRFpge84g,0.46916586,0.04843995,0.027365535,0.17300564,0.0212968,0.03670284,0.09647736,0.01497522,0.17023867,0.04111302,101,2017_LCipSfyCKbLh0uRFpge84g_0.jpg,1.32,103.75,a truck parked in a parking lot next to a building;a truck parked on the side of the road;a truck parked on the side of a road;a truck parked in a parking lot next to trees;a truck parked on the side of a street
2017_AMIjIq2Fq4gv7HSMS3ZbSw,0.5358939,0.024279118,0.016816735,0.099123985,0.00777632,0.016329676,0.15460157,0.007870317,0.05751431,0.02445966,101,2017_AMIjIq2Fq4gv7HSMS3ZbSw_0.jpg,1.33,103.65,a car driving down a road next to a building;a car driving down a street next to a tall building;a car driving down a street past a tall building;a car driving down a street next to a building;a car driving down a road next to a tall building
2017_RXfZWeBtVSV5J5XGn-kO0g,0.3512183,0.039809078,0.022464782,0.25356323,0.021472752,0.041376173,0.14819562,0.013237625,0.17152461,0.049454063,301,2017_RXfZWeBtVSV5J5XGn-kO0g_0.jpg,1.47,103.76,a road with a few cars driving down it;a road with a few cars driving on it;a road with a few cars on it;a road with a few cars parked on it;a road with a few cars parked on it and houses in the background
2017_qvLTHrxgldVpWyZE9j8CKA,0.40554896,0.049079627,0.025047928,0.2316972,0.024848491,0.04073006,0.10294214,0.015609175,0.20007649,0.05033675,301,2017_qvLTHrxgldVpWyZE9j8CKA_0.jpg,1.32,103.67,a empty parking lot with houses in the background;a parking lot with a few houses in the background;a large empty parking lot with houses in the background;a empty parking lot with a few houses in the background;a empty parking lot with a few houses on each side
2017_VjH_uGU7YpqkuFNDy0fJhw,0.5809961,0.027569085,0.017277598,0.08541453,0.008445531,0.016908705,0.12443107,0.008215964,0.06344399,0.022497445,101,2017_VjH_uGU7YpqkuFNDy0fJhw_0.jpg,1.3,103.74,a view of a street from a car window;a view of a street from the side of a road;a view of a street from the side of the road;a view of a street from a vehicle;a view of a street from the side of a street
2017_O8Y-6oML-wlQ8uU7lL7RuA,0.68249387,0.039837867,0.03549698,0.045175523,0.009279937,0.016380936,0.09241772,0.013388485,0.039988816,0.016222954,101,2017_O8Y-6oML-wlQ8uU7lL7RuA_0.jpg,1.35,103.75,a car parked in front of a building;a white car parked in front of a building;a white car parked on the side of the road;a white car parked on the side of a street;a white car parked on the side of a road
2017_6qdWKpTLEBCVIwh4Un05pQ,0.4026736,0.023917884,0.016985387,0.18441495,0.010825694,0.02022621,0.15672979,0.007994235,0.10981357,0.035748363,101,2017_6qdWKpTLEBCVIwh4Un05pQ_0.jpg,1.05,103.95,a view of a city street from across the street;a view of a street with power lines above;a view of a street with power lines above it;a view of a city street with power lines in the background;a view of a city street with power lines and power lines
2017_d-iHD9LUKohPLewO9TWScg,0.3822597,0.02553472,0.017193586,0.2075563,0.011496693,0.022161156,0.16850713,0.008341253,0.11040062,0.037430465,301,2017_d-iHD9LUKohPLewO9TWScg_0.jpg,1.1,104.03,a long road with a street light next to it;an empty street with a street light and trees;an empty road with a street light and trees on the side;an empty road with a street light and a street sign;an empty road with a street light and trees on each side
2017_GudQjxXP9Ij0QW26QlT4jQ,0.6585613,0.034291655,0.032110214,0.043713987,0.008051157,0.014648438,0.118750215,0.011856198,0.036755353,0.016825974,101,2017_GudQjxXP9Ij0QW26QlT4jQ_0.jpg,1.43,103.79,a car parked on the side of a street;a car parked on the side of the road;a car parked on the side of a city street;a car parked on the side of the street;a car parked on the side of a road
2017_op8SbMfjbKELySO1zQz8yg,0.4594338,0.05077526,0.026747942,0.1920996,0.023100674,0.043168157,0.10371885,0.016293377,0.18324178,0.045638174,101,2017_op8SbMfjbKELySO1zQz8yg_0.jpg,1.33,103.79,an empty street with no cars on it;an empty street with no cars on the road;an empty street with no cars on the side;an empty street with a row of houses on each side;an empty street with a row of houses on the side
2017_UYlBSrimshxkKztLkfmFMg,0.60419345,0.037482023,0.019571334,0.1034227,0.012756497,0.025158614,0.092307866,0.010660887,0.08322412,0.024555713,101,2017_UYlBSrimshxkKztLkfmFMg_0.jpg,1.44,103.93,a view of a street from the side of the road;a view of a street from the side of a road;a view of a street with a few trees in the background;a view of a street with a few trees along the side;a view of a street with a few trees along the side of it
2017_-3fsY8kASqPB2rfiD4i-Xg,0.4659183,0.03054896,0.01669553,0.15444764,0.013328582,0.025452614,0.116065174,0.009038806,0.11681682,0.033634663,101,2017_-3fsY8kASqPB2rfiD4i-Xg_0.jpg,1.44,103.78,a car driving down a road next to a bus;a car driving down a road next to a bus stop;a car driving down a road next to a street;a car driving down a road next to a blue and white bus;a car driving down a street next to a bus stop
2017_9OSgDM0iuF8P05SWr1EJ4w,0.64650595,0.030913323,0.02483067,0.060637087,0.007903039,0.015195549,0.098973125,0.009140313,0.04873377,0.017454147,101,2017_9OSgDM0iuF8P05SWr1EJ4w_0.jpg,1.32,103.84,a white house on the corner of a street;a white house sitting on the side of a street;a white house sitting on the corner of a street;a white house sitting on the side of a road;a large white house sitting on the side of a street
2017_teq5yNhCTwX9KbY_p6Nf0g,0.66331834,0.05617121,0.05778709,0.05795893,0.015440643,0.022194326,0.07393184,0.017400265,0.055392444,0.019827038,101,2017_teq5yNhCTwX9KbY_p6Nf0g_0.jpg,1.48,103.4,a street with cars parked along side the road;a street with cars parked on the side of the road;a street with cars parked on the side of it;an empty street with a few cars parked on the side;a street with cars parked on the side of the street
2017_BBdZW6gHbc4JkO25P02MSg,0.3923663,0.024538457,0.017047495,0.18566182,0.010454893,0.020604998,0.18054655,0.008155882,0.09121907,0.037470788,101,2017_BBdZW6gHbc4JkO25P02MSg_0.jpg,1.38,103.95,an empty road surrounded by trees and grass;an empty road surrounded by some trees and grass;an empty road surrounded by green grass and trees;an empty road surrounded by a forest and trees;an empty road surrounded by green grass and a tree
2017_tCukiJWZCG7c2SuY0gsOAg,0.27177513,0.034975052,0.023124456,0.32944041,0.017725527,0.03722024,0.19782382,0.013094336,0.12245321,0.066550285,301,2017_tCukiJWZCG7c2SuY0gsOAg_0.jpg,1.46,103.62,a long road with a long line of trees;a long empty road with a long line of clouds;a long road with a long line of clouds in the sky;a long empty road with a long line of trees;a long empty road with a long line of clouds in the sky
2017_clI9yYpfsxryeI06ZY1oFw,0.51385903,0.033183396,0.049288183,0.058294892,0.009736329,0.013967574,0.22777146,0.012102097,0.04123202,0.027515143,502,2017_clI9yYpfsxryeI06ZY1oFw_0.jpg,1.31,103.78,an empty street in a residential neighborhood;an empty street in front of a two story house;an empty street in front of a white house;an empty street in front of a large white house;an empty street in front of a large house
2017_Mdkv8QwD0hdDg6__fDWM-A,0.3925708,0.03008148,0.017623752,0.22739768,0.0149391,0.027576804,0.13942993,0.009782016,0.13543096,0.041331828,301,2017_Mdkv8QwD0hdDg6__fDWM-A_0.jpg,1.27,103.83,a truck driving down a road next to a forest;a large truck driving down a road next to a forest;a truck driving down a street near a fence;a truck driving down a street near a forest;a truck driving down a road next to a park
2017_z7kWV4RvTgUrpxAeYLbOSA,0.32775974,0.06142971,0.032311946,0.3009701,0.035580605,0.06383416,0.12490189,0.021879703,0.26360944,0.07253954,301,2017_z7kWV4RvTgUrpxAeYLbOSA_0.jpg,1.28,103.63,a black and white photo of an empty parking lot;a black and white photo of a parking lot;a parking lot next to an empty parking lot;a black and white photo of an empty street;a black and white photo of a parking lot with a sky background
2017_5WolCcwaX-qWa_x6hYFA1A,0.32851434,0.0328815,0.019580007,0.2616916,0.015239954,0.030815393,0.17293707,0.010293514,0.13220528,0.047148883,301,2017_5WolCcwaX-qWa_x6hYFA1A_0.jpg,1.3,103.82,a white building sitting on the side of a road;a white building sitting on the corner of a street;a white building sitting on the side of a street;a white building sitting on the corner of a road;a white building sitting on the side of a road next to a street
2017_Wjc-hVk4D4CGPqABkWFEag,0.600869,0.03722897,0.030508548,0.075597376,0.010709286,0.018555433,0.09249881,0.009942621,0.069804996,0.021256357,101,2017_Wjc-hVk4D4CGPqABkWFEag_0.jpg,1.31,103.77,a view of a city skyline from a distance;a view of a city skyline from across the street;a view of a city skyline from the ground;a view of a city skyline from across the way;a view of a city skyline from across the city
2017_7boo5N2Mq0B5yCtqkVMUQA,0.45432988,0.041684955,0.02012667,0.18907619,0.020004451,0.035655975,0.10650954,0.013490498,0.1499435,0.041525632,101,2017_7boo5N2Mq0B5yCtqkVMUQA_0.jpg,1.35,103.96,a white car parked in a parking lot;a white car parked on the side of a road;a white car parked on the side of the road;a white car driving down a road next to a forest;a white car driving down a street next to a forest
2017_1WtQU00gY-UjHUeu-cWmrA,0.39742184,0.042157054,0.02118072,0.23466519,0.02123785,0.040465355,0.11095339,0.013680697,0.17886272,0.047731936,301,2017_1WtQU00gY-UjHUeu-cWmrA_0.jpg,1.39,103.76,an empty parking lot with a green and white fence;a view of a street with a green fence;a view of a street with trees and a fence;a view of a street from the side of a road;a view of a street with a green fence and trees
2017_h5iEJAoDaz5SXquiD_tGuQ,0.34148788,0.028410465,0.019262344,0.2532427,0.012948632,0.025523752,0.17312288,0.009284884,0.11597508,0.04320541,301,2017_h5iEJAoDaz5SXquiD_tGuQ_0.jpg,1.06,103.95,a white house sitting on the side of a road;a white house sitting on the side of a dirt road;a white house sitting on a dirt road;a dirt road with houses on the side;a white house sitting on the side of the road
2017_nQpzzGcbSjROfDHAIcE3BA,0.51212966,0.037938386,0.023249626,0.13463068,0.013429433,0.024243146,0.09227544,0.010458738,0.118943036,0.030672371,101,2017_nQpzzGcbSjROfDHAIcE3BA_0.jpg,1.4,103.75,an empty street with tall buildings in the background;a view of a city street from the street;a view of a city street with tall buildings;a view of a city street from a distance;a view of a city street from a street
2017__s8yn45ut29k4P70dZx1OA,0.414888,0.03126222,0.01735124,0.20440915,0.015350431,0.02685529,0.117955625,0.009898305,0.13846761,0.041110873,301,2017__s8yn45ut29k4P70dZx1OA_0.jpg,1.36,103.94,a parking lot in the middle of a parking lot;a parking lot in the middle of the day;an empty parking lot with a fence and trees in the background;a parking lot in the middle of the day time;an empty parking lot with a fence and trees
2017_G-DETxkKHSgqD003gwDFVA,0.4295234,0.026557505,0.018171608,0.1600439,0.011125565,0.021502614,0.17421952,0.008539736,0.08981025,0.033039093,101,2017_G-DETxkKHSgqD003gwDFVA_0.jpg,1.43,103.41,a boat in a large body of water;a boat in a body of water with a sky background;a large body of water with a boat in it;a boat in a body of water with a sky in the background;a boat in a large body of water with a sky in the background
2017_h1b0RZt385akxisPmkqcjg,0.45250148,0.025412709,0.015966445,0.1668973,0.011194438,0.020728022,0.13050276,0.008313328,0.106446624,0.03396803,101,2017_h1b0RZt385akxisPmkqcjg_0.jpg,1.32,103.74,a street view of a building and trees;a view of a building from the street;a view of a building from a sidewalk;a view of a city street from a distance;a view of a city street from the side
2017_lL4YWixqpYAtgsRKCnxpJQ,0.35882103,0.0641166,0.033627212,0.26048487,0.03292364,0.061071187,0.113197,0.022249341,0.25135463,0.06625649,301,2017_lL4YWixqpYAtgsRKCnxpJQ_0.jpg,1.4,103.7,a road with a long line of traffic lights;a empty road with a long line of traffic;a long road with a long line of traffic lights;a long road with a street light and a street light;a road with a long line of traffic lights on it
2017_JKy1MalNBinwNttB9IJr7g,0.6453577,0.029998899,0.02294448,0.060001522,0.007567585,0.015201509,0.10240582,0.009291917,0.045966953,0.017472893,101,2017_JKy1MalNBinwNttB9IJr7g_0.jpg,1.13,104.04,a view of a street from a car window;a road with a few houses on it;a long road with a few houses on both sides;a long road with a few houses on the side;a view of a street from the back of a truck
2017_CrjZySz1t6mgMbEKRcKYDw,0.44079244,0.036875665,0.018835515,0.19696298,0.016850889,0.03295359,0.11429787,0.011581063,0.14059901,0.03969145,101,2017_CrjZySz1t6mgMbEKRcKYDw_0.jpg,1.4,103.61,a road with a few cars parked on it;a road with a car parked on the side of it;a long road with cars parked on the side of it;a road with a few cars driving down it;a road with a few cars parked on the side
2017_bCULp6_M30AsRXoJXmyLRg,0.27674747,0.03419578,0.024267346,0.32300586,0.016259879,0.033312857,0.19561362,0.012347788,0.12567231,0.06359601,301,2017_bCULp6_M30AsRXoJXmyLRg_0.jpg,1.37,103.62,a narrow road with a mountain in the background;a narrow road with a mountain in the back;a narrow road between a forest and a dirt road;a long narrow road with a few trees on each side;a narrow road between some mountains and the side of the road
2017_fjMRVBcQ06xqfNDSLJ34Lw,0.38135406,0.03335443,0.019031644,0.23400313,0.01790762,0.030331463,0.12624636,0.010766685,0.16132307,0.046203047,301,2017_fjMRVBcQ06xqfNDSLJ34Lw_0.jpg,1.41,103.63,a long empty road surrounded by a forest;a long road with a few cars driving on it;a long road with a few cars on it;a long road with a few cars driving down the road;a long road with a long line of trees on it
2017_gPWzz8EDPEFxv4kXNE3-zw,0.33251157,0.026847899,0.01940611,0.2499161,0.012181044,0.024543494,0.19131216,0.009594888,0.0925363,0.046294957,301,2017_gPWzz8EDPEFxv4kXNE3-zw_0.jpg,1.1,104.07,a long road with green grass on each side;a long road with green grass on the side;a long road with green grass on it;a long road with green grass on each side and blue sky;a long road with green grass on it and a lamp post
2017_JuozOgLVNjuX6hMCrHvicw,0.67847896,0.05220905,0.054657876,0.05001208,0.01325807,0.020227939,0.07871726,0.016202986,0.04829353,0.01733017,101,2017_JuozOgLVNjuX6hMCrHvicw_0.jpg,1.32,103.86,a group of cars parked on the side of a road;a group of cars parked on a city street;a group of cars parked on the side of a street;a group of cars parked on the side of the road;a group of cars parked in front of a building
