2017_LcS5UschXYFsItkv9rVong,0.42409617,0.022640139,0.019497871,0.14732489,0.009054542,0.017280728,0.21084574,0.008002371,0.06331971,0.03358704,502,2017_LcS5UschXYFsItkv9rVong_0.jpg,1.39,103.85,a road with trees on each side;a road with trees on both sides of it;a road with trees on both sides and grass;a road with trees on each side and a forest in the background;a road with trees on each side and a fence
2017_HAYEl_2DsIOfSVxoC2sgTA,0.45686138,0.060147375,0.030631006,0.1815817,0.02615738,0.04770866,0.10079315,0.018497288,0.1950008,0.04722637,101,2017_HAYEl_2DsIOfSVxoC2sgTA_0.jpg,1.35,103.86,a group of construction cones on a road;a long road with construction cones on it;a group of construction cones on a street;a long road with a car parked on it;a long road that has a car driving down it
2017_ldh3Ti1gWSMLilrxUFVQ3A,0.43582147,0.023625761,0.017594784,0.16511342,0.009710759,0.019829154,0.15634301,0.007789075,0.10047689,0.03116867,101,2017_ldh3Ti1gWSMLilrxUFVQ3A_0.jpg,1.32,103.8,a street with a white house in the background;a street with a white house on it;a road with a white house on the side;a road with a white house on the side of it;a street with a white house in the center of it
2017_zwBerFmBrUgTGHwefxLdjg,0.5610488,0.0343889,0.01999098,0.1262058,0.013268709,0.024639338,0.087967396,0.010557324,0.09401631,0.027305454,101,2017_zwBerFmBrUgTGHwefxLdjg_0.jpg,1.31,103.73,a truck parked on the side of the road;a blue truck parked in a parking lot;a blue truck parked in front of a tall building;a truck parked on the side of a street;a truck parked on the side of a road
2017_B-ueE9boxZNeRD_FWLg5Ew,0.5078078,0.031753033,0.01856938,0.13437021,0.011023194,0.021966934,0.10408336,0.008494586,0.105654,0.028212965,101,2017_B-ueE9boxZNeRD_FWLg5Ew_0.jpg,1.35,103.73,an empty street with a building in the background;an empty street with a large building in the background;an empty street with a building in the back;an empty street with a building in the back ground;an empty street with a building in the background and a street light
2017_qaFYR8_T5i-Sw81sf81_1g,0.66521204,0.047652543,0.04700768,0.054065496,0.012220353,0.019320428,0.0770078,0.013894945,0.050307304,0.017114818,101,2017_qaFYR8_T5i-Sw81sf81_1g_0.jpg,1.3,103.9,a street with cars parked on the side of the road;a street with cars parked on the side of it;a street with cars parked on the side of the street;a view of a street with cars driving down the road;a street with cars parked on the side of the road and buildings in the background
2017_lr38bQiSfzKQrgoEI18aIw,0.6676636,0.05150643,0.055620164,0.05394283,0.013485372,0.020439804,0.07756376,0.015721828,0.050605685,0.018805236,101,2017_lr38bQiSfzKQrgoEI18aIw_0.jpg,1.38,103.84,a street with cars and a bike on it;an empty street with a bike lane and trees;an empty street with a car driving down it;an empty street with a car driving down the road;an empty street with a bike lane in the middle of it
2017_xL-jC9Zg9KtRqv5lfkVl3Q,0.46518138,0.031179816,0.016088486,0.18867663,0.014456481,0.027647704,0.10997939,0.009961814,0.12665564,0.03573808,101,2017_xL-jC9Zg9KtRqv5lfkVl3Q_0.jpg,1.32,103.63,a road that has some grass and a fence on it;a road that has some grass and some trees;a road that has some grass and some grass on it;a road that has some grass and a fence in it;a road that has some grass and some trees on it
2017_NPzvxfsSo1on8EWsHaihIA,0.4466141,0.029037863,0.032355815,0.1176742,0.010752887,0.019178659,0.304213,0.01166299,0.04900235,0.036970586,502,2017_NPzvxfsSo1on8EWsHaihIA_0.jpg,1.35,103.83,a wooden bench sitting next to a lush green forest;a wooden bench sitting next to a forest;a long wooden bench sitting next to a forest;a wooden bench sitting next to a lush green field;a long wooden bench next to a forest
2017_dQ_DHGnVnvqqkVqFSE3Tdg,0.32213092,0.03567192,0.024096012,0.2707898,0.018029064,0.030753493,0.1511277,0.011821419,0.17491463,0.050944477,301,2017_dQ_DHGnVnvqqkVqFSE3Tdg_0.jpg,1.44,103.62,a highway with a large grassy field in the background;a highway with a large grassy field on it;a long road with a long line of green grass;a highway with a large grassy field in the distance;a highway with a large grassy field on the side
2017_94n_nBYzuIgoov4KIKCZIA,0.39157575,0.035858065,0.02000603,0.22854179,0.018514901,0.03484717,0.12368071,0.011985838,0.1592072,0.045774788,301,2017_94n_nBYzuIgoov4KIKCZIA_0.jpg,1.28,103.83,a highway with a few cars driving down it;a highway with a few cars on it;a highway with a few cars driving down the road;a view of a city street from a car window;a view of a city street with a car driving down the road
2017_8PiuRgJsiPYzvQDjxwZEiw,0.63566357,0.049051702,0.038381428,0.08183625,0.016561717,0.024128228,0.07369834,0.015593171,0.076628655,0.023973912,101,2017_8PiuRgJsiPYzvQDjxwZEiw_0.jpg,1.34,103.76,a group of cars driving down a street;a group of cars driving down a road;a group of cars driving down a highway;a group of cars driving down the road;a group of cars driving down a street next to tall buildings
2017_n1Z23wtL7UsorADPbojgvg,0.26745707,0.04829672,0.028232962,0.3340121,0.027908236,0.05191022,0.15682337,0.017460316,0.20926106,0.07519376,301,2017_n1Z23wtL7UsorADPbojgvg_0.jpg,1.46,103.9,a road that has some trees on it;a road that has some trees on the side of it;a long road with a long line of trees;a long road with a lot of trees on it;a long road with a long line of trees on each side
2017_xBH5-esdHyYPe8ZqCf1FBQ,0.5357369,0.04107389,0.02028042,0.13781944,0.016013801,0.029159188,0.09332478,0.012193114,0.115548074,0.03131175,101,2017_xBH5-esdHyYPe8ZqCf1FBQ_0.jpg,1.48,103.9,an empty street with a few houses in the background;a empty street with a few houses in the background;an empty street with a few houses on each side;an empty street with a few houses on the side;an empty street with a few houses in the back
2017_2EpQHAF3AyU1wlzQ82-wpA,0.35683638,0.036289304,0.020289183,0.24600655,0.018320799,0.033548027,0.14518678,0.011476606,0.14580595,0.04520628,301,2017_2EpQHAF3AyU1wlzQ82-wpA_0.jpg,1.36,103.74,a road with trees on both sides of it;a view of a street from the side of the road;a view of a street from the side of a road;a road with trees on the side and trees on the side;a view of a street from the side of a highway
2017_8LDwtFQI6_D8A2P5Fdy4XA,0.46533912,0.043357015,0.021843404,0.18154284,0.020027876,0.037648797,0.10824576,0.013382614,0.15521553,0.04030949,101,2017_8LDwtFQI6_D8A2P5Fdy4XA_0.jpg,1.15,104.05,a car parked on the side of a road;a car parked on the side of the road;a car parked on the side of the road in the country;a car parked on the side of the road near a field;a car parked on the side of a road in the country side
2017_OPkD9TNUrkUX3ktDlImrqw,0.48561633,0.038603574,0.01817277,0.16431549,0.016531825,0.03248945,0.113309324,0.01081416,0.13557065,0.03616631,101,2017_OPkD9TNUrkUX3ktDlImrqw_0.jpg,1.43,103.77,a view of a road with a car driving down it;a view of a road with a car driving down the road;a blurry image of a street with trees and grass;a view of a road with a car driving on it;a view of a road with a car driving down a road
2017_PBEO4QBElphUha93QPJctQ,0.4015471,0.042921245,0.023284674,0.22708407,0.021068275,0.036486924,0.107252926,0.013839811,0.18628997,0.047671735,301,2017_PBEO4QBElphUha93QPJctQ_0.jpg,1.46,103.6,a long empty street with a building in the background;a long road with a few cars on it;a long road with a few houses on each side;a long road with a few cars parked on it;a long road with a few houses on the side of it
2017_rYuacPXkZzOSWh93E3y_RA,0.39789474,0.06596181,0.033037126,0.24240103,0.033515364,0.060642004,0.11226851,0.02253285,0.24669817,0.062308908,301,2017_rYuacPXkZzOSWh93E3y_RA_0.jpg,1.33,103.68,a view of a parking lot and trees;an empty parking lot with no one on it;an empty parking lot with no one in it;an empty parking lot with no one on the ground;an empty parking lot with no one on the floor
2017_Mx7-a_3eZ_lYN6loOS5-zw,0.6425134,0.03834918,0.023242623,0.08623746,0.012255698,0.023518622,0.08611223,0.011618644,0.06366518,0.020579219,101,2017_Mx7-a_3eZ_lYN6loOS5-zw_0.jpg,1.31,103.86,a red car is parked on the side of the road;a red car parked on the side of a street;a red car parked on the side of a road;a red car is parked on the side of the street;a street with a red car parked on the side of it
2017_qC8bUSjWX5DZ3mxZ294M-w,0.5597516,0.028686434,0.019954026,0.106482476,0.009647846,0.01887229,0.106474996,0.008027017,0.07949641,0.023462325,101,2017_qC8bUSjWX5DZ3mxZ294M-w_0.jpg,1.35,103.85,a view of a building from the side;a view of a building with a large window;a view of a building from the side of the street;a view of a building from the side of the road;a view of a building from the side of a building
2017_iawGMpKjDNhl3BWDLKbNpQ,0.47403088,0.022734672,0.01646185,0.13766092,0.008341134,0.016799152,0.15686306,0.007375777,0.08167377,0.027928263,101,2017_iawGMpKjDNhl3BWDLKbNpQ_0.jpg,1.05,103.96,a picture of a house with a bicycle outside;a view of a house with a bicycle outside;a view of a house from the side of the house;a view of a house from the side of the street;a view of a house from the side of the road
2017_E1GUByHhxlKFDAHIGlzaPQ,0.5262988,0.034635246,0.017969072,0.1456002,0.013874322,0.027252048,0.0970884,0.010452747,0.10538623,0.030698597,101,2017_E1GUByHhxlKFDAHIGlzaPQ_0.jpg,1.39,103.86,a car parked on the side of the road;a car parked on the side of the street;a car parked on the side of a street;a car parked on the side of the street near a building;a car parked on the side of the road near a fence
2017_QJz7lPNwgkHZJCUf-0t8RA,0.34611243,0.048413664,0.025458038,0.2773968,0.026714891,0.049246967,0.12490019,0.016397208,0.20999613,0.05944237,301,2017_QJz7lPNwgkHZJCUf-0t8RA_0.jpg,1.4,103.56,a view of an empty highway from the road;a view of an empty highway with a blue sky;a view of an empty highway with no traffic;a view of an empty highway from a vehicle;a view of an empty highway with no cars
2017_Vn4fvyzlei3z_J5ae0n9rg,0.26114497,0.035719484,0.025962532,0.333128,0.018638104,0.03777778,0.2159166,0.013631403,0.13424176,0.068119526,301,2017_Vn4fvyzlei3z_J5ae0n9rg_0.jpg,1.27,103.51,a view of a road from a distance;a view of a street from a vehicle;a view of a street from a car window;a view of a road from the side of a road;a view of a street from the top of a vehicle
2017_o6ky8bytvX0fuMELe3OxQA,0.39991906,0.06501123,0.034278512,0.2287094,0.031073004,0.05374065,0.10561502,0.021084249,0.239265,0.0591307,301,2017_o6ky8bytvX0fuMELe3OxQA_0.jpg,1.48,103.63,a street sign on the side of the road;a street sign on the side of a road;a street sign on the corner of a highway;a street sign on the side of a highway;a street sign on the corner of a road
2017_U6xDqaNN1y7cCfhhhPPrsw,0.6064408,0.030066311,0.028757095,0.05650264,0.007725447,0.014611334,0.13813728,0.010032833,0.045687735,0.01926291,101,2017_U6xDqaNN1y7cCfhhhPPrsw_0.jpg,1.28,103.87,a row of white umbrellas sitting on the side of a road;a group of white umbrellas sitting on the side of a road;a row of white umbrellas sitting on the ground;a row of white umbrellas sitting on the side of a street;a group of white umbrellas sitting on the side of a street
2017_tv7HpNz60FaoBZEBDx0bPg,0.21125174,0.057510644,0.03592819,0.42138064,0.035338342,0.07182816,0.21086976,0.023502022,0.20939973,0.10630956,301,2017_tv7HpNz60FaoBZEBDx0bPg_0.jpg,1.39,103.69,a train traveling through a lush green countryside;a train traveling through a lush green field;a train traveling through a lush green hillside;a view of a grassy field with clouds in the sky;a view of a grassy field with clouds in the background
2017_MacbaqLCVT5ETXtlTONnGQ,0.2490131,0.039888054,0.02658102,0.36423382,0.021170676,0.042490274,0.19863826,0.014684498,0.15016624,0.07273987,301,2017_MacbaqLCVT5ETXtlTONnGQ_0.jpg,1.32,103.47,a long road with power lines in the background;a long road with power lines above it;a long road with power lines and power lines above it;a long road with power lines in the back;a long road with power lines in the back of it
2017_XK4JF-xCvVEjc_3yti1kmg,0.5729274,0.028510332,0.020713866,0.09339538,0.008729905,0.017113805,0.10702297,0.0077793,0.06936321,0.021693796,101,2017_XK4JF-xCvVEjc_3yti1kmg_0.jpg,1.36,103.88,a long row of buildings on a city street;a long row of buildings with a grassy field in the background;a long row of buildings with a green grass field in the background;a long row of buildings on a street with a fence;a long row of buildings with a grassy field in front of it
2017_dU99wW7NxtCEJxRGurBClQ,0.3874261,0.07383764,0.0368478,0.24351442,0.03471881,0.06996286,0.11468896,0.0245049,0.2526163,0.06370807,301,2017_dU99wW7NxtCEJxRGurBClQ_0.jpg,1.27,103.86,a view of a city from a street;a view of a city skyline from the street;a view of a city street from the side;a view of a city street from a high way;a view of a city street from the side of a road
2017_tDbUHTd4nAse6IEHX65SnA,0.30233622,0.029171735,0.022245646,0.288384,0.013612062,0.027955383,0.20059842,0.011066288,0.102482736,0.056233764,301,2017_tDbUHTd4nAse6IEHX65SnA_0.jpg,1.16,104,a sandy field next to a wooden fence;a sandy area with lots of dirt and grass;a sandy field next to a fence and trees;a sandy field next to a fence with a sky background;a sandy field next to a fence and a field
2017_EreRhJkyh6LWa4-18oxTQA,0.5155903,0.045054525,0.024967581,0.14463791,0.018463522,0.033287764,0.09288782,0.01333493,0.1390357,0.035939217,101,2017_EreRhJkyh6LWa4-18oxTQA_0.jpg,1.35,103.94,a white car parked on the side of a street;a white car parked on the side of the road;a car parked on the side of the road;a white car parked on the side of a city street;a white car parked on the side of a road
2017_MJx-6nJN9sqI3xfeLz3_Tg,0.5685732,0.02632907,0.02308914,0.07621673,0.007314682,0.013130128,0.13427123,0.007339805,0.058543563,0.0211671,101,2017_MJx-6nJN9sqI3xfeLz3_Tg_0.jpg,1.38,103.94,a view of a building from the street;a view of a building from the side of a street;a view of a building from the side of the road;a view of a building from the side of a road;a street view of a building and a street sign
2017_LA3DfOIMWvC8y097FMxENw,0.557841,0.024426073,0.017048627,0.0877434,0.007773668,0.015647411,0.1354447,0.007767588,0.05919203,0.022962272,101,2017_LA3DfOIMWvC8y097FMxENw_0.jpg,1.39,103.93,two people riding motorcycles on a city street;a couple of people that are on a motorcycle;a couple of people riding motorcycles down a road;a couple of people riding motorcycles down a street;a couple of people that are sitting on a motorcycle
2017_7HZP8tpGUlF_BQk9MAEC-A,0.44059062,0.04932469,0.029418558,0.18737069,0.020228356,0.03693509,0.10134539,0.014223337,0.1834237,0.044979185,101,2017_7HZP8tpGUlF_BQk9MAEC-A_0.jpg,1.45,103.83,a view of an empty street from the street;a view of a city street from a distance;a view of an empty street from the side of the road;a view of a city street from a high rise;a view of a city street from a high angle
2017_I1q25_3cQa4OSzb31eeLJQ,0.4251376,0.025310963,0.01716566,0.18855157,0.01044485,0.020630032,0.15077162,0.007899106,0.10500926,0.03183791,101,2017_I1q25_3cQa4OSzb31eeLJQ_0.jpg,1.47,103.65,a empty street with houses in the background;a street with houses in the background;a street with houses in the background and houses;a street with houses in the background and houses in the background;a street with houses in the background and houses on the side
2017_A5VAO8KXdSlNytkt2Kpmww,0.46987522,0.034490228,0.01749888,0.1846363,0.016734064,0.02930978,0.11111504,0.011088491,0.12724495,0.037810355,101,2017_A5VAO8KXdSlNytkt2Kpmww_0.jpg,1.11,104.06,a car driving down a street next to a field;a road with a few cars parked on the side of it;a road with a few cars parked on the side of the road;a car driving down a road next to a field;a road with a few cars parked on the side
2017_rVq3MDc2pZV-6htRiLnL1A,0.30338746,0.046504647,0.028744638,0.30024388,0.024885982,0.046265483,0.14748698,0.01584056,0.21895981,0.062093765,301,2017_rVq3MDc2pZV-6htRiLnL1A_0.jpg,1.44,103.64,an empty highway with a lot of clouds in the sky;an empty highway with a lot of clouds overhead;a view of a street with a sky background;an empty highway with a lot of clouds and clouds;an empty highway with a lot of clouds around
2017_sSIh8k9cAx_NDEUR1Iiw2w,0.43868345,0.048995554,0.028255433,0.18809259,0.02222234,0.04178661,0.106080264,0.015213549,0.18383232,0.046848387,101,2017_sSIh8k9cAx_NDEUR1Iiw2w_0.jpg,1.37,103.88,a view of a city street from the street;a view of a city street from the side of the road;a view of a street with a bus driving down the road;a view of a city street from the side of a road;a view of a street with a bus driving on it
2017_Y43XEOu2UV4TQWkrE9ODmA,0.5708449,0.027356714,0.016306818,0.11054289,0.009199083,0.019686699,0.11244938,0.008008271,0.07588065,0.023488283,101,2017_Y43XEOu2UV4TQWkrE9ODmA_0.jpg,1.28,103.79,a narrow street with houses on each side;a long road with houses on both sides;a long road with houses on each side;a narrow street with houses on both sides;a long road with houses on each side and a sky background
2017_ghZRkWhaSiG8x1Q3rDPpww,0.46333653,0.030339986,0.015951335,0.18290815,0.014188468,0.025810122,0.117787,0.009529531,0.11763987,0.03462082,101,2017_ghZRkWhaSiG8x1Q3rDPpww_0.jpg,1.47,103.94,a car driving down a road next to houses;a car driving down a street next to houses;a car driving down a street past houses;a street with houses on both sides of it;a car driving down a road next to houses and houses
2017_N-o-YzC0lZDgTrLwkMMr7A,0.3931904,0.030945003,0.018543184,0.21285489,0.015100956,0.027309388,0.12690583,0.009918302,0.1484069,0.04338056,301,2017_N-o-YzC0lZDgTrLwkMMr7A_0.jpg,1.29,103.87,a view of an empty street from the side;a view of an empty road from the side of the road;a view of an empty street from the side of the road;a view of an empty street from behind a car;a view of an empty street from the side of a road
2017_nKq6YITK5ZAB8e1zBAGc2g,0.31821316,0.028490543,0.024651885,0.2526579,0.013258427,0.026615053,0.24264514,0.011496931,0.08307928,0.057213902,301,2017_nKq6YITK5ZAB8e1zBAGc2g_0.jpg,1.45,103.95,a narrow road surrounded by some trees;a narrow road surrounded by a lush green forest;a narrow road surrounded by a lush green field;a narrow road surrounded by green grass and some trees;a narrow road surrounded by a lush green park
2017_YJGuQTYXM5XBBAlb8fwIrA,0.3850865,0.05590287,0.03024739,0.24970475,0.030319482,0.050657243,0.11242694,0.019608438,0.23327315,0.060070664,301,2017_YJGuQTYXM5XBBAlb8fwIrA_0.jpg,1.35,103.74,a view of an empty parking lot and trees;a view of an empty parking lot and a tree;a view of an empty parking lot with trees and grass;a view of an empty parking lot with a view of trees;a view of an empty parking lot with a view of a city
2017_LlGvmiNJbQsV_tYkodcFQQ,0.5824807,0.028452367,0.016320795,0.102326155,0.009200305,0.01943177,0.1151028,0.008472085,0.07373014,0.023077458,101,2017_LlGvmiNJbQsV_tYkodcFQQ_0.jpg,1.31,103.92,a red car parked on the side of a road;a red car driving down a street past houses;a red car parked on the side of a street;a red car parked on the side of the road;a red car driving down a street next to a tall building
2017_BtRpopUgI6U_rO6zzW0gYw,0.41438147,0.025361449,0.018156856,0.17049846,0.011146396,0.020707965,0.17857,0.008294135,0.09347099,0.033738613,101,2017_BtRpopUgI6U_rO6zzW0gYw_0.jpg,1.38,103.64,a boat floating in a large body of water;a boat floating in the middle of a body of water;a boat floating on top of a lake next to a shore;a large body of water with a boat floating on it;a boat floating on top of a lake next to a building
2017_NV6ZD_5NTWxC89ytt-La0w,0.3628412,0.023572087,0.021764874,0.19913992,0.010096192,0.0179936,0.20786062,0.008658767,0.07598165,0.04069519,502,2017_NV6ZD_5NTWxC89ytt-La0w_0.jpg,1.03,103.95,a field that has a few houses on it;a field that has a few trees in it;a field that has a few cars on it;a field that has a few houses in it;a field with a large hill in the back ground
2017_YBS4fW7lFjz055mD1JgwfA,0.38897264,0.083538145,0.04462838,0.24818784,0.040784657,0.07293278,0.1060043,0.028647631,0.27836654,0.07173395,301,2017_YBS4fW7lFjz055mD1JgwfA_0.jpg,1.47,103.62,an empty highway with no cars on it;an empty highway with a lot of clouds in the sky;an empty highway with a few cars parked on the side;an empty highway with a few cars parked on it;an empty highway with a lot of clouds in the background
2017_mMJ_MNSivuhEpMwNlFml0A,0.5813386,0.027282715,0.020032436,0.085106164,0.008573622,0.016411394,0.10544282,0.008511692,0.053287685,0.021472663,101,2017_mMJ_MNSivuhEpMwNlFml0A_0.jpg,1.03,104.05,a truck parked on the side of a road;a truck parked on the side of the road;a truck parked on the side of a street;a truck is parked on the side of a road;a truck parked on the side of a road near a building
2017_1BL95W-Rn_o3UAsEHw1oxg,0.41903642,0.023076594,0.017175555,0.16283363,0.009683818,0.017837465,0.16536576,0.007886201,0.08414981,0.03369403,101,2017_1BL95W-Rn_o3UAsEHw1oxg_0.jpg,1.1,103.96,a road that has some trees on it;a road that has some grass on it;a long road with a motorcycle driving down it;a long road with a motorcycle driving down the road;the view of a road from the side of the road
2017_dTpQOsyiOO5I902QnBtnJw,0.44751912,0.02642554,0.015442282,0.1812172,0.012595177,0.022766769,0.11934972,0.008615732,0.11885393,0.03487903,101,2017_dTpQOsyiOO5I902QnBtnJw_0.jpg,1.11,104.04,a large body of water with trees in the background;a large body of water with a bridge in the background;a large body of water in the middle of a yard;a large body of water in the middle of a city;a large puddle of water in the middle of a dirt field
2017_nGbLn90wF8uCjYkdY_2WKw,0.3562596,0.026008219,0.017968506,0.22435,0.012078315,0.021996439,0.16425371,0.00846529,0.107188076,0.04107091,301,2017_nGbLn90wF8uCjYkdY_2WKw_0.jpg,1.47,103.89,a car driving down a road next to a forest;a car driving down a road next to a building;a view of a street from a car window;a view of a street from a vehicle window;a car driving down a road next to a field
2017_G26oQSSRxyTuCX9XaOYe2Q,0.55293924,0.0254699,0.01842001,0.089962006,0.007716566,0.015981048,0.16503805,0.008371115,0.05463758,0.023821771,101,2017_G26oQSSRxyTuCX9XaOYe2Q_0.jpg,1.33,103.95,a view of a street from inside a car;a car driving down a street next to a house;a car driving down a street next to a building;a view of a street from a car window;a car driving down a road next to a house
2017_Bu9gUtlSlDzuDPiyRDwByQ,0.42466983,0.05388847,0.031116754,0.20002434,0.023925304,0.040261388,0.098338336,0.01640141,0.20239305,0.04850748,301,2017_Bu9gUtlSlDzuDPiyRDwByQ_0.jpg,1.46,103.77,a long road with a bunch of construction work on it;a long road with a few traffic cones on it;a long road with a lot of traffic on it;a long road with a bunch of traffic on it;a long road with a bunch of construction cones on it
2017_tSmGu4p3wASDFCFtlYzsZw,0.2535948,0.039196163,0.02878341,0.36640036,0.02171427,0.045756698,0.23807451,0.016733915,0.1190196,0.08771747,301,2017_tSmGu4p3wASDFCFtlYzsZw_0.jpg,1.37,103.48,a train traveling down a road next to a forest;a train traveling down a road surrounded by trees;a train traveling down a road next to a lush green forest;an empty road with a train on the side;an empty road with a train on the track
2017_eQBVyZTyAOZ78p3m9CPpDQ,0.47883993,0.063599944,0.030890584,0.18396288,0.030718476,0.05189562,0.101486504,0.019697458,0.19611135,0.048819125,101,2017_eQBVyZTyAOZ78p3m9CPpDQ_0.jpg,1.28,103.84,a long road with cars driving down it;a long road with cars driving on it;a long road with some cars driving down it;a long road with cars driving down the road;a long road with cars driving on top of it
2017_QwbzWUbK--zeiaEqcnGKAg,0.6421509,0.034666687,0.022499114,0.07966119,0.010659725,0.020706207,0.08597869,0.010863721,0.056579024,0.019145459,101,2017_QwbzWUbK--zeiaEqcnGKAg_0.jpg,1.38,103.89,a car parked on the side of the road;a car parked on the side of a street;a car parked in front of a building;a car parked on the side of the street;a car parked on the side of a road
2017_4H5hgdngK0OTypv3-JqzFg,0.5807332,0.032793283,0.041093796,0.047519088,0.008934796,0.013656199,0.18429327,0.012224019,0.03509,0.021768421,101,2017_4H5hgdngK0OTypv3-JqzFg_0.jpg,1.31,103.93,a group of people riding bikes down a road;a group of people riding bicycles down a road;a group of people riding bicycles down a street;a group of people riding bikes down a street;a group of people on bicycles riding down a road
2017_q89uHNTj9pfL_oWn-Benhw,0.33083114,0.06553516,0.032788455,0.30094624,0.0356614,0.06835878,0.1256442,0.022781074,0.25335652,0.069562495,301,2017_q89uHNTj9pfL_oWn-Benhw_0.jpg,1.48,103.86,a view of a road with a cloudy sky;a view of a road from a road;a view of a road with a few trees in the background;a view of a road with a cloudy sky in the background;a view of a road with a few trees on the side
2017_DvfApkhzZvnsex25INj3ag,0.3295625,0.030296206,0.01927343,0.25751513,0.01438579,0.028350353,0.16361132,0.009961695,0.1284186,0.04620731,301,2017_DvfApkhzZvnsex25INj3ag_0.jpg,1.46,103.74,an empty road with a fence next to it;an empty road with a fence on each side;an empty road with a fence to the side;an empty road with a fence on each side of it;an empty road with a fence on each side of the road
2017_tJ-msCCUDdeoQIH9h67n4w,0.45767367,0.023801327,0.015103012,0.17068481,0.010292321,0.020507067,0.14024532,0.007578135,0.09619713,0.030556023,101,2017_tJ-msCCUDdeoQIH9h67n4w_0.jpg,1.11,104.08,an empty street with a few houses next to it;an empty street with a few houses in the background;a view of a street from the side of the road;a view of a street from the side of a road;a view of a street from the side of a street
