OBJECTID,description,tags,lat_wgs,lon_wgs,pov_exp,heading,orgid,nid,captions,scene,label
425,Ｇ３１６,GENERAL,30.539215023099999,114.320135246000007,2.000000000000000,256.000000000000000,10141003150321155833856.000000000000000,10141003150321155019300_right_337.jpg,a white van driving down a street next to tall buildings;a white car driving down a street next to tall buildings;a group of cars driving down a city street;a group of cars driving down a street;a group of cars driving down a busy city street,a white truck driving down a city street ; cars are parked on the side of the street ; a city street filled with traffic and tall buildings ; a white van driving down a street next to tall buildings,8
426,长湖南路,GENERAL,30.538840664799999,114.302562367999997,2.000000000000000,353.000000000000000,10141006121127139868672.000000000000000,10141006121127140314500_right_156.jpg,a group of people walking down a sidewalk;a couple of people walking down a sidewalk;a group of people walking down a sidewalk near a building;a couple of people walking down a sidewalk next to a building;a group of people walking down a sidewalk next to a building,a narrow street in a small town ; a person riding a bike down a sidewalk ; a bicycle is parked outside of a store ; a group of people walking down a sidewalk,2
427,赫山路,GENERAL,30.568072968000003,114.216207474000001,2.000000000000000,22.000000000000000,10141057150531133243392.000000000000000,10141057150531133901600_right_123.jpg,a man standing in front of a building;a man is standing outside of a building;a man standing in front of a building next to a street;a man standing next to a building near a street;a man standing next to a building near a building,a group of vehicles driving down a city street ; a couple of vehicles that are sitting in the street ; a black car parked in front of a large sign ; a man standing in front of a building,10
428,,GENERAL,30.587800909799999,114.274297168000004,2.000000000000000,314.000000000000000,10141050150718160240640.000000000000000,10141050150718160800200_right_291.jpg,a white bus parked in front of a building;a white bus driving past a tall building;a white bus parked next to a building;a white bus parked on the side of a road;a white bus driving down a street next to tall buildings,a row of buildings on a city street ; a group of cars that are sitting in the street ; a truck parked on the side of the road ; a white bus parked in front of a building,3
429,兴业南路,GENERAL,30.639824036899999,114.299532799999994,2.000000000000000,244.000000000000000,10141050150531115253760.000000000000000,10141050150531114359900_right_331.jpg,a group of cars parked outside of a building;a group of vehicles parked in front of a building;a group of cars parked in front of a building;a couple of cars parked in front of a building;a couple of cars parked in front of a house,a group of people riding motorcycles down a street ; a group of people walking down a street ; the inside of a building with a big door ; a group of cars parked outside of a building,2
430,,GENERAL,30.545590409799999,114.336061060999995,2.000000000000000,198.000000000000000,10141006121208142364672.000000000000000,10141006121208142926800_right_103.jpg,there is a metal fence next to a building;there is a metal fence outside of a building;there is a metal fence on the sidewalk;a building with a metal gate in the front;there is a metal fence next to a small building,cars are parked on the side of the street ; a van parked on the side of a road ; a view of a building from behind it ; there is a metal fence next to a building,6
431,解放大道,GENERAL,30.577942325300000,114.239688592999997,2.000000000000000,271.000000000000000,10141003150331123597312.000000000000000,10141003150331123157600_right_248.jpg,a couple of buses that are sitting in the street;a couple of buses driving down a city street;a couple of buses driving down a street next to tall buildings;a couple of buses that are sitting on the street;a couple of buses that are sitting on a road,a white car parked in front of a building ; a couple of cars driving down a street ; a city street with cars parked on the side ; a couple of buses that are sitting in the street,8
432,新建后街,GENERAL,30.619321598400003,114.301361181000004,2.000000000000000,353.000000000000000,10141013130101101953024.000000000000000,10141013130101101017000_right_97.jpg,a large white truck parked next to a building;a large white truck parked next to a brick wall;a large white truck parked next to a forest;a large white truck parked in front of a fence;a large white truck parked in front of a building,a bus parked on the side of a road ; a group of people walking down a street ; a truck parked next to a brick wall ; a large white truck parked next to a building,3
433,粮道大巷,GENERAL,30.551786540500000,114.299684935000002,2.000000000000000,215.000000000000000,10141003150507141758976.000000000000000,10141003150507141816500_right_283.jpg,there is a white door on the side of the building;there is a white door on the side of a building;there is a white door on the wall;there is a white door on the side of this building;a wall with two doors and a metal bar,a row of buildings on a city street ; a narrow alley way with a row of buildings ; a person standing in front of a doorway ; there is a white door on the side of the building,6
434,,GENERAL,30.559307093800001,114.342903379000006,2.000000000000000,57.000000000000000,10141058150821114413056.000000000000000,10141058150821114408700_right_36.jpg,a truck sitting in the middle of a dirt field;a truck sitting in the middle of a field;a truck sitting in the middle of a dirt road;a truck parked in a dirt field in front of buildings;a truck parked in a dirt field in front of a building,a view of a street with buildings in the background ; a person riding a bike on a city street ; a street scene with a large building in the background ; a truck sitting in the middle of a dirt field,2
435,,GENERAL,30.516157454399998,114.203476085000005,2.000000000000000,335.000000000000000,10141003150524101427200.000000000000000,10141003150524101317800_right_45.jpg,there is a very large building in the background;there is a very large building in the middle of the street;there is a very large building in the distance;there is a long building with a red fence on it;there is a very large building in the middle of the city,a city street with trees and a fence ; a view of a city street from the side ; a view of a city street from the side ; a car parked on the side of the road ; a yellow building behind a fence and some trees ; a red and blue bus sitting next to a park ; a row of yellow buildings next to a tree ; there is a very large building in the background,3
436,洲头二路,GENERAL,30.525925378600000,114.250182026000004,2.000000000000000,198.000000000000000,10141058150729131229184.000000000000000,10141058150729131627600_right_227.jpg,a man standing next to a tree on a sidewalk;a man walking down a street next to a tree;a man standing next to a tree on the sidewalk;a man standing next to a tree next to a building;a man standing next to a tree in front of a building,a man walking down a sidewalk next to tall buildings ; a street with cars parked on the side of the road ; a street scene with a tree and a building ; a man standing next to a tree on a sidewalk,11
437,汉中路,GENERAL,30.569004876699999,114.264865150999995,2.000000000000000,247.000000000000000,10141050150708135854080.000000000000000,10141050150708134820300_right_207.jpg,an umbrella hanging off of a wooden wall;a white and red umbrella hanging from a wire;a canopy bed with a red and white umbrella;a canopy bed with a red and white plaid umbrella;a canopy bed with a red and white umbrella over it,a white car driving down a city street ; a man walking down a street past tall buildings ; the side of a building with signs on it ; an umbrella hanging off of a wooden wall,10
438,汉中路,GENERAL,30.569004581800002,114.265247737999999,2.000000000000000,120.000000000000000,10141050150708133756928.000000000000000,10141050150708134803500_right_166.jpg,a couple of cars parked in front of a store;a couple of cars parked on the side of a street;a couple of cars parked on the side of the road;a couple of cars parked on the side of a road;a group of cars parked on the side of the street,a group of people walking down a street ; a person on a bike on a city street ; a room filled with lots of different types of items ; a couple of cars parked in front of a store,6
439,德望街,GENERAL,30.604446270400000,114.272433976000002,2.000000000000000,131.000000000000000,10141022121127141441536.000000000000000,10141022121127141355100_right_80.jpg,a blue car parked on the side of the road;a blue car parked on the side of a road;a group of cars parked on the side of a road;a blue car parked on the side of a street;a group of cars parked on the side of the road,a car parked in front of a building ; a group of people standing around a pile of bags ; a car parked on the side of a street ; a blue car parked on the side of the road,6
440,沿江大道,GENERAL,30.605791140900003,114.306605621000003,2.000000000000000,18.000000000000000,10141050150606094729216.000000000000000,10141050150606095324200_right_80.jpg,a view of a road from a vehicle;a view of a street from a vehicle;a view of a road from a car window;a view of a road from inside a vehicle;a view of a street from a vehicle looking out a window,a red car parked on the side of the road ; a white truck driving down a street next to tall buildings ; cars are parked on the side of the street ; a view of a road from a vehicle,8
441,,GENERAL,30.615616658800000,114.275370089000006,2.000000000000000,218.000000000000000,10141050150701152337920.000000000000000,10141050150701153252500_right_293.jpg,a room filled with lots of different types of vegetables;a room filled with lots of fresh produce;a store front with a variety of fruits and vegetables;a room filled with lots of vegetables and fruits;a room filled with lots of different types of fruits and vegetables,a group of people standing outside of a building ; a group of people walking down a street ; a blue and white umbrella and some buildings ; a room filled with lots of different types of vegetables,6
442,二七路,GENERAL,30.628809699000001,114.289592909999996,2.000000000000000,254.000000000000000,10141003150612165033984.000000000000000,10141003150612164511600_right_207.jpg,a view of a city from across the street;a view of a city skyline from across the street;a view of a city from across a street;a view of a city from across a road;a view of a city skyline from the top of a bridge,a view of a bridge from the side of a road ; an empty street with a building in the background ; a view of a city street through the window ; a view of a city from across the street,0
443,白沙二路,GENERAL,30.489674977600004,114.266292897000000,2.000000000000000,237.000000000000000,10141003150425124241408.000000000000000,10141003150425123657800_right_317.jpg,a sign that is on the side of a building;a sign that is on the side of a wall;a sign that is on the ground outside;a sign that is on the side of a ramp;a sign that is on the ground in a field,a long road with a long line of trees ; a car driving down a street next to a building ; the side of the road is covered with graffiti ; a sign that is on the side of a building,9
444,,GENERAL,30.558746356699999,114.341864182999998,2.000000000000000,36.000000000000000,10141003150429110927360.000000000000000,10141003150429110209400_right_123.jpg,a white car parked in front of a brick building;a white car parked next to a building;a white car parked in front of a building;a white car parked in front of a house;a white car parked on the side of a road,a street with cars and people walking down it ; a group of people walking down a sidewalk ; a concrete wall with graffiti on it and a building in the background ; a white car parked in front of a brick building,6
445,前进五路,GENERAL,30.583824401000001,114.281491693999996,2.000000000000000,178.000000000000000,10141035140719159803904.000000000000000,10141035140719160515100_right_209.jpg,a group of motorcycles parked next to a tree;a couple of motorcycles parked next to a tree;a couple of motorcycles parked next to a building;a motorcycle parked next to a tree on a sidewalk;a motorcycle parked next to a tree on the sidewalk,a couple of people that are on a street ; a couple of cars that are sitting in the street ; a white car driving down a street next to tall buildings ; a group of motorcycles parked next to a tree,8
446,,GENERAL,30.566625587499999,114.348893993999994,2.000000000000000,213.000000000000000,10141003150429115121664.000000000000000,10141003150429114747300_right_5.jpg,a car parked in front of a building;a silver car parked in front of a stone wall;a car parked in front of a brick building;a silver car parked in front of a brick wall;a blue car parked in front of a building,a group of cars parked in front of a building ; a group of cars that are sitting in the street ; a couple of cars parked in front of a building ; a car parked in front of a building,6
447,,GENERAL,30.546885628399998,114.322905304000003,2.000000000000000,350.000000000000000,10141006121205153923072.000000000000000,10141006121205153819100_right_272.jpg,people walking down the sidewalk of a city street;a man walking down a sidewalk next to buildings;a man walking down a street past a store;a man walking down a sidewalk in a city;a man walking down a sidewalk next to a store,a group of people walking down a street ; a couple of cars that are sitting in the street ; a car parked on the side of the road ; people walking down the sidewalk of a city street,6
448,中山大道,GENERAL,30.608753658000001,114.303189173000007,2.000000000000000,23.000000000000000,10141050150625113800704.000000000000000,10141050150625112912000_right_135.jpg,a store front that has a large sign on it;the front of the store is shown in the city;a store front that has a large sign on the front of it;the front of the store is shown in front of the store;a store front that has a large sign on the side of it,a group of people walking down a sidewalk ; a city street with people walking down it ; a fire truck parked in front of a building ; a store front that has a large sign on it,6
449,彭刘杨西路,GENERAL,30.542582837099999,114.290849559999998,2.000000000000000,197.000000000000000,10141003150323139739648.000000000000000,10141003150323140402700_right_8.jpg,a street view of a building and a tree;a street scene with focus on the street sign;a street corner with a large building and a tree;a street view of a building with a tree in front of it;a street view of a building with a tree in front,a city street filled with traffic and tall buildings ; a silver car driving down a city street ; a group of cars that are sitting in the street ; a street view of a building and a tree,-1
450,长云路,GENERAL,30.611900829900001,114.176777130999994,2.000000000000000,279.000000000000000,10141022121209110724608.000000000000000,10141022121209111423200_right_195.jpg,a red truck parked next to a building;a red truck parked in front of a building;a red truck parked next to a brick building;a red truck parked in front of a brick building;a red truck parked next to a red building,a white bus driving down a street past tall buildings ; a truck driving down a street next to buildings ; a view of a city skyline from across the water ; a red truck parked next to a building,4
451,马场路,GENERAL,30.615873058900000,114.264887697000006,2.000000000000000,119.000000000000000,10141050150701160726528.000000000000000,10141050150701161752500_right_198.jpg,a group of cars that are sitting in the street;a group of cars that are in a parking lot;a group of cars parked on a city street;a group of cars parked on the side of a road;a group of cars parked on the side of the road,a busy street with many cars and motorcycles ; a car driving down a street next to tall buildings ; a row of buildings on a city street ; a group of cars that are sitting in the street,9
452,紫湖村,GENERAL,30.533374484599999,114.296590503000004,2.000000000000000,318.000000000000000,10141006121203153240064.000000000000000,10141006121203152457900_right_78.jpg,a parking sign on the side of a building;there is a sign that is on the street;there is a sign that is on the wall;there is a sign that is on the side of a building;there is a sign on the wall of an old building,a car parked on the side of a street ; a narrow alley with a row of buildings ; a white van parked on the side of a road ; a bike parked on a sidewalk next to a building ; there is a bench outside of the building ; a building with a blue roof and a blue roof ; a white building with a window on the side of it ; a parking sign on the side of a building,6
453,舒家街,GENERAL,30.544225527799998,114.317023344000006,2.000000000000000,176.000000000000000,10141003150327101259776.000000000000000,10141003150327101631900_right_231.jpg,a cement wall in front of a brick building;a cement wall in front of a building;a cement wall in front of a brick building next to a tree;a cement wall in front of a brick building and trees;a cement wall in front of a brick building and a tree,a street scene with focus on an old building ; a cement wall in a city with tall buildings ; a concrete wall with a large city in the background ; a cement wall in front of a brick building,6
454,中山大道,GENERAL,30.598958936799999,114.297439628999996,2.000000000000000,296.000000000000000,10141050150625113800704.000000000000000,10141050150625113303900_right_293.jpg,a blue bench sitting in front of a tall building;a blue bench sitting in the middle of a city;a blue bench sitting in front of a building;a blue bench sitting in the middle of a city street;a blue bench sitting in front of tall buildings,a man that is standing in the street ; a person on a bike on a city street ; a man sitting on a bench in front of a store ; a blue bench sitting in front of a tall building,2
455,莲花湖二路,GENERAL,30.554444708100000,114.268406182999996,2.000000000000000,183.000000000000000,10141003150323150225408.000000000000000,10141003150323150441000_right_5.jpg,a car parked on the side of the street;a car parked on the side of the road;a car parked on the side of a street;a car parked on the side of a road near a building;a car parked on the side of the road near a building,a street with cars parked on the side of the road ; a street that has cars parked on the side of it ; an orange cone sitting in the middle of a street ; a car parked on the side of the street,6
456,,GENERAL,30.550297099500000,114.340866591999998,2.000000000000000,65.000000000000000,10141003150519112302592.000000000000000,10141003150519112745900_right_345.jpg,a refrigerator sitting in the middle of an alley;a refrigerator sitting in the middle of a sidewalk;a refrigerator sitting in the middle of the street;a refrigerator sitting outside of a building next to a building;a refrigerator sitting in the middle of a street,a couple of cars that are sitting in the street ; cars parked on the side of the road ; a white truck driving down a street next to a forest ; a refrigerator sitting in the middle of an alley,-1
457,归元寺路,GENERAL,30.545542331899998,114.256760885000006,2.000000000000000,295.000000000000000,10141035140618135797760.000000000000000,10141035140618135645000_right_281.jpg,a couple of buildings that are next to a street;a couple of buildings that are next to each other;a couple of buildings that are next to a sidewalk;a couple of buildings that are next to a building;a couple of buildings that are on a street,a green car driving down a city street ; a view of a city street from the sidewalk ; a couple of people riding bikes down a street ; a couple of buildings that are next to a street,2
458,后湖大道,GENERAL,30.639293586000001,114.272345137000002,2.000000000000000,69.000000000000000,10141003150426114097152.000000000000000,10141003150426114326600_right_155.jpg,a large body of water surrounded by tall buildings;a large body of water with a building in the background;a large body of water with trees in the background;a large body of water surrounded by a few trees;a large body of water sitting next to a park,a group of cars driving down a city street ; a city street with buildings in the background ; a blue car driving down a street next to tall buildings ; a large body of water surrounded by tall buildings,7
459,粮道街,GENERAL,30.550791984699998,114.298468384000003,2.000000000000000,178.000000000000000,10141035140714099376128.000000000000000,10141035140714100353000_right_22.jpg,a car parked in front of a store;a car parked on the side of the road;a car parked on the side of the street;a car parked on the side of a street;a car parked on the side of a street next to a building,a street with cars parked on the side of the road ; a group of cars driving down a city street ; a group of people standing around a white van ; a car parked in front of a store,8
460,,GENERAL,30.548827296500001,114.268817663999997,2.000000000000000,214.000000000000000,10141019131222140387328.000000000000000,10141019131222141131900_right_162.jpg,a truck parked in front of a building under a tree;a truck parked in front of a tall building;a truck parked next to a building under a tree;a truck parked in front of a building next to a tree;a blue car parked in front of a building,a white truck parked on the side of a road ; a car parked on the side of a street ; a white van parked in front of a tall building ; a truck parked in front of a building under a tree,6
461,张之洞路,GENERAL,30.536604872400002,114.298063666999994,2.000000000000000,196.000000000000000,10141003150312150663168.000000000000000,10141003150312150610900_right_159.jpg,a man walking down a street next to tall buildings;a man walking down a street in front of a building;a man is walking down the sidewalk in the city;a man walking down a street in front of a tall building;a man is walking down the sidewalk in front of a building,a group of buses that are sitting in the street ; a city street filled with traffic surrounded by tall buildings ; a city street filled with traffic surrounded by tall buildings ; a man walking down a street next to tall buildings,-1
462,长丰大道,GENERAL,30.609848665600001,114.211282053999994,2.000000000000000,135.000000000000000,10141050150530110717952.000000000000000,10141050150530111639500_right_75.jpg,a bus stop with blue walls and cars;a bus stop with cars parked on the side;a bus stop with cars parked on the side of the road;a bus stop with cars parked on the side of the street;a bus stop with cars parked on the side of it,a city street filled with traffic and tall buildings ; a refrigerator with a lot of stickers on it ; a city street filled with lots of tall buildings ; a bus stop with blue walls and cars,4
463,,GENERAL,30.573443803899998,114.187704366000006,2.000000000000000,344.000000000000000,10141058150713102696448.000000000000000,10141058150713102737400_right_269.jpg,a brick building with a red and green sign;a brick building with a red and yellow sign;a brick building with a red and green sign on it;a brick building with a red and white sign on it;a brick building with a red and green sign on the wall,a narrow street with a yellow and red building ; a couple of cars parked on the side of a street ; a person standing in front of a store ; a brick building with a red and green sign,6
464,,GENERAL,30.615090178300001,114.236586453000001,2.000000000000000,258.000000000000000,10141050150524133834752.000000000000000,10141050150524134128900_right_335.jpg,a couple of cars parked in front of a building;a white car parked in front of a tall building;a couple of cars parked on the side of the road;a couple of cars parked on the side of a street;a couple of cars parked on the side of a road,a white van driving down a street next to tall buildings ; a man sitting on a bench next to a street ; there is a building in the middle of the street ; a couple of cars parked in front of a building,-1
465,京汉大道,GENERAL,30.584956278200000,114.276608425999996,2.000000000000000,197.000000000000000,10141003150612104216576.000000000000000,10141003150612104506800_right_332.jpg,a city street with buildings and a few cars;a city street with buildings and a few people walking on it;a city street with buildings and a few people walking down it;a city street with a building that has a large sign;a city street with buildings and a few people walking down the street,a person riding a motorcycle down a city street ; a city street with cars and a bus ; a view of a city street with a fence ; a city street with buildings and a few cars,2
466,解放大道,GENERAL,30.583239991100001,114.220646551000002,2.000000000000000,54.000000000000000,10141003150331123597312.000000000000000,10141003150331124128100_right_49.jpg,a group of people walking down a sidewalk;a group of people walking down a side walk;a group of people walking down a sidewalk near a building;a group of people walking down a sidewalk next to a street;a group of people walking down a sidewalk near a street,a group of cars that are sitting in the street ; a group of cars that are sitting in the street ; a bus parked in front of a bus stop ; a group of people walking down a sidewalk,3
