OBJECTID,description,tags,lat_wgs,lon_wgs,pov_exp,heading,orgid,nid,captions,scene,label
639,群建路,GENERAL,30.547335645000000,114.267426732000004,2.000000000000000,300.000000000000000,10141019131222111027200.000000000000000,10141019131222110116000_right_83.jpg,a group of cars driving down a street;a group of cars driving down a city street;a group of cars driving down a busy street;a group of cars driving down a street next to tall buildings;a group of cars parked on the side of the road,a couple of cars parked on a city street ; a street with cars parked along the side of it ; a couple of signs that are next to a tree ; a group of cars driving down a street,9
640,,GENERAL,30.606977760400000,114.287511011000007,2.000000000000000,171.000000000000000,10141050150701152337920.000000000000000,10141050150701151812000_right_50.jpg,a man is standing in front of a house;a man standing in front of a tall building;a man standing in front of a house;a man is standing in front of a building;a man standing in front of a house next to a tree,a group of people walking down a street ; a man is walking down a narrow street ; a white refrigerator freezer sitting inside of a building ; a man is standing in front of a house,11
641,游艺东巷,GENERAL,30.577023558400001,114.272418920999996,2.000000000000000,107.000000000000000,10141050150710113468416.000000000000000,10141050150710112911000_right_93.jpg,a white van parked on the side of a street;a white van parked on the side of the road;a bus parked on the side of the street;a bus parked on the side of the road;a white van parked on the side of a road,a city street with cars and buildings ; a white car parked in front of a building ; several cars parked on the side of the road ; a white van parked on the side of a street,6
642,解放大道,GENERAL,30.606177419300000,114.296962000999997,2.000000000000000,358.000000000000000,10141035140610120482816.000000000000000,10141035140610120110200_right_290.jpg,a street that has cars parked on it;a street with cars parked on the side of the road;a street with a car parked on the side of it;a street with cars parked in front of a building;a street with a car parked in front of a building,a bus driving down a street next to tall buildings ; a couple of buses driving down a road ; a bus parked in front of a building ; a street that has cars parked on it,4
643,澳门路,GENERAL,30.605797652800003,114.287243967999999,2.000000000000000,161.000000000000000,10141003150322143592448.000000000000000,10141003150322142656100_right_90.jpg,a person crossing the street in front of a building;a person crossing the street in front of a store;a person crossing the street in front of some buildings;a person crossing the street in the middle of a city;a person crossing the street in front of a car driving down a street,a public transit bus on a city street ; a car driving down a street past tall buildings ; a green bus driving down a street next to tall buildings ; a person crossing the street in front of a building,4
644,,GENERAL,30.609820162300000,114.238999737000000,2.000000000000000,64.000000000000000,10141013130114133655552.000000000000000,10141013130114134541700_right_79.jpg,a city street filled with lots of traffic;a city street filled with lots of garbage;a city street filled with garbage and old buildings;a city street filled with lots of traffic and buildings;a city street filled with lots of traffic and a tv,a person walking down a street next to buildings ; a person walking down a street next to buildings ; a pile of trash sitting in the middle of a street ; a city street filled with lots of traffic,6
645,,GENERAL,30.519460859100001,114.201368678999998,2.000000000000000,131.000000000000000,10141003150524109815808.000000000000000,10141003150524110233200_right_73.jpg,a parking lot with a building in the background;a parking lot with a large building in the background;a street with a large building in the background;a parking lot with a building and trees;a parking lot with a building and trees in the background,a palm tree on the sidewalk of a city street ; a street with cars parked on the side of the road ; a large sign on the side of the road ; a parking lot with a building in the background,6
646,长江日报路,GENERAL,30.605451825900001,114.273012262999998,2.000000000000000,286.000000000000000,10141050150624113459200.000000000000000,10141050150624113009100_right_220.jpg,a store front with a row of bicycles parked outside;a store front with a row of bicycles outside of it;a store front with a row of bicycles parked in front of it;a store front with a row of parked bicycles outside;a store front with a row of bicycles parked outside of it,a group of people walking down a street ; a city street filled with lots of traffic ; a group of cars that are sitting in the street ; a store front with a row of bicycles parked outside,6
647,,GENERAL,30.616836656299999,114.204910088999995,2.000000000000000,193.000000000000000,10141050150727125565440.000000000000000,10141050150727125953400_right_308.jpg,a red fire hydrant on a city street;a red fire hydrant sitting on the side of a road;a red fire hydrant sitting in the middle of a street;a red fire hydrant sitting on the side of a street;a red fire hydrant on a street corner,an empty street with a tree lined street ; an empty street with a building in the background ; a sign that is on the side of the street ; a red fire hydrant on a city street,0
648,常青一路,GENERAL,30.626960872800002,114.258989189000005,2.000000000000000,97.000000000000000,10141057150718161453056.000000000000000,10141057150718160628900_right_205.jpg,a man walking down a street next to tall buildings;a person walking down a street with a skate board;a man is walking down the street with a skateboard;a person walking down a street with a skateboard;a man is walking down the street with a surfboard,a city street filled with lots of traffic and tall buildings ; a car driving down a street past tall buildings ; a group of cars driving down a city street ; a man walking down a street next to tall buildings,10
649,长丰大道,GENERAL,30.608443697799999,114.226177582000005,2.000000000000000,102.000000000000000,10141050150530110717952.000000000000000,10141050150530111153800_right_346.jpg,a blue and white sign some buildings and trees;a large blue boat sitting in the middle of a city;a large blue boat sitting in front of tall buildings;a large blue screen tv sitting in the middle of a street;a large blue boat sitting in the middle of a street,a group of cars driving down a street ; a group of cars that are sitting in the street ; a couple of cars parked in a parking lot ; a blue and white sign some buildings and trees,7
650,四新南路,GENERAL,30.524907055600000,114.194756462000001,2.000000000000000,293.000000000000000,10141050150312124350464.000000000000000,10141050150312124140800_right_241.jpg,a street scene with a fence and a building;a street scene with focus on a large sign;a street scene with a fence and a large building;a street scene with a fence and a building in the background;a street scene with a fence and a large building in the background,a public transit bus on a city street ; a couple of cars parked on a city street ; a large metal fence sitting in front of a building ; a street scene with a fence and a building,3
651,,GENERAL,30.541371331899999,114.290386577999996,2.000000000000000,127.000000000000000,10141231121231123578880.000000000000000,10141231121231124151700_right_22.jpg,a tree on the side of the road;a tree is in the middle of the street;a tree is in the middle of a street;a tree on the side of the road next to a sidewalk;a tree on the side of the road in a neighborhood,a street with a few people walking around it ; an empty street with a building in the background ; a tall building sitting on the side of a street ; a tree on the side of the road,0
652,,GENERAL,30.489536285500002,114.263792258999999,2.000000000000000,305.000000000000000,10141019131027153485824.000000000000000,10141019131027154405800_right_313.jpg,a fire hydrant in front of a brick building;a red fire hydrant in front of a brick building;a red fire hydrant sitting in front of a brick building;a red fire hydrant sitting in front of a building;a fire hydrant in front of a building,a long empty street in front of a large building ; a person riding a bike down a sidewalk ; there is a bridge with a train on it ; a fire hydrant in front of a brick building,0
653,莲花湖二路,GENERAL,30.554612357900002,114.269776612000001,2.000000000000000,239.000000000000000,10141003150323150225408.000000000000000,10141003150323150412400_right_188.jpg,a white car parked in front of a store;a small white car parked in front of a store;a white car parked in front of a building;a white car parked outside of a building;a small white car parked in front of a store front,a city street filled with traffic surrounded by tall buildings ; a city street with several cars parked on it ; a view of a city street during the day ; a white car parked in front of a store,6
654,汉正街,GENERAL,30.567599376000000,114.260779558999999,2.000000000000000,254.000000000000000,10141050150702102347776.000000000000000,10141050150702102513500_right_194.jpg,a bridge in the middle of a city;a bridge with a building in the background;a bridge in the middle of a large city;a bridge in the middle of the city;a bridge in the middle of a city with tall buildings,a man riding a bike down a sidewalk ; a blue and white street sign and some people ; a sign on the wall of a building ; a bridge in the middle of a city,2
655,,GENERAL,30.610767786400000,114.231532486999996,2.000000000000000,338.000000000000000,10141050150727112982528.000000000000000,10141050150727113956500_right_128.jpg,a person walking down a sidewalk next to a building;a person walking down a sidewalk next to a tall building;a person walking down a street past a building;a person walking down a sidewalk near a building;a person walking down a sidewalk near a tree,the side of the building has a sign that says no parking ; a view of a wall covered in graffiti ; a car parked on the side of the street ; a person walking down a sidewalk next to a building,0
656,文明路,GENERAL,30.542684540200000,114.289323164999999,2.000000000000000,227.000000000000000,10141006121203144851456.000000000000000,10141006121203145137800_right_310.jpg,a truck parked next to a wall covered in graffiti;a truck parked in front of a wall;a truck parked next to a wall with graffiti on it;a truck parked in front of a wall covered in graffiti;a truck parked next to a wall with graffiti,a sign on the side of a city street ; a white car driving down a city street ; a bus driving down a street next to a truck ; a truck parked next to a wall covered in graffiti,4
657,归元寺路,GENERAL,30.546893475100003,114.256245883999995,2.000000000000000,203.000000000000000,10141035140618135797760.000000000000000,10141035140618135622900_right_83.jpg,a row of buildings on a city street;a row of buildings on a street corner;a row of buildings on a street with umbrellas;a row of buildings on a street corner with umbrellas;a row of buildings on a city street with umbrellas,a group of people standing on the side of a road ; a car driving down a street next to buildings ; a man walking down a sidewalk next to a building ; a row of buildings on a city street,10
658,,GENERAL,30.628549915099999,114.307354224999997,2.000000000000000,293.000000000000000,10141050150625105412096.000000000000000,10141050150625104649100_right_221.jpg,a concrete wall with a concrete wall and bushes;a concrete wall with a concrete wall and trees in the background;a concrete wall with a concrete wall in the middle;a concrete wall with a concrete wall and a tree;a concrete wall with a concrete wall in the middle of it,a person riding a bike down a city street ; a person walking down the side of a road ; a view of a city street with tall buildings ; a concrete wall with a concrete wall and bushes,2
659,文举街,GENERAL,30.511392378899998,114.227998073999998,2.000000000000000,134.000000000000000,10141003150522142687232.000000000000000,10141003150522143523400_right_250.jpg,a sign that is on the side of the road;a sign that is on the side of a building;a sign that is on the side of a wall;a sign that is on the side of a street;a sign that is on the side of the street,a street with a fence and trees in the background ; a building with a sign on the side of the road ; a cement wall with a concrete wall and bushes ; a sign that is on the side of the road,6
660,粮道街,GENERAL,30.548964219700000,114.310169970999993,2.000000000000000,257.000000000000000,10141035140714101473280.000000000000000,10141035140714100750100_right_16.jpg,two children are playing baseball in a parking lot;a child is swinging a baseball bat at a ball;a couple of people that are standing in the dirt;a couple of people that are standing in front of a fence;a couple of people that are standing in front of a building,a group of people riding motorcycles down a street ; a group of people riding motorcycles down a street ; a white car parked in front of a store ; two children are playing baseball in a parking lot,2
661,,GENERAL,30.535443181800002,114.248514471999997,2.000000000000000,164.000000000000000,10141058150803152306176.000000000000000,10141058150803153319800_right_308.jpg,a pile of garbage sitting next to a lush green forest;a couple of bags that are in the dirt;a pile of garbage sitting next to a forest;a pile of garbage sitting next to a green forest;a pile of garbage sitting next to a lush green tree,a city street with tall buildings in the background ; a view of a city street from the side ; a view of a city from across the street ; a pile of garbage sitting next to a lush green forest,6
662,,GENERAL,30.602059309400001,114.232948156000006,2.000000000000000,252.000000000000000,10141050150707152289792.000000000000000,10141050150707151829600_right_346.jpg,a pile of trash sitting in front of a building;a pile of trash sitting next to a building;a pile of trash sitting next to a tall building;a pile of trash sitting on top of a cement floor;a pile of trash sitting in front of a cement wall,a yard filled with lots of trees and buildings ; a pile of garbage sitting in front of a building ; a row of wooden UNK sitting on the side of a road ; a pile of trash sitting in front of a building,6
663,,GENERAL,30.555149982300001,114.210458196000005,2.000000000000000,296.000000000000000,10141058150721103331328.000000000000000,10141058150721103708900_right_192.jpg,a white car parked in front of a building;a white car parked on the side of the road;a white car parked next to a building;a white car parked in a parking lot;a white car parked on the side of the street,a street with cars parked on both sides of it ; a blue bench sitting on the side of a road ; a bus parked in front of a building ; a white car parked in front of a building,3
664,马场路,GENERAL,30.616322343899999,114.261276492999997,2.000000000000000,248.000000000000000,10141050150701160726528.000000000000000,10141050150701161700500_right_351.jpg,a couple of cars parked in front of a building;a couple of cars parked in front of a store;a group of cars parked on the side of a street;a couple of cars parked on the side of a road;a group of cars parked on the side of the road,a group of people that are standing in the street ; a group of cars parked on the side of a street ; a group of motorcycles parked in front of a building ; a couple of cars parked in front of a building,6
665,,GENERAL,30.520324540600001,114.232426637000003,2.000000000000000,356.000000000000000,10141003150524151758848.000000000000000,10141003150524151935800_right_25.jpg,a tree in front of a stone wall;a tree in front of a brick wall;a tree in front of a concrete wall;a tree next to a brick wall and a building;a tree next to a brick wall and a house,a view of a city street from the sidewalk ; a view of a city street from the sidewalk ; a building that has a large window in it ; a tree in front of a stone wall,6
666,,GENERAL,30.578272865100001,114.188201957999993,2.000000000000000,307.000000000000000,10141019131210104832000.000000000000000,10141019131210104242000_right_297.jpg,a tree in the middle of a forest;a view of a building from a window;a view of a forest from behind a tree;a tree in the middle of a field;a view of a forest from behind a tree branch,a white truck parked on the side of a road ; a view of a city street from the side ; a tree in the middle of the forest ; a tree in the middle of a forest,6
667,归元寺路,GENERAL,30.545167156800002,114.256909333999999,2.000000000000000,306.000000000000000,10141035140618135797760.000000000000000,10141035140618135650200_right_246.jpg,a couple of blue signs sitting on the side of a road;a couple of blue signs sitting on the side of a street;a street scene with a person standing in the street;a couple of blue signs sitting on the side of the road;a couple of blue signs sitting on the side of a building,a city street filled with traffic next to tall buildings ; a person is riding a bike down the street ; a couple of people walking down a street ; a couple of blue signs sitting on the side of a road,2
668,中山路,GENERAL,30.550003808800000,114.312727148999997,2.000000000000000,330.000000000000000,10141003150421143846912.000000000000000,10141003150421144248300_right_79.jpg,a couple of cars that are sitting in the street;a couple of cars driving down a street;a couple of cars driving down a city street;cars are parked on the side of the road;cars are parked on the side of the street,a city street filled with traffic next to tall buildings ; a highway filled with lots of traffic and traffic ; a white truck driving past a tall building ; a couple of cars that are sitting in the street,8
669,易农街,GENERAL,30.596933369700000,114.190286814999993,2.000000000000000,130.000000000000000,10141057150702141308928.000000000000000,10141057150702141706200_right_216.jpg,a red and white sign that reads UNK UNK;the front of a building with a sign on the wall;the front of a building with a sign that reads UNK;the front of a building with a large sign on the front;the front of a building with a large sign on the wall,a group of cars parked on a city street ; a person riding a bike down a city street ; a row of cars parked on the side of a street ; a red and white sign that reads UNK UNK,2
670,三曙街,GENERAL,30.570114238399999,114.268885154000003,2.000000000000000,102.000000000000000,10141050150708135854080.000000000000000,10141050150708135421100_right_355.jpg,a white car parked in front of a store;a white van parked in front of a store;a white car parked outside of a store;a white car parked in front of a store front;a white car is parked outside of a store,a city street with cars and people walking ; a group of cars parked on a city street ; a motorcycle parked in front of a store ; a white car parked in front of a store,6
671,常超街,GENERAL,30.615146852399999,114.238546205999995,2.000000000000000,305.000000000000000,10141022121207143596032.000000000000000,10141022121207143806000_right_59.jpg,a person walking on a city street;a man walking down a street past a store;a man walking down a street in front of a store;a man walking down a street past a store front;a person walking on a city street past a store,a person walking down a street next to parked cars ; a woman walking down a street past tall buildings ; a couple of cars parked on the side of a street ; a person walking on a city street,1
672,铁路大厂一路,GENERAL,30.607104030399999,114.181837630999993,2.000000000000000,20.000000000000000,10141050150530150563840.000000000000000,10141050150530150956700_right_291.jpg,a sign that is on the side of a building;a sign that is on the side of a pole;a sign on a pole in front of a body of water;a sign that is on the side of a street;a sign on a pole in front of a lake,a view of a street from a distance ; a man walking down a sidewalk next to a building ; an alley with a tree and some buildings ; a sign that is on the side of a building,11
673,,GENERAL,30.661028374600001,114.298117318999999,2.000000000000000,247.000000000000000,10141003150610116116480.000000000000000,10141003150610115958900_right_343.jpg,a blue tub sitting in front of a building;a blue tub sitting in front of a doorway;a blue tub in a building with graffiti on the walls;a blue tub in a building with graffiti on it;there is a blue tub in the corner of a building,a man sitting in a chair in an alley ; a man walking down a street past a store ; a wall of a building with two doors ; a blue tub sitting in front of a building,-1
674,中北路,GENERAL,30.556973136100002,114.336455517999994,2.000000000000000,128.000000000000000,10141019140103130316800.000000000000000,10141019140103130108700_right_126.jpg,a person walking across a street near parked cars;a car parked on the side of the road;a car parked on the side of a road next to tall buildings;a car parked on the side of a road near tall buildings;a car parked on the side of the road in front of a building,a group of cars driving down a street ; a group of people walking down a city street ; a group of people sitting in front of a building ; a person walking across a street near parked cars,9
675,二七路,GENERAL,30.631247063899998,114.298842156999996,2.000000000000000,72.000000000000000,10141003150612165033984.000000000000000,10141003150612165003500_right_155.jpg,a man standing in front of a store;a man standing in front of a store front;a man standing on the side of a street;a man standing on the sidewalk next to a white car;a man standing in front of a building next to parked cars,a highway with cars driving under a bridge ; a yellow fire truck driving down a city street ; a blue car parked in front of a building ; a man standing in front of a store,10
676,,GENERAL,30.482550631799999,114.252808814000005,2.000000000000000,39.000000000000000,10141019131027153485824.000000000000000,10141019131027153957300_right_293.jpg,a tree in the middle of the street;a tree in the corner of a street;a tree in the middle of a sidewalk;a tree in the middle of a sidewalk in front of a building;a tree in the middle of a sidewalk in a city,a city street with tall buildings in the background ; a sign that is on the side of a road ; a sign for a farmers market in a city ; a tree in the middle of the street,6
677,联友路,GENERAL,30.609607555899998,114.165216287999996,2.000000000000000,137.000000000000000,10141057150727122583552.000000000000000,10141057150727122156700_right_39.jpg,a plant hanging from the side of a building;a plant hangs from the wall of a building;a plant hanging from the wall of a building;a plant hanging from the side of a wall;a plant hanging from a wall next to a building,a white truck parked on the side of a street ; a narrow city street lined with buildings ; a wall with a lot of graffiti on it ; a plant hanging from the side of a building,6
678,黄浦大街,GENERAL,30.613618167799999,114.306908475000000,2.000000000000000,128.000000000000000,10141003150612102119424.000000000000000,10141003150612101546100_right_28.jpg,a couple of people walking across a street;a couple of people that are standing in the street;a couple of people walking across a parking lot;a couple of people that are walking around;a couple of people walking across a street near a building,a white car driving down a city street ; a blue and white bus driving down a city street ; a white fence some trees and a building ; a couple of people walking across a street,4
679,舒家街,GENERAL,30.544327650700001,114.316559924000003,2.000000000000000,103.000000000000000,10141003150327101259776.000000000000000,10141003150327101615700_right_193.jpg,a blue truck parked on the side of a road;a blue truck parked in front of a building;a blue truck parked next to a brick wall;a truck parked on the side of a road;a blue truck parked on the side of a street,a group of people walking down a street ; a couple of people walking down a sidewalk ; a man sitting under an umbrella next to a building ; a blue truck parked on the side of a road,11
680,单洞三路,GENERAL,30.585251640799999,114.274130044000003,2.000000000000000,288.000000000000000,10141035140623133310976.000000000000000,10141035140623133720600_right_244.jpg,a white car parked in front of a building;a white car parked in front of a store;a white car parked on the side of the road;a white car parked on the side of a street;a white car parked in front of a building with a painting,a group of cars parked on a city street ; a city street with cars and buses on it ; a group of cars parked on a city street ; a white car parked in front of a building,6
681,机电路,GENERAL,30.638252169200001,114.253539692000004,2.000000000000000,235.000000000000000,10141057150628113940480.000000000000000,10141057150628113845200_right_154.jpg,a couple of trucks parked next to each other;a couple of trucks parked in front of a building;a couple of trucks parked on the side of a road;a couple of trucks parked next to a building;a couple of trucks parked in a lot,cars and buses are parked on the side of the road ; a group of people that are standing in the street ; a truck parked next to a fire hydrant ; a couple of trucks parked next to each other,6
682,黄孝河路,GENERAL,30.612054052000001,114.280137363999998,2.000000000000000,300.000000000000000,10141003150322135203840.000000000000000,10141003150322135404500_right_325.jpg,a street with cars parked on the side of the road;a city street with cars parked on the side;a city street with cars parked on the side of it;a view of a city street from a distance;a street with cars parked on the side of the street,a city street with parked cars and buildings ; a person walking on a city street near buildings ; a car driving down a street next to tall buildings ; a street with cars parked on the side of the road,9
