OBJECTID,description,tags,lat_wgs,lon_wgs,pov_exp,heading,orgid,nid,captions,scene,label
215,,GENERAL,30.577791336200001,114.252769631999996,2.000000000000000,239.000000000000000,10141050150708154728448.000000000000000,10141050150708155654700_right_331.jpg,the inside of a building with glass walls;the inside of a building with a window;the inside of a building with a large window;the inside of a room with a window and curtains;the inside of a building with glass walls and curtains,a city street with people walking down the sidewalk ; a couple of cars parked on a city street ; a red brick building with a yellow cross on it ; the inside of a building with glass walls,6
216,常青三路,GENERAL,30.628285962500001,114.245527323000005,2.000000000000000,256.000000000000000,10141003150426114097152.000000000000000,10141003150426113516800_right_274.jpg,a city street filled with traffic next to tall buildings;a city street filled with traffic next to buildings;a street with cars parked on the side of the road;a city street lined with tall buildings and cars;a city street with a few cars parked on the side,a view of a building from the street ; a shop on the corner of a street ; a man walking down a street next to tall buildings ; a city street filled with traffic next to tall buildings,11
217,,GENERAL,30.594847855300003,114.188878394000000,2.000000000000000,103.000000000000000,10141057150702141308928.000000000000000,10141057150702142333300_right_187.jpg,a man walking down a sidewalk next to tall buildings;a man walking down a sidewalk next to a building;a man walking down a sidewalk in the day;a man walking down a street with a motorcycle;a man walking down a sidewalk next to a street,a view of a street from the side of a building ; a truck parked on the side of a street ; a building on the sidewalk of a street ; a man walking down a sidewalk next to tall buildings,11
218,,GENERAL,30.605535913299999,114.238955868999994,2.000000000000000,74.000000000000000,10141050150707150192640.000000000000000,10141050150707150548100_right_327.jpg,a couple of cars that are sitting in the street;a couple of cars are parked in front of a building;a couple of cars parked on the side of the road;a couple of cars parked in front of a tall building;a couple of cars parked on the side of a road,a city street filled with lots of traffic ; a group of trucks on a city street ; a group of cars parked in a parking lot ; a couple of cars that are sitting in the street,6
219,洲头二路,GENERAL,30.526918837600004,114.248874157000003,2.000000000000000,185.000000000000000,10141058150729131229184.000000000000000,10141058150729131712200_right_219.jpg,a red brick building with graffiti on it;a red brick building with graffiti on the walls;a building with graffiti on the side of it;a red brick building with graffiti on the wall;a red brick building with graffiti on the outside,a view of a building from the street ; a row of houses on a city street ; a truck parked in front of a brick building ; a red brick building with graffiti on it,6
220,文举街,GENERAL,30.511993671999999,114.226832535000000,2.000000000000000,126.000000000000000,10141003150522142687232.000000000000000,10141003150522143507900_right_34.jpg,a dirt road with buildings in the background;a couple of buildings that are next to each other;a couple of buildings that are next to a street;a couple of buildings that are next to a dirt field;a couple of buildings that are next to a building,a man is walking down a dirt road ; an empty street with a building in the background ; a couple of cars parked in a parking lot ; a dirt road with buildings in the background,0
221,绿缘路,GENERAL,30.606011418900000,114.293298047999997,2.000000000000000,304.000000000000000,10141050150701102006272.000000000000000,10141050150701101313300_right_130.jpg,a sign on the side of the street;a sign on the side of a building;a sign on the side of the street near a building;a sign on the side of the street near a tree;a sign on the side of a building covered in kites,a city street lined with buildings and trees ; a street with parked cars next to a building ; a couple of umbrellas that are outside of a building ; a sign on the side of the street,6
222,长云路,GENERAL,30.611788866200001,114.177630538000003,2.000000000000000,260.000000000000000,10141022121209110724608.000000000000000,10141022121209111406900_right_191.jpg,a white van parked in front of a brick building;a white truck parked in front of a brick building;a van parked in front of a brick building;a white van parked in front of a red brick building;a white van parked in front of a tall brick building,a white truck driving down a city street ; a group of people walking down a sidewalk ; a view of a street from the side of a building ; a white van parked in front of a brick building,8
223,,GENERAL,30.521272220600000,114.234717971999999,2.000000000000000,95.000000000000000,10141003150524151758848.000000000000000,10141003150524152148500_right_264.jpg,a narrow street with buildings in the background;a narrow road with a building in the background;a narrow street in a city with tall buildings;a narrow street in a city with buildings;a narrow road with a building in the back,a plant that is hanging from a tree ; a cement wall with a sign on it ; an empty sidewalk next to a concrete wall ; a narrow street with buildings in the background,0
224,振兴三路,GENERAL,30.613985592199999,114.235310433999999,2.000000000000000,155.000000000000000,10141050150524133834752.000000000000000,10141050150524134045100_right_239.jpg,a car parked in front of a building;a car parked in front of a wooden wall;a car parked next to a wall with graffiti on it;a car is parked in front of a building;a car parked next to a wall with graffiti,a line of cars parked on the side of a road ; a white car parked on the side of a road ; there is a house in the middle of the yard ; a car parked in front of a building,6
225,美庐路,GENERAL,30.636007982900001,114.283014301999998,2.000000000000000,168.000000000000000,10141050150703140438016.000000000000000,10141050150703140903500_right_246.jpg,a tree in front of a large building;a street scene with focus on the trees;a street scene with focus on a tree and buildings;a street scene with focus on a tree and building;a street scene with focus on a tree and a building,a woman walking down a street holding an umbrella ; a person riding a bike on a city street ; a person walking down a sidewalk near a building ; a tree in front of a large building,1
226,工大路,GENERAL,30.517166858300001,114.340063826999994,2.000000000000000,11.000000000000000,10141003150509163413504.000000000000000,10141003150509162830800_right_288.jpg,a couple of plastic containers sitting on a sidewalk;a couple of plastic containers sitting on top of a sidewalk;a trash bin sitting in the middle of a sidewalk;a couple of blue containers sitting on top of a sidewalk;a couple of plastic containers sitting on top of a brick walkway,a bus that is sitting in the street ; a city street lined with lots of trees ; a silver car parked on the side of the road ; a couple of plastic containers sitting on a sidewalk,3
227,民权路,GENERAL,30.573223003500001,114.286726750000000,2.000000000000000,153.000000000000000,10141035140613123604480.000000000000000,10141035140613123245700_right_28.jpg,a couple of cars parked on a city street;a couple of cars driving down a street;a couple of cars parked on the side of a street;a couple of cars parked on the side of a road;a group of people standing outside of a store,a city street with cars and buses on it ; a green bus driving down a city street ; a group of people standing outside of a store ; a couple of cars parked on a city street,4
228,古田路,GENERAL,30.592508449099999,114.197268749000003,2.000000000000000,257.000000000000000,10141022121211123990528.000000000000000,10141022121211122943600_right_313.jpg,a crowd of people walking down a street;a crowd of people walking down a city street;a crowd of people walking down a busy city street;a crowd of people walking down a busy street;a crowd of people walking down a street next to tall buildings,a group of people walking down a city street ; a busy street with people walking and cars ; a red car driving down a city street ; a crowd of people walking down a street,-1
229,,GENERAL,30.579478638499999,114.239504685000000,2.000000000000000,1.000000000000000,10141057150702111948800.000000000000000,10141057150702112315300_right_313.jpg,a white car parked in front of a building;a white car parked in front of a store;a red car parked in front of a store;a red car parked in front of a building;a white car is parked in front of a building,a group of cars parked on the side of a road ; a couple of cars parked on a city street ; two cars parked in front of a building ; a white car parked in front of a building,6
230,,GENERAL,30.574377739000010,114.278420181000001,2.000000000000000,242.000000000000000,10141050150624105070592.000000000000000,10141050150624104756700_right_241.jpg,a couple of people walking down a sidewalk;a group of people walking down a sidewalk;a group of people walking down a sidewalk in the rain;a group of people walking down a sidewalk near a building;a group of people walking down a sidewalk next to a building,a bus parked on the side of the street ; a man walking down a sidewalk next to a building ; a view of a street from the street ; a couple of people walking down a sidewalk,-1
231,百灵路,GENERAL,30.553243770800002,114.216472988000007,2.000000000000000,83.000000000000000,10141050150510120665088.000000000000000,10141050150510121710800_right_101.jpg,a green trash can sitting on the side of a road;a green trash can sitting on the side of a street;a trash can on the side of a street;a green trash can sitting on the side of the road;a green trash can sitting on the corner of a street,a red fire hydrant on a city street ; a white car driving down a street next to tall buildings ; a couple of kids walking down a street ; a green trash can sitting on the side of a road,8
232,长堤街,GENERAL,30.571322443100001,114.268258181999997,2.000000000000000,230.000000000000000,10141019131230094884864.000000000000000,10141019131230094750400_right_137.jpg,a motorcycle parked in front of a store;a motorcycle parked in front of a shop;a man standing in front of a building;a motorcycle parked in front of a store front;a man standing in front of a store with motorcycles parked outside,a group of people walking down a street ; a group of people walking down a narrow street ; a pile of boxes sitting in front of a building ; a motorcycle parked in front of a store,-1
233,汉正街,GENERAL,30.567829243199999,114.259766197999994,2.000000000000000,237.000000000000000,10141050150702102347776.000000000000000,10141050150702102448300_right_25.jpg,a person standing next to a building under an umbrella;a person standing in the middle of a city;a person standing in the middle of a city street;a person standing in front of a building with an umbrella;a person standing in front of a building with a red umbrella,a white truck driving down a city street ; a person on a bike holding an umbrella ; a red car driving past a tall building ; a person standing next to a building under an umbrella,8
234,莲花湖二路,GENERAL,30.554550641300001,114.269279523999998,2.000000000000000,137.000000000000000,10141003150323150225408.000000000000000,10141003150323150424500_right_111.jpg,a car parked on the side of the road;a car parked on the side of the street;a car parked in front of a building on a street;a car parked on the street in front of a building;a car parked in front of a building on the street,a view of a building from the street ; two cars parked on the side of the road ; a car parked on the side of the road ; a car parked on the side of the road,6
235,解放大道,GENERAL,30.593182586800001,114.283664810999994,2.000000000000000,30.000000000000000,10141003150331121500160.000000000000000,10141003150331122220000_right_52.jpg,a group of cars driving down a city street;a group of cars driving down a street;a city street filled with lots of traffic next to tall buildings;a group of cars driving down a street next to tall buildings;a city street filled with lots of traffic and tall buildings,a city street filled with lots of traffic ; a bus driving down a street past tall buildings ; a city street filled with lots of traffic ; a group of cars driving down a city street,4
236,劳动街,GENERAL,30.604439285800002,114.292663129999994,2.000000000000000,17.000000000000000,10141019131231124586496.000000000000000,10141019131231124045300_right_73.jpg,a city street with cars and motorcycles on it;a city street with cars and buildings on it;a city street with cars and motorcycles driving down it;a city street with cars parked on the side;a city street with cars and motorcycles driving on it,a sign that is on the side of a building ; a couple of cars parked in front of a building ; a couple of people walking down a city street ; a city street with cars and motorcycles on it,6
237,发展大道,GENERAL,30.621329505999999,114.267853642999995,2.000000000000000,192.000000000000000,10141003150612162936832.000000000000000,10141003150612163757700_right_157.jpg,a person walking down the street in front of a sign;a woman walking down a street past a sign;a person walking down the street in front of a building;a person walking down the street in front of a store;a person walking down the street in front of a large sign,a city street filled with traffic surrounded by tall buildings ; a city street with cars and a bus ; a city street with cars and a bus ; a person walking down the street in front of a sign,3
238,罗家嘴路,GENERAL,30.637048321900000,114.255081453000003,2.000000000000000,60.000000000000000,10141050150618134478848.000000000000000,10141050150618135412700_right_331.jpg,a building that has a bunch of graffiti on it;a building that has a bunch of signs on it;a couple of signs that are on the side of a building;a building that has a sign that says UNK;a couple of signs that are on the side of a wall,a city street with tall buildings and trees ; a person riding a bike down a sidewalk ; a man standing next to a parked white car ; a building that has a bunch of graffiti on it,2
239,,GENERAL,30.609421058700001,114.226419043999996,2.000000000000000,346.000000000000000,10141022121208112480256.000000000000000,10141022121208113220700_right_95.jpg,a white car parked in front of a building;a white van parked in front of a building;a white car parked next to a building;a white car parked in front of a brick building;a white car parked in front of a brick wall,a row of buildings on a city street ; a gate that is next to a building ; there is a wall with signs on it ; a white car parked in front of a building,6
240,二七路,GENERAL,30.629179285700001,114.290044488000007,2.000000000000000,72.000000000000000,10141103150611145162752.000000000000000,10141103150611145238400_right_270.jpg,a person riding a bike on a city street;a person riding a bike down a city street;a person on a bike rides down a street;a person riding a bike down a street next to a building;a person riding a bike down a street near a building,a couple of cars parked in a parking lot ; a white car driving down a street under a bridge ; a view of a street from the side of a building ; a person riding a bike on a city street,2
241,解放路,GENERAL,30.556264562199999,114.296552194000000,2.000000000000000,0.000000000000000,10141003150327132717056.000000000000000,10141003150327132249300_right_287.jpg,a street sign on a sidewalk in front of a store;a street scene with a store and a sign;a street sign on a sidewalk in front of a building;a street scene with a store and a street sign;a street scene with a store and a sign on the sidewalk,a busy city street with cars and pedestrians ; a blue car driving down a city street ; a street corner with a store and a bicycle ; a street sign on a sidewalk in front of a store,7
242,石牌岭路,GENERAL,30.522608709499998,114.335632903000004,2.000000000000000,6.000000000000000,10141003150324142178304.000000000000000,10141003150324141156700_right_90.jpg,a street view of a sidewalk in a city;a street view of a sidewalk and a store;a street view of a sidewalk in the middle of a city;a street view of a sidewalk in the middle of the day;a street view of a sidewalk in the middle of the city,a street with cars and people on it ; a couple of cars are driving down the street ; a person riding a scooter on a city street ; a street view of a sidewalk in a city,-1
243,汉阳大道,GENERAL,30.552887098000003,114.250447960000002,2.000000000000000,264.000000000000000,10141003150521144442880.000000000000000,10141003150521143827400_right_185.jpg,a bus parked in front of a bus stop;a bus parked on the side of the street;a bus parked on the side of the road;a bus parked on the side of a city street;a bus parked on the side of a street,a man riding a bike down the middle of a street ; a highway with buses cars and a bridge ; a group of people walking down a street ; a bus parked in front of a bus stop,2
244,,GENERAL,30.623623516100000,114.242951629999993,2.000000000000000,202.000000000000000,10141050150624155402240.000000000000000,10141050150624154442900_right_56.jpg,a view of a building from behind a fence;a fence next to a tree in a park;a fence next to a fence and a tree;a view of a building from behind a gate;a fence in front of a building with a fence,a street sign on a city road ; a long road with a long line of trees ; a city skyline with tall buildings in the background ; a view of a building from behind a fence,6
245,新湾路,GENERAL,30.637758117600001,114.251755261000000,2.000000000000000,81.000000000000000,10141050150618136576000.000000000000000,10141050150618135840500_right_140.jpg,a group of people crossing a city street;a group of people walking across a street;a group of people crossing a street next to tall buildings;a group of people crossing a street next to buildings;a group of people walking down a street next to tall buildings,a busy city street with cars and people ; a couple of people that are sitting in a cart ; a group of people walking down a city street ; a group of people crossing a city street,6
246,芦沟桥路,GENERAL,30.610066235000001,114.303383711999999,2.000000000000000,291.000000000000000,10141003150612102119424.000000000000000,10141003150612101959400_right_21.jpg,a picture of a building in the background;a building with a sign that says UNK UNK;a building with a sign that says UNK UNK UNK;a large building with a sign that says UNK UNK;a picture of a building in the background of a city,a car driving down a road next to a bus ; a bus driving down a street next to tall buildings ; a parking lot with a fence and trees ; a picture of a building in the background,4
247,单洞三路,GENERAL,30.586052688700001,114.273837749999998,2.000000000000000,203.000000000000000,10141035140623133310976.000000000000000,10141035140623133706400_right_211.jpg,a couple of cars driving down a city street;a couple of cars driving down a street;a couple of cars parked on the side of a street;a couple of cars parked on the side of a road;a couple of cars parked in front of a building,a group of people riding motorcycles on a city street ; a truck parked on the side of a street ; a man walking down a busy city street ; a couple of cars driving down a city street,2
248,,GENERAL,30.515617305700001,114.204347411000001,2.000000000000000,101.000000000000000,10141003150524101427200.000000000000000,10141003150524101304800_right_37.jpg,two men standing next to each other in front of a building;two people standing in front of a sign with a city in the background;two men standing next to each other in front of a sign;two men standing next to each other in front of a wall;two people standing in front of a sign with a city in the back ground,a white car driving down a street next to tall buildings ; a man walking down a sidewalk next to a street ; a group of men standing next to each other on a field ; two men standing next to each other in front of a building,10
249,,GENERAL,30.608482086700000,114.227586252999998,2.000000000000000,113.000000000000000,10141050150727115079680.000000000000000,10141050150727114326300_right_290.jpg,a blue and white sign and some buildings;a blue and white sign some buildings and trees;a blue and white sign some buildings and clouds;a blue and white sign and some buildings and clouds;a blue and white sign some buildings and a cloudy sky,a group of people walking down a sidewalk ; a parking lot with cars parked on it ; a large brown vase sitting on top of a table ; a blue and white sign and some buildings,6
250,,GENERAL,30.619738081900000,114.236312867999999,2.000000000000000,344.000000000000000,10141057150629120573440.000000000000000,10141057150629121226800_right_87.jpg,a bike is parked outside of a building;a green pole sitting next to a building;a bicycle is parked next to a building;a bike parked next to a building on a sidewalk;a bike parked next to a house next to a green pole,a car driving down a street next to tall buildings ; a building that has a door to the outside ; a car parked on the side of the road ; a white van parked in front of a building ; a car parked in front of a house ; a green pole sitting in front of a building ; a car parked in front of a house ; a bike is parked outside of a building,8
251,兴业路,GENERAL,30.637254280699999,114.283309196000005,2.000000000000000,249.000000000000000,10141050150531153002496.000000000000000,10141050150531152016400_right_292.jpg,a car driving down a road next to a bridge;a car driving down a road next to a building;a truck driving down a street next to a tall building;a truck driving down a street next to a bridge;a car driving down a street next to a tall building,a view of a city street from the side ; a street view of a building with graffiti on it ; a view of a city street from the sidewalk ; a car driving down a road next to a bridge,9
252,北湖东巷,GENERAL,30.605726037400000,114.269641113999995,2.000000000000000,324.000000000000000,10141022121127141441536.000000000000000,10141022121127141122800_right_55.jpg,a couple of people standing outside of a building;a couple of people sitting outside of a brick building;a person sitting on a bench in front of a building;a person sitting on a bench outside of a building;a person sitting on a bench outside a building,a building with a green sign hanging off the wall ; a building with many windows on the side of it ; a person is walking down a narrow street ; a couple of people standing outside of a building,6
253,白鹭街,GENERAL,30.555498893200003,114.337252194000001,2.000000000000000,301.000000000000000,10141003150324150566912.000000000000000,10141003150324151505600_right_210.jpg,a car parked in front of a building;a white car parked in front of a building;a car parked in front of a building near a tree;a car parked in front of a building next to a tree;a white car parked in front of a building next to a tree,a couple of cars driving down a street ; a blue and white bus driving down a street ; a city street with a large building in the background ; a car parked in front of a building,4
254,兰陵路,GENERAL,30.589946696900000,114.291721382000006,2.000000000000000,154.000000000000000,10141035140613100535808.000000000000000,10141035140613100115700_right_29.jpg,a couple of people standing outside of a store;two people standing outside of a store;a couple of people standing outside of a building;a couple of people standing outside of a shop;two people standing outside of a store front,a group of people walking down a street ; a city street with people walking on the sidewalk ; a white car parked in front of a building ; a couple of people standing outside of a store,6
255,振兴路,GENERAL,30.610228193699999,114.243751677999995,2.000000000000000,241.000000000000000,10141050150524112863232.000000000000000,10141050150524111904100_right_325.jpg,a couple of cars parked in front of a store;a couple of cars driving down a city street;a couple of cars driving down a street;a couple of cars that are sitting in the street;a couple of cars parked in front of a building,a person riding a bike on a city street ; a city street filled with traffic next to buildings ; a person riding a scooter on a city street ; a couple of cars parked in front of a store,2
256,,GENERAL,30.610269719500000,114.228657819000006,2.000000000000000,178.000000000000000,10141050150727115079680.000000000000000,10141050150727114616600_right_78.jpg,a couple of people sitting on top of a bench;a group of people sitting on a bench outside of a building;a couple of people sitting on top of a wooden bench;a couple of people sitting on top of a bench near a building;a couple of people sitting on top of a bench in a street,a narrow street with many fruits and vegetables ; a man walking down a street next to a tall building ; a man and a little girl walking down a street ; a couple of people sitting on top of a bench,-1
257,,GENERAL,30.580412444200000,114.218782380999997,2.000000000000000,47.000000000000000,10141150150725101158400.000000000000000,10141150150725101427600_right_36.jpg,a blue truck parked next to a building;a blue truck parked in front of a house;a blue truck parked in front of a building;a blue truck parked in front of a red brick building;a blue truck parked in front of a red building,a blue truck parked next to a fence ; a view of a street from the street ; a street light on the side of the road ; a blue truck parked next to a building,6
