OBJECTID,description,tags,lat_wgs,lon_wgs,pov_exp,heading,orgid,nid,captions,scene,label
1,,GENERAL,30.519417667399999,114.201244513999995,2.000000000000000,30.000000000000000,10141003150524105621504.000000000000000,10141003150524105323600_right_285.jpg,a sign that is on the ground near a tree;a sign that is on the side of a tree;a sign that is on the side of the road;a sign that is on the side of the street;a sign that is on the ground next to a tree,a white bus driving down a street next to a tree ; a road with a car driving down the road ; a parking lot with a large building in the background ; a sign that is on the ground near a tree,4
2,,GENERAL,30.531543734800000,114.236762432000006,2.000000000000000,282.000000000000000,10141003150524153856000.000000000000000,10141003150524154157100_right_287.jpg,a couple of people that are walking around;two people walking on a sidewalk near a fence;a couple of people that are walking on a sidewalk;a couple of people that are walking in a park;a man walking down a sidewalk next to a tree,a street with cars parked on the side of it ; a view of a city street from the sidewalk ; a frisbee on the ground in front of a building ; a couple of people that are walking around,6
3,雪松路,GENERAL,30.594307882300001,114.260217462000000,2.000000000000000,333.000000000000000,10141050150701095714816.000000000000000,10141050150701095028400_right_155.jpg,a white bus parked on the side of a street;a white bus parked on the side of the road;a white bus parked on the side of a road;a small white bus parked on the side of the road;a small white bus parked on the side of the street,a motorcycle parked on the side of a street ; a group of people walking down a sidewalk ; a person walking on a city street near buildings ; a white bus parked on the side of a street,2
4,,GENERAL,30.629257342800003,114.253876968000000,2.000000000000000,305.000000000000000,10141003150426135068672.000000000000000,10141003150426134956900_right_255.jpg,a street scene with a blue and white street sign;a street scene with a blue and white bus and buildings;a street scene with a couple of cars parked on the side;a street scene with a couple of cars parked on the street;a street scene with a couple of cars parked on the side of the road,a red truck parked on the side of the road ; a group of cars parked on a city street ; two buses parked on the side of the road ; a street scene with a blue and white street sign,6
5,江国路,GENERAL,30.502954629700000,114.278915439000002,2.000000000000000,296.000000000000000,10141003150306150711296.000000000000000,10141003150306150200600_right_227.jpg,a blue truck parked in front of a building;a blue truck parked in front of a tall building;a truck parked in front of a building;a large blue truck parked in front of a building;a blue truck parked in front of a house,a group of trucks parked on the side of a road ; a semi truck parked on the side of the road ; a blue truck parked in a parking lot ; a blue truck parked in front of a building,6
6,二七路,GENERAL,30.628989736299999,114.290305615999998,2.000000000000000,185.000000000000000,10141003150612165033984.000000000000000,10141003150612164517900_right_155.jpg,a sign on the side of a city street;a sign that is in the middle of the street;a sign that is in the middle of a street;a sign on the side of a road in a city;a sign on the side of a road in a large city,a view of a street from the side of a road ; a view of a street from inside a train ; a view through a window of a large building ; a sign on the side of a city street,5
7,江达路,GENERAL,30.621410098700000,114.226714967999996,2.000000000000000,233.000000000000000,10141017151004129361920.000000000000000,10141017151004130139500_right_327.jpg,a couple of cars parked on a city street;a couple of cars parked in front of a building;a couple of cars parked on the side of a street;a couple of cars parked on the side of a road;a couple of cars parked on the side of the street,a view of a street with cars and motorcycles ; a red car driving down a city street ; a young girl is walking down the sidewalk ; a couple of cars parked on a city street,1
8,Ｇ１０７,GENERAL,30.587371236300001,114.214444667999999,2.000000000000000,202.000000000000000,10141003150629164548096.000000000000000,10141003150629164118400_right_81.jpg,a street with cars and buildings in the background;a street with cars and people walking on it;a busy intersection with cars and people crossing the street;a city street with cars and people walking under a bridge;a city street with cars and people walking on the street,a bus driving down a street next to tall buildings ; cars are driving on a busy city street ; a bus driving down a street next to tall buildings ; a street with cars and buildings in the background,4
9,洲头五路,GENERAL,30.519814749300000,114.248921679999995,2.000000000000000,292.000000000000000,10141019121209101516800.000000000000000,10141019121209102259900_right_53.jpg,a truck parked in the dirt near a building;a truck parked in the middle of a street;a truck parked in the middle of a city;a truck parked in the middle of a dirt field;a truck parked in the dirt in front of a building,a truck parked on the side of the road ; two trucks are parked on the side of the street ; a street corner with a building in the background ; a truck parked in the dirt near a building,6
10,兴业路,GENERAL,30.637952556199998,114.284952554000000,2.000000000000000,63.000000000000000,10141050150531153002496.000000000000000,10141050150531152034200_right_159.jpg,a blue and white building and a tree;a blue and white building and some trees;a blue and white building and some bushes and trees;a blue and white building and some trees and bushes;a blue and white building and a tree and bushes,a group of cars driving down a street ; a car driving down a city street with tall buildings ; a street with lots of different colored flowers in it ; a blue and white building and a tree,9
11,拦江路,GENERAL,30.546745975699999,114.265775923999996,2.000000000000000,205.000000000000000,10141003150323152322560.000000000000000,10141003150323152423100_right_342.jpg,a group of people standing in front of a store;a group of people standing outside of a store;a group of people standing in front of a building;a group of people standing next to each other;a group of people standing on a sidewalk next to a tree,a city street with buildings on each side ; a white car driving down a city street ; a city street filled with lots of tall buildings ; a group of people standing in front of a store,8
12,汉西一路,GENERAL,30.588047208100001,114.215056179000001,2.000000000000000,269.000000000000000,10141003150331155054592.000000000000000,10141003150331155421600_right_129.jpg,a group of cars parked in front of a store;several cars parked in front of a store;a group of cars parked outside of a store;a group of cars parked in front of a building;a group of cars parked on the side of the road,a couple of cars that are sitting in the street ; a man riding a motorcycle down a city street ; a car driving down a street next to a train track ; a group of cars parked in front of a store,2
13,新火路,GENERAL,30.570721819300001,114.270298259000000,2.000000000000000,255.000000000000000,10141050150708142145536.000000000000000,10141050150708141625300_right_274.jpg,a store front with a large store front;a store front with a lot of windows;a store front with a large store front window;a store front with a man sitting on the floor;a store front with a man sitting on the outside of it,a busy street with many people walking around ; a city street with people walking on the sidewalk ; a wooden bench sitting inside of a building ; a store front with a large store front,6
14,,GENERAL,30.545901028000003,114.336177094000007,2.000000000000000,17.000000000000000,10141006121208142364672.000000000000000,10141006121208142915600_right_288.jpg,a large brick building with a tower in the center;a large brick wall with a tall building next to it;a large brick wall with a tall building in the background;a large brick building with a tower built into it;a large brick wall with a UNK in the center,a car parked on the side of the road ; a couple of people walking down a sidewalk ; graffiti on the side of a building ; a large brick building with a tower in the center,6
15,雪松路,GENERAL,30.594284748200003,114.260124582000003,2.000000000000000,82.000000000000000,10141050150701095714816.000000000000000,10141050150701095027000_right_323.jpg,a large building on the corner of a city street;a large building on the side of the street;a large building on the side of the road;a large building on the side of a street;a large building on the corner of a street,a group of people walking down a city street ; a group of people walking down a street ; a couple of people walking down a street ; a large building on the corner of a city street,6
16,工农兵路,GENERAL,30.620741489000000,114.299784918000000,2.000000000000000,288.000000000000000,10141050150728102838272.000000000000000,10141050150728103345100_right_140.jpg,a green bus parked in front of a building;a green bus parked outside of a building;a large green bus parked in front of a building;a large green bus parked next to a building;a bus parked in front of a building,a city street with tall buildings in the background ; a city street with cars parked on the side ; a row of motorcycles parked outside of a store ; a green bus parked in front of a building,3
17,,GENERAL,30.535435947600003,114.197371500000003,2.000000000000000,281.000000000000000,10141003150426145554432.000000000000000,10141003150426145042900_right_3.jpg,a sign on the side of a city street;a sign on the side of the street;a sign on the side of a building;a sign on the side of the road;a sign on the side of a building advertising UNK,a city street is shown with buildings in the background ; a view of a city from the street ; a small car parked on the side of the road ; a sign on the side of a city street,6
18,石牌岭路,GENERAL,30.522552111800000,114.335532814000004,2.000000000000000,191.000000000000000,10141003150324142178304.000000000000000,10141003150324142139000_right_297.jpg,a street that has a bunch of signs on it;a street that has a bunch of signs in it;a street corner with a building and a tree;a row of buildings with a street sign in front of them;a street corner with a brick wall and a tree,a city street with people walking on the sidewalk ; a bus driving down a street next to tall buildings ; a blue car parked in front of a tall building ; a street that has a bunch of signs on it,4
19,,GENERAL,30.571102207100001,114.203860558000002,2.000000000000000,200.000000000000000,10141050150712143511552.000000000000000,10141050150712143011100_right_300.jpg,a building with a lot of graffiti on it;a building with a lot of writing on it;a building with a lot of graffiti on the wall;a building with a lot of graffiti on the walls;a building with a lot of writing on the wall,a group of cars that are sitting in the street ; a person walking down a sidewalk next to parked cars ; a white car parked in front of a building ; a building with a lot of graffiti on it,6
20,江大路,GENERAL,30.618401337100000,114.292704810999993,2.000000000000000,125.000000000000000,10141058150822112657408.000000000000000,10141058150822112805600_right_213.jpg,a view of a street in front of a store;a street scene with a building and motorcycles;a view of a street in front of a building;a view of a street in front of a business;a view of a street in front of a restaurant,a city street with cars parked on the side ; a red car driving down a street next to tall buildings ; a car parked on the side of the street ; a view of a street in front of a store,8
21,北湖小路,GENERAL,30.605562301100001,114.260194483999996,2.000000000000000,274.000000000000000,10141050150711105421312.000000000000000,10141050150711104802400_right_233.jpg,a couple of red and white signs in front of a store;a couple of red and white signs and a building;a couple of red and white signs sitting in front of a store;a couple of red and white signs and some buildings;a couple of red and white signs in front of a store front,a man sitting on a bench on the sidewalk ; a city street with cars parked on the side ; a couple of cars parked in front of a building ; a couple of red and white signs in front of a store,-1
22,新湾路,GENERAL,30.637296446899999,114.250415257000000,2.000000000000000,249.000000000000000,10141050150618136576000.000000000000000,10141050150618135900300_right_134.jpg,a man riding a bike down a street next to a car;a man riding a bike down a city street;a man riding a bike down a street next to parked cars;a man riding a bike in front of a car;a man riding a bike down a street next to a silver car,a person on a motorcycle on a city street ; two people riding a scooter on a city street ; a silver car parked in front of a building ; a man riding a bike down a street next to a car,2
23,长云路,GENERAL,30.611721644500001,114.178103589000003,2.000000000000000,279.000000000000000,10141022121209110724608.000000000000000,10141022121209111352400_right_216.jpg,a car parked in front of a stone wall;a car parked next to a brick wall;a car parked in front of a stone building;a car parked in front of a brick wall;a silver car parked in front of a brick building,a white van parked in front of a building ; a car parked on the side of the road ; a building with a red roof and a red roof ; a car parked in front of a stone wall,6
24,芳草路,GENERAL,30.527013879300000,114.194447736000001,2.000000000000000,208.000000000000000,10141057150531141632000.000000000000000,10141057150531140757400_right_302.jpg,a person in an orange jacket is walking;a person in an orange jacket walking across a field;a person in an orange jacket walking across a dirt field;a person in an orange jacket is walking down the street;a person in an orange jacket and hat walking on a road,a red car driving down a street next to tall buildings ; a blue and white sign on the side of a road ; a large sign on the side of a road ; a person in an orange jacket is walking,8
25,四新路,GENERAL,30.588198030800001,114.211529756999994,2.000000000000000,23.000000000000000,10141022121209102336000.000000000000000,10141022121209101347100_right_294.jpg,a group of people walking down a street next to tall buildings;a group of people walking down a city street;a group of people walking across a street;a group of people walking down a sidewalk near tall buildings;a group of people walking down a sidewalk next to tall buildings,a group of cars driving under a bridge ; a city street filled with lots of traffic ; a truck parked in front of a building ; a group of people walking down a street next to tall buildings,-1
26,中山大道,GENERAL,30.571635447999999,114.255873421000004,2.000000000000000,255.000000000000000,10141050150708152631296.000000000000000,10141050150708153059900_right_260.jpg,cars driving down the road in a city;cars driving on a road in a city;a city street with cars parked along the side of the road;a city street with cars parked along the side of it;a city street with cars parked on the side,a group of cars that are sitting in the street ; a couple of cars parked in front of a building ; a group of people crossing a busy street ; cars driving down the road in a city,9
27,,GENERAL,30.573011880700001,114.188003535999997,2.000000000000000,148.000000000000000,10141058150713102696448.000000000000000,10141058150713102656400_right_246.jpg,a man standing in front of a store front;a man standing outside of a store front window;a man standing in front of a store front window;there is a man standing outside of a store;a man standing in front of a building next to boxes,a narrow street with a row of buildings ; a view of a street with a bunch of stuff on it ; a large sign on a building on a city street ; a man standing in front of a store front,11
28,东湖路,GENERAL,30.551751324300000,114.339062072000004,2.000000000000000,217.000000000000000,10141058150821110218752.000000000000000,10141058150821110444800_right_331.jpg,a person sitting on a bench under an umbrella;a man sitting on a bench under an umbrella;a man sitting on top of a bench under an umbrella;a man sitting on a bench under an umbrella on a sidewalk;a man sitting on a bench under an umbrella on the sidewalk,a view of a street from the side of a road ; a car driving down a street next to tall buildings ; a couple of people walking down a street ; a person sitting on a bench under an umbrella,-1
29,兴业南路,GENERAL,30.635395873600000,114.284182860000001,2.000000000000000,63.000000000000000,10141050150531104768000.000000000000000,10141050150531103836100_right_342.jpg,a couple of cars parked in front of a building;two cars parked in front of a building;a couple of cars parked on the side of the road;a blue car parked in front of a store;a blue car parked in front of a building,a group of cars driving down a city street ; a city street filled with lots of traffic ; a white building a tree a street and buildings ; a couple of cars parked in front of a building,8
30,顺道街,GENERAL,30.579063879000000,114.268049543999993,2.000000000000000,82.000000000000000,10141035140622109900800.000000000000000,10141035140622110801000_right_342.jpg,a white truck parked next to a building;a white truck driving down a street next to a building;a white truck driving down a street next to tall buildings;a white truck parked in front of a building;a white truck driving down a street next to buildings,a city street filled with lots of traffic ; a city street filled with lots of traffic ; a black car driving down a street next to tall buildings ; a white truck parked next to a building,-1
31,兰陵路,GENERAL,30.588287946200001,114.294009897999999,2.000000000000000,259.000000000000000,10141035140613100535808.000000000000000,10141035140613100258900_right_135.jpg,a group of people walking down a street;a group of people walking down a city street;a group of people walking down a city sidewalk;a group of people walking down a street next to tall buildings;a group of people walking down a street next to buildings,a person standing in front of a store window ; a van parked in front of a tall building ; a couple of cars that are sitting in the street ; a group of people walking down a street,6
32,首义路,GENERAL,30.538305845400000,114.303939784999997,2.000000000000000,330.000000000000000,10141003150323135545344.000000000000000,10141003150323135025800_right_353.jpg,a person riding a motorcycle down a city street;a person riding a scooter on a city street;a person is riding a scooter down the street;a person riding a scooter down a street;a person is riding a scooter down a street,a group of people walking down a sidewalk ; a white car driving down a street next to tall buildings ; a group of people that are standing in the street ; a person riding a motorcycle down a city street,2
33,,GENERAL,30.550080956599999,114.309803211000002,2.000000000000000,265.000000000000000,10141206130122104504320.000000000000000,10141206130122105136500_right_206.jpg,there is a window on the side of the building;there is a window on the side of a building;there is a window with bars on it;there is a window on the side of the house;there is a window on the side of a house,a couple of cars parked in front of a building ; a narrow city street with a large building ; a white car parked next to a building ; there is a window on the side of the building,6
34,紫湖村,GENERAL,30.531568191700000,114.296660008000003,2.000000000000000,298.000000000000000,10141006121203153240064.000000000000000,10141006121203152404400_right_64.jpg,a store front with a lot of food in it;a store front with a lot of items inside of it;a store front with a lot of food inside of it;a store front with a lot of items on the wall;a store front with a lot of food on the wall,a person sitting on a bench on the sidewalk ; a row of buildings on a city street ; a view of a building from a window ; a store front with a lot of food in it,6
35,粮道街,GENERAL,30.549054989700000,114.309724459999998,2.000000000000000,258.000000000000000,10141035140714101473280.000000000000000,10141035140714100739500_right_29.jpg,a white car parked in front of a store;a car parked in front of a store;a white car parked outside of a store;a white car parked in front of a building;a white car parked in front of a store front,a man riding a motorcycle down a city street ; a group of people walking down a city street ; a bike parked next to a tree on a sidewalk ; a white car parked in front of a store,2
36,古萧路,GENERAL,30.599763140699999,114.201188024999993,2.000000000000000,125.000000000000000,10141022121209133793280.000000000000000,10141022121209134425200_right_45.jpg,a blue truck parked in front of a building;a blue truck parked in front of a brick building;a blue truck parked on the side of a road;a blue truck parked on the side of the road;a blue truck parked on the side of a street,a row of buildings with graffiti on them ; an alley with a person walking down the street ; a city street with a building and parked cars ; an alley with a few buildings and people ; a brick building with a window and a door ; a pile of trash sitting in the middle of a street ; a wall with a bunch of signs on it ; a blue truck parked in front of a building,6
37,洲头二路,GENERAL,30.526529789200001,114.249384749000001,2.000000000000000,283.000000000000000,10141058150729131229184.000000000000000,10141058150729131653100_right_44.jpg,a couple of cars parked in front of a fence;a car parked in front of a fence;two cars parked in front of a fence;a silver car parked in front of a fence;a couple of cars parked in front of a building,a city street filled with lots of traffic ; a group of cars parked on the side of the street ; a store front window with a box of food in front of it ; a couple of cars parked in front of a fence,6
38,,GENERAL,30.629177127100000,114.253908064000001,2.000000000000000,200.000000000000000,10141003150426135068672.000000000000000,10141003150426134958600_right_85.jpg,a car parked on the side of the road;a car parked on the side of the street;a car parked on the side of a street;a car parked in front of a store on the street;a car parked in front of a store on a city street,a city street filled with lots of traffic ; a truck parked on the side of the road ; a group of cars parked in front of a store ; a car parked on the side of the road,6
39,汉西三路,GENERAL,30.602672165600001,114.214937011000004,2.000000000000000,324.000000000000000,10141103150611161939968.000000000000000,10141103150611161835000_right_239.jpg,a white van parked in front of a store;a white van parked on the side of a street;a white van parked on the side of the road;a white truck parked on the side of a street;a white van parked on the side of a road,a car parked on the side of the road ; a street scene with cars and people on bicycles ; a white truck driving down a street next to tall buildings ; a white van parked in front of a store,8
40,,GENERAL,30.581519996899999,114.217639039999995,2.000000000000000,236.000000000000000,10141022130105112068096.000000000000000,10141022130105111509900_right_294.jpg,a view of a city skyline from a bridge;a view of a city skyline from across a bridge;a view of a city skyline from across the city;a view of a city skyline from across the water;a view of a city skyline with a bridge in the background,a street sign on a bridge with buildings in the background ; a view of a city street from a vehicle ; a view of a building from the street ; a view of a city skyline from a bridge,6
41,,GENERAL,30.552255537000001,114.201846395999993,2.000000000000000,184.000000000000000,10141058150721105428480.000000000000000,10141058150721104524700_right_32.jpg,a brick building with a tree in front of it;a large brick building behind a metal fence;a large brick building behind a metal gate;a brick building with a tree in front of the building;a large building with a window and a tree,an empty street with a building in the background ; a narrow street in the middle of a city ; a concrete wall in the middle of a city ; a brick building with a tree in front of it,0
42,京汉大道,GENERAL,30.576134328500000,114.255328929000001,2.000000000000000,53.000000000000000,10141003150612104216576.000000000000000,10141003150612105214900_right_102.jpg,a group of cars parked on a city street;a group of cars parked on the side of the street;a group of cars parked on the side of a road;a group of cars parked on the side of the road;a group of cars parked on the side of a street,a city street filled with traffic and tall buildings ; a view of the side walk of a city street ; a person on a motorcycle on a city street ; a group of cars parked on a city street,2
43,,GENERAL,30.627774776700001,114.244794786000000,2.000000000000000,241.000000000000000,10141019131231116197888.000000000000000,10141019131231115343700_right_73.jpg,a bunch of boxes sitting on the side of a road;a bunch of boxes that are outside of a building;a bunch of boxes sitting on the side of a street;a bunch of boxes that are outside of a store;a bunch of boxes on the side of the street,a group of cars parked on the side of a road ; a group of buses parked in front of a building ; a man walking down a street past tall buildings ; a bunch of boxes sitting on the side of a road,11
